,Unnamed: 0,Unnamed: 0.1,Unnamed: 0.1.1,PUBLISHEDDATE,ARTICLEURL,TEXT,COMMODITY
69,69.0,,,2020-04-09,https://www.thehindu.com/life-and-style/homes-and-gardens/grow-your-own-vegetables-in-a-home-greening-challenge/article31298308.ece,"A WhatsApp Collective challenges people to begin planting their own greens: in gardens, balconies and even small kitchen counters  Tis the season of challenges  whether youre suddenly pulling out your silks for the sari challenge, or resting your aching muscles after finally acing dalgona coffee for Instagram.  Ready for one more? A Whatsapp collective in Kerala that calls itself The Marasena (The Tree Army) has called for a vegetable challenge that urges people to grow their own greens. For a State such as Kerala, which is hugely dependent on Tamil Nadu and Karnataka for its vegetables, the lockdown is an opportunity to become self-reliant, say the administrators of this 80-member strong group, with participants from all over the State.  To take part, you have to plant the seeds of different vegetables once every three days and post pictures of their progress on the group. The challenge is open to the general public as well. Those who live in independent homes and have a bit of land can take it on easily, says Jayaraj Mitra, an active members of the group. He adds, Every household can grow one drumstick plant, one curry leaf plant and one coriander plant at least.  Lockdown and children  He adds that this lockdown is a time when children can be inducted into the many joys of farming. ""Not just can they see the seed germinating into a plant, they also learn about soil, creatures that live in it and more, he says, adding, The larger message we are trying to send out is that with a little time and patience, one can grow ones own food.  For apartment dwellers who have just a balcony to spare, kitchen gardens are a workable model. You do not need to go rushing out for seeds: green gram and horse gram can be sprouted, and the method does not require soil. Just wrap the grain moist biodegradable paper. (Newspaper is not a great option, as it has printing ink.) In about a week, the leaves would have grown long enough to be cut. They can be used to make a salad or even a thoran (coconut stir-fry). This method takes up little space and is highly efficient. More importantly, it qualifies you for the challenge so you can also take plenty of pictures of your new kitchen counter sprout patch.  The Marasena hopes this challenge will inspire a network of home vegetable growers, who will continue to grow at least some of their own food post lockdown.  How the group was formed  The group traces its roots to an art lovers collective that dabbled in making films too, got actively involved in tree planting initiatives. The idea came about when in the middle of shooting a short film in Thrissur, the host offered the team raw mango juice, made with fruit from his compound. The conversation veered towards planting seeds for future trees. Led by former head of the department of English of NSS College, Ottappalam, Govindan Kutty Kartha and announcer at All India Radio, Thrissur, M Thankamani, the foundations of The Marasena were thus laid.  Tree challenge A school in Edavanakkad, Vypeen, has started a tree challenge. Mooted by the Student Police Cadet (SPC) wing of Sree Dharma Paripalana Yogam Kumara Panicker Memorial High School for its students, the challenge has received an enthusiastic response from the public in general, says KG Harikumar, a Math teacher and one of the co-ordinators of the SPC.  The challenge urges people to plant tree saplings and mail a picture to the school. Students are not regularly posting pictures. This is being done as part of the State-wide tree planting campaign carried out by the SPC. And we thought why not reach out to the public, we have been receiving pictures from older people as well, Harikumar says. He adds, Of all the trees you see around you, how many have you planted? This is what we ask as part of the campaign. If you have planted none, this is your chance.  Invigorated by the idea of planting trees, the members of the group joined hands with the Pookottukavu Panchayat in Palakkad (about 340 km from capital city, Thiruvananthapuram) and planted about one lakh seeds in the Panchayat. The seeds were those collected by the members of the group from different parts of the State. The team then had over 2,000 volunteers from across Kerala.  However, a year later, the group scaled down operations and decided to move over to an online space (Whatsapp). Today, with the core team of 80 members, the The Marasena is a veritable storehouse of information on plants, including technical know-how and maintenance. The group admins plan to compile the information into a book. The ultimate aim is to have an Onasadya with vegetables grown at home, says Jayaraj.",GREEN GRAM DAL (MOONG DAL)
70,70.0,,,2020-04-11,https://www.thehindu.com/news/national/summer-rice-crop-covers-more-area-than-the-previous-year-says-ministry/article31319200.ece,"Pulses also see significant increase in early sowing despite lockdown limitations  Early sowing of the summer rice crop has covered 37% more area than the same time the previous year, despite the COVID-19 lockdown limitations, the Agriculture Ministry data shows. This is the pre-monsoon sowing of paddy, with the major kharif crop sowing to be done after the rains begin in June.  Also read | PM Modi indicates a 14-day extension of nationwide lockdown  Overall sowing of summer crops including rice, pulses, coarse cereals and oil seeds is about 31% higher than usual. In total, 48.8 lakh hectares have been sown so far.  The Centre has exempted agricultural activity from the lockdown restrictions and has also taken steps to ensure availability of fertilizers and pesticides for the coming season.  So far, more than 32 lakh hectares of rice have been sown across the country, mostly in eastern India, including 11.3 lakh hectares in West Bengal, 7.5 lakh hectares in Telangana, 3 lakh hectares in Odisha and 2.7 lakh hectares in Assam. This is more than a third higher than the 23.8 lakh hectares sown with rice during the same period last year.  Pulses have also seen a significant increase in early sowing, with more acreage covered in green gram and black gram. Overall, there was a 32% jump from about 3 lakh hectares to 4 lakh hectares.  The growth in oilseeds is more modest with a 12% increase in sowing area to 6.7 lakh hectares. Most of the hike comes from more land sown with groundnuts.  Among coarse cereals, more maize and bajra have been sown than in the previous year resulting in a 27% jump to 5.6 lakh hectares under cultivation.",GREEN GRAM DAL (MOONG DAL)
71,71.0,,,2020-04-12,https://indianexpress.com/article/opinion/editorials/coronavirus-india-lockdown-extended-exit-strategy-farmers-transport-6359519/,"The challenge is going to be with the crops marketing. (File Photo/Representational) The challenge is going to be with the crops marketing. (File Photo/Representational)  Even as the 21-day lockdown till April 14 appears set to be extended by two weeks, both the Centre and the states are agreed that the blanket restrictions on production and movement will not apply to farm-related work. Agriculture would, indeed, be the most significant, if not the only, economic activity the country might see at least till the end of this month. The governments focus, too, will now have to be as much on the rabi crops harvesting and marketing as on keeping the war against the novel coronavirus going. But harvesting per se is unlikely to be a problem. The bulk of the mustard, chana (chickpea), masur (red lentil), sugarcane, potato and rabi onions have already been harvested. Its only wheat and some seasonal vegetables (the likes of bottle gourd, okra, brinjal and cucumber) and fruit (mango and melons) that are still in the fields. Harvesting of rabi maize, summer moong (green gram) or even Dasheri, Chaunsa and Langra mangoes will only be after May.  Simply put, harvesting will happen. Farmers will somehow manage, whether by using combines (whose movement and deployment, both inter- and intra-state, has been exempted from the lockdown) or labour (including those forced to return to villages after being rendered jobless in factories and urban centres). The challenge is going to be with the crops marketing. There are two major issues here. The first is the mandis, which are normally a hive of activity at this time, when farmers in thousands bring their trolley-loads of produce to sell. Given the imperative of social distancing, that is ruled out today. Even if farmers were to come, there arent enough labourers in wholesale markets predominantly from states such as Bihar and Uttar Pradesh, who have fled back home  to unload, clean, bag and reload their crop. The second issue is the collapse of demand. With hotels, restaurants, caterers and most agro-processing units shut, the market cannot absorb a bumper crop  a situation similar to that during April-June 2017 post demonetisation. Then, it was lack of cash. Now, it is lack of institutional buyers.  What is the way out? If overcrowding at the mandis is not to be allowed, farmers have to be given some incentive for not bringing their entire harvested crop straight from the field. There is a strong case to give, say, a bonus of Rs 50 over the minimum support price of Rs 1,925 per quintal for wheat that is sold after April 30 and Rs 100 if after May 30. Not only will this enable staggered crop arrivals, there would also be interest savings for the Food Corporation of India through reduced drawdown of cash credit limits. This is also the time for the Narendra Modi government to enact an omnibus law to remove all restrictions on sale, stocking, movement and export of farm produce. Coronavirus can do for agriculture what 1991 did for industry and services.",GREEN GRAM DAL (MOONG DAL)
72,72.0,,,2020-04-12,https://indianexpress.com/article/india/harvester-combines-stubble-burning-farmers-marketing-india-lockdown-6359720/,"Harvesting in progress in Chandauli, UP. (Express photo) Harvesting in progress in Chandauli, UP. (Express photo)  In early November, the district administration of Chandauli in eastern Uttar Pradesh banned harvester combines, citing a state government order to prevent burning of parali (leftover straw) from the paddy cut by these machines. Panic-stricken farmers approached the district magistrate, who relented after obtaining an assurance that they would not burn any standing stubble after machine-harvesting. The permission came late: Paddy harvesting could start only by early-December, against the normal time from mid-November. And with heavy rains in December 11-13, the crop also suffered extensive damage and grain discolouration. COVID-19 LIVE updates  Now in April, as Chandaulis farmers harvest wheat amid the lockdown, parali and air pollution is hardly an administrative priority. Harvesting wont be a problem. My district alone has over 100 combines, with an equal number coming from outside. We have some 230,000 acres under wheat, nearly three-fourths of which is combine-harvested and the rest manually using sickles. Each machine can do 35-40 acres over 18 hours daily, says Ajay Kumar Singh. The 42-year-old farmer from Emiliya village in Chandauli district and tehsil has planted wheat on 40 acres and summer moong (green gram) on 12 acres, which will be harvested from May.  Dont miss from Expained: 3 hotspots, 3 control models  Singhs worry isnt over harvesting. The authorities have issued passes for the combines and their operators  typically one foreman, two drivers and two helpers. The grain will get cut, but we dont know how it would be marketed. Wheat procurement is usually from around April 10. This time, it may not be before May, he points out.  Echoing the same concern is Rao Gulab Singh Lodhi from Nanhegaon village in Gotegaon tehsil of Madhya Pradeshs Narsinghpur district. He began harvesting his 36 acres of wheat in Wednesday, after having finished with chana (chickpea) and masur (red lentil) on 8 acres each in early March.  Read | In Dharavi: 8.5 lakh people holed up in 2.4 sq km  My chana and masur is harvested, cleaned and graded for quality. But I cannot sell, as the APMC (agricultural produce market committee) mandi at Karakbel is closed and theres nobody to buy, notes Lodhi. While procurement in MP is slated to start from April 15  a delay of over 15 days  he isnt sure if that would help.  The government has declared that it will not purchase more than 13 quintals per acre of wheat from any farmer, with these at 5 quintals each for chana and masur. My own average per-acre yield is 20 quintals in wheat, 12 quintals in masur and 10 quintals in chana. What do I do with the remaining crop, for which there are no takers today? They wants us to increase productivity, but are unwilling to procure our extra grain, adds Lodhi.  Read | Slight but noticeable flattening of growth curve in India  The story isnt different in onions, where around 30 labourers are required to harvest one acre in a single day. For Santosh Gorade, a farmer from Takli Vinchur village in Niphad taluka of Maharashtras Nashik district, that isnt an issue: There are enough labourers in my village. Although the ones in nearby villages may not be able to come due to the lockdown, I can stagger my harvesting.  Gorade plans to harvest his rabi onion on two out of his total 6-acre holding after April 20. Eknath Sanap, from Naigaon village in Nashiks Sinnar taluka, harvested 200 quintals from 1.5 out of his 3 acres last week. He did not find it difficult to get labour, which is largely local.  Dont miss from Explained: How a dollar swap line with US Fed can help in uncertain times  For both farmers, the primary concern is marketing. Rabi onions are amenable to storage in kanda chawls. Farmers generally keep the crop harvested in March-April in these on-field raised platform structures (to prevent moisture ingress that cause the bulbs to sprout) and sell in tranches till September-October. Yes, I can take it to the market later. But what if after lockdown, everybody rushes to sell and the prices crash?, asks Sanap.  Currently, the APMC mandis of Lasalgaon and Pimpalgaon in Nashik are functioning with skeletal staff. Unlike in farms, the labourers at these two big wholesale onion markets  those who unload, clean, bag and reload produce  are mostly from UP and Bihar, who have gone back due to the lockdown.  Read | Provide counselling to migrants: Centre to states  Availability of labour for farm work doesnt seem a constraint even in sugarcane. According to Jitender Singh Hooda, an 8-acre farmer from Kheri Bairagi village of western UPs Shamli district and tehsil, a skilled labourer can harvest, bundle and load 12-14 quintals of cane daily, for which he charges Rs 45/quintal. Four of them can, thus, deliver a full tractor trolley-load of 55-56 quintals for just over Rs 2,500.  The same job  of only harvesting and bundling 12-14 quintals  can also be done by three unskilled labourers. At a daily wage rate of Rs 350, it works out to Rs 4,200 for 56 quintals, plus another Rs 800 for loading on to the farmers trolley. Theres no dearth of labour now, especially the people who have lost their jobs after lockdown. But they have little experience in cane cultivation, explains Hooda.  Read | Three weeks and counting: Stranded and hungry at shut gateway  Hoodas present workforce includes Rakesh, a ladies tailor; Vinod, an electrician; Manoj, a construction labourer; and Krishan Pal, a mender of old jute bags  all previously working in Shamli, Karnal and nearby towns. Technically more skilled than farm hands, they are now being engaged for sugarcane planting as well. Hooda estimates the cost of planting one acre using skilled workers at Rs 4,200. The same with the new less productive persons comes to Rs 6,000 or so, but at least my work gets done.  That harvesting labour isnt a major issue is also borne out by sugar mills in UP crushing 932.08 lakh tonnes (lt) of cane during the current 2019-20 season till Friday. Over 100 lt out of this has been after the lockdown from March 25. Nearly 85% of the seasons projected crushing of 1,100 lt is over. Mills will continue to crush beyond May-end, UPs cane commissioner Sanjay Bhoosreddy told The Indian Express.  Read | In March, people hoarded cash, withdrew four times more than monthly average  For cane growers, the main problem again is in getting money. They have so far supplied cane worth more than Rs 29,800 crore at the UP governments advised price, but received only Rs 15,581 crore. Mills are unable to pay, as there is little offtake of sugar by industrial buyers or of ethanol by oil companies for blending with petrol.",GREEN GRAM DAL (MOONG DAL)
73,73.0,,,2020-04-12,https://www.newindianexpress.com/nation/2020/apr/12/pregnant-lactating-women-children-malnourished-during-lockdown-pucl-2129198.html,"Ranjani Madhavan By  Express News Service  A rapid assessment by People's Union for Civil Liberties released on Sunday has found disheartening results on the state of food and nutrition provided by Karnataka government through anganwadis, mid-day meals scheme and Public Distribution System shops.  Of the 80 villages/localities, anganwadi centres in 10 areas have not yet provided rations for children between the ages of 0-6 years, during the Corona lockdown. In 70% of the cases, eggs have not been provided and 43.75% of the cases milk has not been provided to children. This report has been submitted to the High Court of Karnataka.  Only 75% of pregnant and lactating women received ration from anganwadis but not the entire quantity. Only 13.75% percent of adolescent girls who suffer from malnutrition get ration from Anganwadis.  Significantly, 73.75% of respondents had not received the Iron/Folic Acid tablets that must be given to pregnant women to counter anemia and safeguard the health of pregnant woman.  Delivery of rations to students under the mid-day meal scheme appeared to be more operational, with only 9 of the 80 surveyed areas reporting that rations through mid day meal schemes were not provided.  ""While the food schemes themselves are functional and most people have received some sort of ration, it is not complete and importantly it will not last till the end of any extended lockdown. The worrying part is children who are malnourished have not got the additional nutrition they need. Karnatakas children already face a huge malnutrition problem. It may become worse because of the lockdown,"" the report stated.  Prof. Y J Rajendra, President, PUCL Karnataka told TNIE,""There is a Supreme Court and Government of India order that you cannot stop food and nutrition services during the lockdown but this has not been complied with by the Education department which handles the mid-day meal scheme and Women and Child Development department which handles nutrition through anganwadis. Food security of the vulnerable has been ignored during this lockdown due to lack of will.""    Disparity in quantity of food and nutrition  There is wide disparity in the quantities provided by Anganwadis ranging from 480 grams rice only in some districts to comprehensive packages of 4.17 kg of nutritional mix of ragi, rice and green gram in other districts, 70 grams milk powder being given in some areas and 500 grams in other area, 1 kg rice and 200 gram dal for pregnant and lactating women in some areas to comprehensive nutritional packages comprising 5.7 kg rice, 228 gram jaggery, 232 grams groundnut, 380 grams tur dal, 190 gram green gram, 380 gram sugarin other areas. In mid-day meals scheme, it was found that some places received 1 kg rice and others 3 kg of rice.    PDS shops demand Aadhar, OTP  In PDS shops, only rice and wheat is distrbuted and not Dal. In 10 cases, shops were not open and in 5 cases they were open but not providing ration.  ""Ration shop owners insisted on Aadhaar and OTP verification even though government said it is not mandatory. Ration cardholders are required to get an OTP by calling the IVRS line, which would be given to the ration shop owner who would then enter it into the in his point of sale (POS) system to give the ration to the cardholder. Persons without mobile phones as also those unable to get OTP due to server problems, bad networks are turned away from the ration shop,"" the report stated.  ""Ration Shop owners force people to pay for the free ration. There is a clamour at almost all ration shops, since people are anxious to get ration resulting in social distancing norms not being followed. People are highly frustrated since except for using the phone to approach authorities and elected representatives, they have no other avenue left and are concerned about the next meal they will receive,"" it added It was complained that some shops mandatarily sold jeera, soap and oil and shop owners would create problems for those people who did not purchase them.",GREEN GRAM DAL (MOONG DAL)
