,Unnamed: 0,Unnamed: 0.1,Unnamed: 0.1.1,PUBLISHEDDATE,ARTICLEURL,TEXT,COMMODITY
127,127.0,,,2020-08-24,https://www.newindianexpress.com/states/andhra-pradesh/2020/aug/24/andhra-padresh-ryots-keep-their-fingers-crossed-as-rivers-continue-to-be-in-spate-2187477.html,"S Guru Srikanth ByExpress News ServiceVIJAYAWADA: Farmers of Krishna and Guntur districts who cultivate different crops in their land holdings along the course of the river now have their fingers crossed with a surge in flood levels in the river. At present, the flood levels hover between 3 lakh and 3.5 lakh cusecs and there has been no significant crop damage on both the banks of the Krishna river.However, they are worried as they will suffer losses if the flood levels cross the 5 lakh cusecs mark, and pray that it wont happen. Last year, they were at the receiving end of the flood fury in the Krishna river.Several farmers, particularly those who cultivated cotton, maize, vegetables and turmeric, had suffered losses last year. Most of the losses were reported downstream Prakasam barrage. Now, we hope the floods recede in 2-3 days and if the water level increases further, standing crops may be affected, explained M Vijaya Bharathi, agriculture joint director in Guntur district.According to her, as of today, no crop damage has been reported and a few acres of maize cultivated in the river islands downstream Prakasam Barrage has suffered some damage. If the flood continues, the cotton cultivated upstream the barrage along the river course might be affected.Similar situation prevails in Krishna district and there has been no reports of any horticulture corp damage either in delta or in uplands of the district.In fact, officials felt that the flood levels at the current discharge rate might prove beneficial, if they do not continue for more than three days. It will be helpful for the paddy cultivated in the delta mandals and increase the ground-water levels.As per the preliminary corp damage report due to rains and floods in August till date submitted to the district collector, standing crop in 4,003 hectares was affected. Green gram in 2,448 hectares, which was at harvesting stage, was affected, followed by paddy in 919 hectares, cotton in 474 hectares, black gram in 135 hectares, groundnut in 12 hectares, chillies in 10 heaters and maize in 5 hectares.Though there has been no flood damage reported in Kurnool district, where heavy inflows in both Krishna and Tungabhadra river were reported, continuous rains since last 10 days have proven fatal for maize crop in Atmakur, Pamulapadu, Kotapalle and Nandikotkur areas of the district. According to the district Agriculture joint director, maize in 6,711 hectares suffered damage due to waterlogging induced stem rot. Farmers are now removing the crop from the fields to use it as fodder and replacing it with black gram. Heavy rains also affected cotton crops in 4,793 hectares and farmers hope that they will at least get single picking. Groundnut in around 1,100 hectares was also affected due to heavy rains.Meanwhile, heavy floods in Godavari has inundated paddy crops in 2,400 hectares in the delta region of West Godavari district while around 250 hectares in Polavaram mandal was affected. Cotton cultivated in 40 hectares in Polavaram, Veleripad area was affected. Officials said the real extent of the crop damage can only be known after enumeration, which will be taken up as soon as the floods recede.In East Godavari district, paddy crop in 3,163 hectares in 101 villages of 23 mandals, which was at tillering stage, was inundated. Six hundred hectares in Mummidivaram and 300 hectares in Sitanagaram mandals were inundated. Cotton cultivated in 255 hectares of 25 villages in three mandals  Nelipaka, Kunavaram and Seetanagaram  suffered inundation. Maize cultivated in 255 hectares in Seethanagaram mandal was affected.According to experts, the crop damage due to floods in the State so far is very marginal, thanks to the absence of rains and floods at the same time. In fact, the floods were due to the heavy rains in upper catchment areas.",GREEN GRAM DAL (MOONG DAL)
128,128.0,,,2020-08-27,https://timesofindia.indiatimes.com/city/ahmedabad/gujarat-farsan-infusion-saves-business-from-covid-19-sickness/articleshow/77775278.cms,"Gaurav Chudasama (left) and Priyam Kapadia have launched House of FarsanPeople want their favourite farsanAHMEDABAD: The Covid pandemic has depressed demand for most products, but Gujarat businesspersons have found an FMCG formula:  farsan moves in corona gloom.Gujaratis addiction to farsan and namkeen is legendary. The appetite, evidently, has not gone into a recession despite the havoc caused by the virus. For many in the state, mornings still begin with khakhra and chai. As the day progresses, the snack platter loads up with crunchy profusion: fafda, ganthiya, chavanu, chevdo, and fulwadi.No wonder then that the distressed businesspersons of Gujarat are hoping to endure in the crisis by banking on a service needed now more than ever: the home delivery of comfort food!Priyam Kapadia, 29, the owner of a successful event management company , recently launched a startup, House of Farsan, with his childhood friend Gaurang Chudasama. Gaurangs family runs a bandhani and wedding sari business.Kapadia said the post-Covid forecast is grim for his 10-yearold company which has had to its credit 300-plus high-profile weddings and corporate events. In Chudasamas case, the sales of heavy saris have dropped as people scale down weddings in the new normal.But all through the lockdown, food  especially farsan  was a source of major solace for Gujarati families, said Kapadia. We launched our startup by sourcing the choicest farsan and namkeen from popular brands all over Gujarat and delivering them to peoples homes.Chudasama said that the startup offers khakhra, puri, and kachori. Besides, we have aggregated the famed moong from Bhadran, ganthiya from Surendranagar and Bhavnagar, and peanuts from Bharuch, Chudasama said. He said bulk orders are coming in from NRIs for khakhra, and for sweets such as mohan thal, kaju katli and Surats khajali.Paurav Shah, a tours and travel operator, has ventured into the farsan territory as well.My reading is that tours and travel business will not recover in the next one-and-a-half years, Shah said. I am marketing healthy farsan such as khakhra made of jav, juvar, ragi, oats, and multi-grains. He said that immunity-boosting drinks such as lal bhinda nu sharbat is also a part of his portfolio. He set up Aroma Gruh Udyog in Navrangpura on August 10.Jay Mehta, 28, an International English Language Testing System (IELTS) teacher lost his job in Covid-triggered retrenchment. From teaching the English tongue, he has moved on to providing what pleases the Gujarati palate. As people cannot travel, they desperately want their favourite farsan, Mehta said. Among the popular items are Nadiads bhusu and Vadodaras lilo chevdo. I forayed into this business as people love their snacks. Mehta recently launched his startup, Eatzy. Minal Sheth, who runs a jewellery shop in Satellite, now sources handmade farsan from Palitana. The savouries are sold alongside ornaments. Because of Covid, business comes only from old customers, Sheth said.",GREEN GRAM DAL (MOONG DAL)
129,129.0,,,2020-08-29,https://www.hindustantimes.com/celebrations/happy-onam-no-athapookalam-competition-elaborate-sadhya-for-keralites-in-delhi-ncr/story-Vr8X3OzbvLeYaEuPC0cE1J.html,"celebrationsUpdated: Aug 29, 2020 20:36 ISTCome Onam and we immediately visualise vibrant rangolis made with fresh fragrant flowers, ethnic, festive attires largely in the shades of white and golden, cultural performances to the rhythmic beats of traditional instruments, and a whole lot of festive cheer. But in a world struck by a pandemic, festivities, as in the case of most other occasions, are subdued.Onam is celebrated to commemorate King Mahabali, who is said to visit Kerala during this time. And every year, the Delhi Malayalee Association (DMA), a socio-cultural organisation that brings Keralites across Delhi-NCR together under one roof, has elaborate plans to ring in this harvest festival. Celebrations last for nearly three months, interspersed with cultural and religious activities. However, this time around, gatherings have been restricted to peoples homes, the stage to perform is now a webinar, and the applause that reverberates through an auditorium will now take a digital turn.READ: Happy Onam 2020: All you need to know about the 10 days of celebrationEvery year, on Onam, we conduct lavish celebrations on a large scale at an auditorium or stadium in the Capital. A week before Onam, we organise athapookalam (rangoli) competitions, in which several people across the National Capital Region participate with gusto. This year, we didnt feel it was right to hold such a large celebration, as the world is in a crisis. Having said that, we will hold a small programme online on August 30 evening, wherein short performances will take place, says C Chandran, general secretary, DMA, who affirms that although we are going through tough times, we cannot let it overcome festive spirit. This is being done more to boost the morale of people, rather than as a means of celebration, he adds.Onam celebrations were held at Delhis Siri Fort Auditorium last year.Every year, children who excel at academics are felicitated as part of celebrations. The association will continue with this tradition this year as well, only this time, it will be an online affair. We should not disappoint the kids, insists Chandran.The association is also getting together to help those in need, both financially and otherwise. We are all away from home (Kerala), but the reason we are continuing this is because we should not forget out culture. We need to teach our younger generations all about our culture and traditions, so we are seeing this (online celebration) as an opportunity to help our future generations stay rooted, he adds.And how can celebrations be complete without a quintessential feast or an Onam Sadhya, comprising a range of delectable dishes  both sweets and savories  that are a treat to the eyes and the palate. So, if you are also planning to celebrate at home, here are some lip-smacking recipes you could try out to revel in festivities.Puli InjiTo make this sweet and sour chutney-like culinary treat, you will need  cup ginger (finely chopped), 3tsp tamarind paste or 250g tamarind pulp, 100g green chilli (finely chopped),  tsp turmeric powder,  tsp red chilli powder,  tsp mustard seeds, 5 small onions (finely chopped; optional), 2-3 dry red chillies (broken),  cup jaggery, 2 sprigs curry leaves, 3tbsp coconut oil,1 cups water, salt to tasteMethod: Soak the tamarind in a cup of hot water for about 10-15 minutes. Then, squeeze the tamarind to extract the juice and filter it to get the extract. Else, dilute the tamarind paste in water. Set aside. Heat coconut oil in a kadai and fry the ginger until its brown. Remove the fried ginger, place it on a tissue paper and keep it aside to remove the oil from it. Grind the fried ginger to get it finely crushed.Next, take a kadai or an earthen pot (manchatti), pour the tamarind juice, add salt, chilli powder, turmeric powder and combine well. Bring it to a boil, reduce the flame to low and cook for 10 minutes, so that the gravy gets thick. Add one cup of hot water with jaggery and mix well, filter it and keep that aside.Heat oil in a pan, add mustard seeds. When they splutter, add chopped onions, dry red chilli, chopped green chilli and curry leaves and saute till its brown in colour. Pour this onto the cooked mixture. Add the crushed ginger and jaggery water, reduce the flame and allow the mixture to boil until it is thick, pulpy and reduced by half. Cool and transfer into a sterilised jar or bottle and leave it to settle for an hour or so. Your dish is ready!Beans ThoranA stir fry of sorts, this is an essential part of a sadhya. For this, you will need 1tbsp coconut oil,  tsp mustard seeds,  tsp cumin seeds, 6-7 pearls of sambar onions or shallots, 3-4 small or medium-sized garlic cloves (finely chopped), 1 green chilli (chopped), 10-11 curry leaves,  tsp turmeric powder, 250g french beans,  cup grated fresh coconut, 1/3 cup water or as requiredMethod: Rinse 250g of beans a couple of times and drain all the water. Discard the ends of the beans and finely chop. Next, heat coconut oil in a heavy pan or kadai. Add mustard seeds, and when it begins to crackle, add cumin seeds and let them crackle. Next, add in the sambar onions or shallots which have been chopped. You can even use finely chopped onions instead. Mix well and saut onions on a low flame, till they turn translucent. To this, add finely chopped garlic, green chilli, curry leaves, followed by turmeric powder and mix well.Now, add the finely chopped beans and stir. Add cup fresh grated coconut, season with salt as per taste and mix it well. Sprinkle about four tablespoons of water first and stir. Cover and cook the thoran on a low flame. Check after 3-4 minutes. If water has dried up, sprinkle some more water. Mix well and continue to cover and cook. Add water in parts, as and when required. Cook till the beans are completely cooked. If there is any water in the pan, cook without the lid till the water evaporates.Serve beans thoran with some steamed rice or a vegetable side dish. If you want, you can also garnish with some coriander leaves.Recipes by home chef Suja RajendranPayasamFor this traditional sweet dish, you will need  cup moong dal (soaked and drained), ghee, 1 cup water, 1 cup coconut milk,  cup jaggery, a pinch of salt, 1tsp cardamom powder,  cup cashew nutsMethod: Heat jaggery in a pan along with 2 tablespoons of water and let the jaggery melt. Once it melts completely, strain it and keep warm till used. Next, heat ghee in a pot, roast the moong dal until it slightly changes in colour and becomes aromatic. Now, add water and coconut milk and mix. Keep stirring the dal and let it cook completely. Once done, mash it using the back side of a ladle. Lower the flame and pour in the prepared jaggery syrup. Whisk continuously while pouring. Bring this mixture to a boil. Then, add in salt and cardamom powder and mix well. Let it cook for 5 minutes more, and turn off the flame.Add ghee and cover with a lid. Let it rest for 5-7 minutes. Mix and serve warm, garnished with roasted cashew nuts.Recipe by chef Ranveer BrarAuthor tweets @srinidhi_gkFor more stories follow Facebook and Twitter",GREEN GRAM DAL (MOONG DAL)
130,130.0,,,2020-08-30,https://timesofindia.indiatimes.com/life-style/health-fitness/weight-loss/lockdown-weight-loss-story-i-lost-22-kilos-after-my-pregnancy-without-going-to-the-gym/photostory/77821617.cms,"Before breakfast: I start my day with a glass of warm water with cinnamon powder, chia seeds and a dash of lemon in it.My breakfast: After 30 minutes, I eat a few soaked almonds. For breakfast, I have oats with nuts, fruits and flax seeds. I also choose from moong dal chila, poha, upma, idli chutney, plain dosa and chutney, fresh smoothies and oats pancake for my breakfast. I have a cup of tea with 1 teaspoon of sugar.My lunch: I eat whatever is made at home, be it dal, sabzi, multigrain chapati with lots of salad. I have stopped eating rice and potato completely. Sometimes, I eat chicken or fish in my lunch as well. I have 1 anjeer or 1 date after my lunch, instead of sweets.My dinner: I eat my dinner at around 7/7:30 pm. I usually eat dalia khichdi, oats khichdi (with lots of vegetables), stir-fried vegetables with paneer or boiled eggwhite, chickpeas or red beans salad, sauteed lobia or black chana. At 10 pm, I have a glass of turmeric milk without sugar.I indulge in: When I first started my fitness routine during the lockdown, for the first 2 months I did not take any cheat days as we were not going out to eat. However, even today, I practise portion control and take only 2-3 bites to satisfy my cravings.Low-calorie recipes I swear by: Bottlegourd Kebabs and Mexican saladFitness secrets I unveiled: I have replaced noodles with Spaghetti, Maida Pasta with Wheat Pasta, Maida Pizza with Oats and Suji Pizza. So, on days I feel like munching on junk food, I at least feel less guilty with these alternatives.",GREEN GRAM DAL (MOONG DAL)
131,131.0,,,2020-08-31,https://www.hindustantimes.com/more-lifestyle/happy-onam-2020-26-dishes-in-the-onam-sadhya-feast-what-they-re-called/story-Ox35zUre2YkHzMjzOcSHTN.html,"more-lifestyleUpdated: Aug 31, 2020 14:16 ISTOnam, also referred to as Thiru-Onam or Thiruvonam, falls in the first month of the Malayalam calendar, Chingam. It is one of the most popular festivals celebrated in Kerala. Onam preparations and celebrations go on for a period of ten days and this year the festival started on August 22, leading up Onam on August 31.Malayalis around the world celebrate the 10-day harvest festival of Kerala and the return of the legendary King Mahabali, by organising a grand feast, also known as Onam Sadhya. Traditionally, over two dozen vegetarian dishes are prepared for this grand feast and served on banana leaves. Preparations for this auspicious occasion usually start a few days in advance. This year, Onam is being celebrated on August 31, 2020.Kerela Tourism also shared a video on Twitter, of the celebration of Onam Sadhya, where people eat a variety of dishes that are served on a banana leaf, with their hands, as is customary.Served on banana leaves and eaten with the hand, Sadya is a spread of curries, fried vegetables, and more. #OnamBeyondBorders #OnamFestKeralaWatch the Facebook Premiere: 27 Aug 2020 2:30 PM IST pic.twitter.com/ef4vpgIIEP  Kerala Tourism (@KeralaTourism) August 27, 20201. PappadamNo Onam Sadhya is complete without these pappads made from rice flour.2. UpperiPerhaps the most beloved item on this list, banana chips are served by the handful before the other 25 dishes.3. Sharkara VarattiThis sweeter version of banana chips is made out of jaggery and though the sweet made be hard to eat, it will certainly leave you wanting more.4. Inji CurryInji curry is made from ginger, tamarind and jaggery. In most Malayali households, this is the first thing that is prepared in the days leading to the 10th day of Onam.5. Mango CurryThis mango pickle will add a spicy kick to your meal.6. Naranga CurryOf the two types of pickles served at Onam Sadhya, this sour lemon pickle will certainly add some zest to your meal.7. PachadiAnother yogurt-based dish for the feast, this is a curry made with either pineapple or bitter gourd, and grated coconut.8. OlanThis is made with ash gourd and red beans splashed with a generous amount of hand-pressed, authentic coconut milk.9. EllisheriThis dish includes pumpkin, red beans, and a generous amount of grated coconut.10. AvialAn often-ignored dish on this occasion, Avial is one of the best mixed vegetable dishes. It is made by mixing vegetable with grated coconut and is cooked in coconut oil and milk.11. ThoranThoran can be made from any vegetable and is a staple in every Malayali household. Usually, it is made with cabbage and carrots or just beans with grated coconut.12. ChorRice is an essential part of Onam Sadhya but on this occasion, most Malayalis serve red rice.13. Parripu CurryFor this dish, plain moong dal is topped with ghee, red chillies, and black sesame seeds.14. Chenna MezhkkupurattiFor this dish, yam is cut into thin slices, boiled with spices and fried in coconut oil.15. SambharAn essential dish for the feast, each family has their own recipe for Sambhar. It is cooked with every vegetable there is, from beans to potatoes to yam.16. PulisseryMade with curd and a vegetable of your choice ranging from pumpkin to cucumber and topped with a gracious amount of grated coconut.17. KaalanThis signature Onam Sadhya dish is made with yogurt, yam or raw banana and grated coconut.18. Morru KachiyathaIf you are a Malayali, this is definitely a part of your comfort food. It is made by boiling yogurt to perfection with black sesame seeds, shallots, ginger, and garlic.19. KichadiAnother delicious dish is this one made using spicy yogurt and your choice of vegetable. It can be okra, cucumber, or even bitter gourd.20. RasamEaten as a rice accompaniment, this can also be drunk to aid in digestion. It is made with spicy tamarind soup, sprinkled with a generous amount of curry leaves, mustard and tomatoes.21. Kootu CurryThe ingredients in this might surprise you, it is made with raw bananas, black chana and grated coconut made into a dry curry.22. NeyyUsually known as ghee in Hindi, a spoonful of this is poured over the rice and parripu to give it an extra flavour.23. Inji ThayirThis delicious dish is made using loads of thinly sliced ginger mixed with yogurt, black sesame seeds and spices.24. Poovan PazhamThis includes the smaller version of bananas. When mashed together, it goes exceptionally well with Payasam, and pappadam can be thrown into the mix for that extra crunch.25. Palada PradhamanA sweet dish made with milk, dry fruits, and rice ada is the last thing to be served as it helps in counteracting the spices.26. Pazham PradhamanThis delicacy includes Rice ada, cashew nuts, thinly sliced coconut pieces and jaggery. And for the right way to enjoy this refer to Poovan Pazham.Follow more stories on Facebook and Twitter",GREEN GRAM DAL (MOONG DAL)
132,132.0,,,2020-09-02,https://indianexpress.com/article/india/maharashtra-ahead-of-harvest-pulses-trade-below-msp-6580897/,"As against the 1.5 lakh tonnes quota allocated for imports, traders in India have managed to ship in only about 80,000-90,000 tonnes. (Representational)Ahead of what promises to be a bumper crop of pulses, wholesale prices across major markets in the country have gone below the government-declared Minimum Selling Price (MSP). Market sources rule out any drastic price rise in pulses as demand is expected to remain low for the next few quarters.For the present kharif season, India has reported plantation of pulse on over 119.59 lakh hectares, an increase from 114.77 lakh hectares the previous season. Moong bean has seen the highest increase from 27.54 lakh hectares last year to 32.13 lakh hectares this season. Barring moong, all other crops have shown single digit rise in acreages. Farmers in Maharashtra and Madhya Pradesh have reported some damage to their harvest-ready crop due to the torrential rains towards the end of August.Across mandis wholesale prices have been correcting themselves even as the harvest is yet to hit the market. In case of Moong, prices have shown a sharp correction in August, which has dampened the chances of any drastic price rise in immediate future. Back in July, the average price of moong beans across the country was Rs 7,271.05 per quintal, which corrected to Rs 6,646.34 in August. Further correction, traders say, can not be ruled out once the crop starts hitting the market. For the present season, the MSP of moong is Rs 7,196, which traders say, seems difficult to reach. Nitin Kalantari, a prominent dal trader and miller in Latur district of Maharashtra, said the pulse will trade below its MSP for most of the season.As against the 1.5 lakh tonnes quota allocated for imports, traders in India have managed to ship in only about 80,000-90,000 tonnes.International prices were higher than domestic prices and it made no sense to import the pulse, he said.. Similarly, another short-duration pulse, urad, which is expected to hit the markets in September, has shown a downward slide just before the arrival of the new crop. In July, the average traded price of urad was Rs 6,344.38 per quintal, which corrected to Rs 5,891.1 per quintal in August. Just about 1 lakh tonnes of the allocated 4 lakh tonnes import quota has arrived in the country. Tur, another major kharif pulse, is also expected to trade below its MSP of Rs 6,000 per quintal.Traders point to the general slowdown in the market for their pessimistic outlook. They said that during the lockdown, domestic households had stocked up their supplies and the same is expected to last for some more time. Also, slowdown in the hotel catering and restaurant business, the traders said, would affect price realisation in the season. The Indian Express is now on Telegram. Click here to join our channel (@indianexpress) and stay updated with the latest headlinesFor all the latest India News, download Indian Express App. The Indian Express (P) Ltd",GREEN GRAM DAL (MOONG DAL)
