,Unnamed: 0,Unnamed: 0.1,Unnamed: 0.1.1,PUBLISHEDDATE,ARTICLEURL,TEXT,COMMODITY
190,190.0,,,2020-12-28,https://www.thehindu.com/news/cities/Delhi/measures-being-taken-to-ensure-fair-prices-for-farm-produce/article33432952.ece,"550 village cooperative societies, agricultural cooperative marketing societies notified as mandi sub-yards: Rajasthan MinisterThe cooperative sector in Rajasthan has been playing an important role in agricultural activities of farmers. The Congress government here has been working for farmers welfare since they are treated as the backbone of the States economy, says Cooperative Minister Udai Lal Anjana in an interview to The HinduFarmers across the country are agitating against the Centres agriculture sector laws. Rajasthans farmers are also staging a protest at the Haryana border. How concerned is the State government about their welfare?The Congress government in Rajasthan has been constantly taking measures for the farmers welfare since we treat them as the backbone of the States economy. Several new schemes and policies for farmers, introduced during the COVID-19 pandemic, are being implemented effectively in a transparent manner.Farmers are finding it increasingly difficult to sell their produce at remunerative prices. What efforts have been made in this regard?The State government has notified 550 village cooperative societies as well as agricultural cooperative marketing societies as mandi sub-yards for ensuring fair prices and expeditious payments to farmers. They can now sell their produce at one of the notified markets near their agricultural land and village. Open bidding has also fetched them better price. Over 19,200 farmers have benefited from the sale of 6.70 quintal of produce for 152.95 crore.The State government had recently assured low-interest loans to save farmers from forced selling. Has the scheme benefited the farmers?The State government has announced disbursement of loans against the stored produce of farmers at a nominal interest rate of 3% to ensure that they are not forced to sell the farm produce and are still able to meet their financial needs. Over 2,000 farmers associated with 840 cooperatives have availed of an aggregate loan amounting to 20.46 crore under the scheme. They held more than 1.14 lakh quintals of their produce worth 32 crore.A large number of farmers depend on loans to meet their agricultural expenses. Has the Cooperative Department taken measures to reduce their financial hardship?Efforts are being made to make expensive equipment available on lease at affordable prices. Village cooperative societies and agricultural marketing cooperative societies are being associated with custom hiring centres and 8 crore has been sanctioned for opening these centres at 100 cooperatives. New village cooperative societies have also been formed across the State. They will help the farmers access loans, purchasing fertlisers and other activities at their own village panchayat. The approval for 129 primary agricultural credit societies and 21 large area multi-purpose societies has associated 75,000 more people with the cooperative sector.Which crops are being procured on minimum support prices in Rajasthan? How are the procurement centres functioning?We have enhanced the limit for procurement of moong and groundnuts by 10%, providing the benefit to over 29,000 farmers. The 266 procurement centres for moong and 365 for groundnuts have so far purchased 30,638 metric tonnes and 7,253 metric tonnes of the two farm produce, respectively.The functioning of cooperative banks has often come into question in Rajasthan. Are some efforts being made to improve the process for loan disbursement by these?For the first time in the country, Chief Minister Ashok Gehlot introduced an online registration and disbursement scheme for farm loans in 2019. This has done away with discrepancies in the distribution of loans. Biometric and Aadhaar-based verification, which helped in selecting genuine farmers, has led to the association of 12.72 lakh new members with the farm loan process.",GREEN GRAM DAL (MOONG DAL)
191,191.0,,,2020-12-28,https://www.hindustantimes.com/fitness/change-your-diet-with-change-of-weather/story-kxMKzX5hiVPDHJczsx426O.html,"fitnessUpdated: Dec 28, 2020, 13:32 ISTSnuggled inside the blanket or soaking the winter sun with a cuppa hot chai or cappuccino us a must. Those honey smeared peanuts and sesame pattis are also a must-have in this season. But as you gorge onto mouth-watering and addictive delicacies, they not only affecting your weight but also your overall health. Experts list a few tips to follow in winters to keep safe from the pollution, the novel virus and adapt healthy eating:Jaggery is a winter vitamin shot, with best warming ingredients its loaded with iron and other minerals which fortify the body against the winter chills. It is great for people with high blood pressure and helps in digestion, boosting haemoglobin and cleaning the body from within to breathe easy in this pollution. A small piece of jaggery in any form must be included to the diet in winters.Intake of vitamin D as we have less exposure to sunlight is very important to keeps the bones strong and prevent dryness of skin. Vitamin D is also known for its effective immune strengthening benefits.The immune system is constantly overburdened with toxins from fried food in winters thus it is advisable to detoxify the body by keeping a fast once a week or using herbs like cilantro in green smoothies or juices.Garlic contains compounds that fight germs and helps to boost the immunity. Sulphur present in the garlic boosts the disease-fighting response of some types of white blood cells in the body when it comes in contact with any kind of viruses, which causes common cold and flu.The active compound curcumin in turmeric fights infection and inflammation by preventing damage caused by free radicals. And to improve the bioavailability of turmeric dont forget to add black pepper which contains a compound called piperine, which when combined with turmeric, increases the absorption of curcumin by upto an astonishing 2000%.Dry and sweet snacks such as panjeeri prepared during winters in the northern parts of our country is very warming and believed to help relieve body pains and opens up muscles and joints. One can make different versions of this using whole wheat, millets, sattu, or moong dal flour and to this, add ghee, nuts, dry fruits, and spices like cardamom, fennel seeds, saffron, and nutmeg.Include green leafy and root vegetable like sarson, bathua, methi, palak(spinach), sweet potato, yam, carrots etc as they are packed with vitamins and minerals. Some common vitamins found in these vegetables are beta-carotene that can be converted in the body to vitamin A, B-vitamins, folate and vitamin C. They are also rich in magnesium, potassium and other minerals found in the local soil. When we eat whats in season we are not only helping the local agriculture but we are also eating food when it has its peak nutrient values, leading to overall health.Winter millets like bajra, ragi and makai as they are good quality starch, high in protein and fibre. Also they are good for maintaining cholesterol levels and energy.Citrus fruits like lemon, alma, orange and grapefruit are the juiciest and are loaded with vitamin C which help in boosting immunity and keeps the cough and cold away.Kahwa green tea acts as an immunity drink, which helps to fight the winter by keeping us warm and free from any infection due to its ingredients like saffron, cinnamon, cardamom, almonds and bay leaves which are excellent sources of vitamins and minerals.Good quality pure ghee generates instant heat and energy for the body to help keep the body warm and cleanse the body from inside. Ghee should be used instead of oils to make every day sabzi and roti.Fresh turmeric root should be consumed in hot water or hot milk before sleeping as it is an Ayurvedic adaptogen and helps to keep the body immune and healthy.Relax, enjoy and sleep well! Chronic stress, depression due to darkness weakens the immune system so enjoy life and sleep for 6-7 hours a day.Inputs by Nutritionist Harleen Gulati and Clinical Nutritionist Ridhima Batra",GREEN GRAM DAL (MOONG DAL)
192,192.0,,,2020-12-29,https://timesofindia.indiatimes.com/life-style/health-fitness/weight-loss/weight-loss-i-have-oats-khichdi-for-dinner-and-a-glass-of-haldi-milk/photostory/80010431.cms,"My breakfast: I have my first meal around 8 A.M.- usually a mix of almonds, cashews, walnuts (handful) with poha/ semolina/ vermicelli (100-150 gms). Sometimes, I like to have 2 pieces of idli and half a cup of tea without sugar.My lunch: I have my lunch around 1-1:30 P.M., usually 2 chapatis, 150 gm of toor dal and curry (low-carb veggies like cabbage, cauliflower, green beans, ridge gourd etc) with a serving of salad.Evening snacks: Murmure (puffed rice) and green moong daal sprouts mix (1 bowl) or a fruit chaat (papaya+ apples). A while later, half a cup of milk tea (without sugar of course)I have a cup of Green tea before going for my evening walkMy dinner: Oats khichdi (150 gm) and half a glass of haldi doodh before going to bed.Pre-workout meal & Post-workout meal: Because I majorly followed basic brisk walking and jogging exercises, (the initial months at least), I didn't really buy into pre or post-workout meals. I just followed calorie restrictions and divided my meals into 4 slots as mentioned above.I just did basic brisk walking throughout my weight loss journey (Initial 4.5 months of my journey). So, was not much into pre-workouts or post workouts meal and was following strict meal timings and divided them into 4 slots as mentioned above.I indulge in (What you eat on your cheat days): Frankly saying, I never had any single cheat day during my 4.5 months weight loss journey and completely avoided eating outside food.Low-calorie recipes I swear by:I love this recipe part. My aim is to add as many veggies as I can to my normal meals. Like, I used to prepare poha will a lot of veggies, had veggies soups, oats with veggies (Like, spinach, beetroot, paneer, soya, etc)., green moong sprouts with veggies salad. (I am vegetarian so I love adding veggies in my recipes).",GREEN GRAM DAL (MOONG DAL)
193,,,,2021-01-04,https://timesofindia.indiatimes.com/life-style/health-fitness/weight-loss/lockdown-weight-loss-i-have-a-bowl-of-moong-or-split-moong-dal-for-dinner/photostory/80099084.cms,"My breakfast: I have my breakfast at 8:30 am sharp and prefer eating oats with almonds and fat-free curd/ vermicelli upma with veggies/poha or two idlis.My lunch: For lunch, had at 1:30 pm, I mostly take 2 - 3 chapatis or little rice with moong dal and low carb vegetables (broccoli, beans, spinach etc.) or grilled boiled chicken/fish ( 100 gms)My dinner: Just a bowl of moong or split moong dal at 9 pm. If I feel hungry later, I have a glass of skimmed milk.Pre-workout meal: 1 hour before I take 2 digestive biscuits with tea without sugar, preferably red tea. An hour before heading to my workout, I have 2 digestive biscuits with tea (without sugar). Sometimes, I have red tea.Post-workout meal: I have a cup of green tea.I indulge in (What you eat on your cheat days): Nothing fancy, on rare occasions when I crave too much, I like to have chicken momos or homemade pooris or paranthas. I avoid eating outside food as much as possible.Low-calorie recipes I swear by: My wife prepares delicious oats recipe- with nuts, curd and jaggery powder. I avoid gluten and sugar. Vermicelli is another favourite. I love eating it and this has helped me control my calorie intake. Most of my food was prepared in very less oil (usually mustard oil). I have to thank my wife for being so supportive and helpful.",GREEN GRAM DAL (MOONG DAL)
194,,,,2021-01-09,https://www.newindianexpress.com/states/tamil-nadu/2021/jan/09/eps-distributes-pongal-gift-hampers-to-labourers-2247525.html,"By Express News ServiceCHENNAI: With the State preparing for Pongal celebrations, Chief Minister Edappadi K Palaniswami on Friday launched Pongal gift hamper distribution to 12.70 lakh construction workers. At a simple function at the secretariat, the Chief Minister presented gift hampers to seven construction workers.According to an official release, 5,94,147 men and 6,75,403 women workers, who have registered with the Tamil Nadu Construction Workers Welfare Board would receive the gift hamper and the government has allocated `94.40 crore towards this. Labour Minister Nilofer Kafeel, Chief Secretary K Shanmugam and senior officials were present on the occasion.The gift hamper contains dhoti and angavastram for men and saree for women workers, two kg of raw rice, one kg of moong dhal, 500 grams of cooking oil, 100 grams of ghee, one kg jaggery, five grams of cardamom, 25 grams of cashew and 25 grams of resins.Palaniswami also laid foundation for establishing a water regulator, dam and check dams in Mayiladuthurai, Virudhunagar and Madurai districts at a total cost of `24.78 crore, through video conference. The water regulator to be constructed at Thennampattinam village in Mayiladuthurai district will benefit Thennampattinam and Perunthottam villages, and it would prevent seawater intrusion to the villages.The dam to be built across Kundar river at Kalkurichi village in Virudhunagar district will benefit 791.97 acres of lands in Kariapatti taluk. Similarly, the check dam to be established near Sathangudi village in Madurai district will increase water level in the 19 wells around Sathangudi and Kannukulam village. The dam would irrigate 293.18 acres in the villages. The check dam to be built at Thirali village in Madurai district will fortify water level in 40 wells in the area besides irrigating 368.01 acres.Pongal gift hamperAbout 5,94,147 men and 6,75,403 women workers, who have registered with the Tamil Nadu Construction Workers Welfare Board would receive the gift hamper. The government has allocated `94.40 crore for this. The hamper contains dhoti and angavastram for men and saree for women workers, two kg of raw rice, one kg of moong dhal, 500 grams of cooking oil, 100 grams of ghee, one kg jaggery, and five grams of cardamom, 25 grams cashew and 25 grams of resinsBridging growthThe Chief Minister declared open bridges constructed in various districts at a total cost of `85.73 crore, through video conference at the secretariat. The new bridges are located at",GREEN GRAM DAL (MOONG DAL)
195,,,,2021-01-12,https://www.newindianexpress.com/cities/chennai/2021/jan/12/a-taste-of-the-harvest-2248824.html,"Roshne Balasubramanian and Vaishali Vijaykumar ByExpress News ServiceCHENNAI: Millets, sugarcane juice and turmeric take centre stage this Pongal, as kitchens across households in the city opt to give a healthy twist to the traditional sakkarai pongal, ven pongal and other accompaniements. Roshne Balasubramanian and Vaishali Vijaykumar give you...Sugar cane juice pongal by Shanthi Ramachandran(Instagram @shaanthram)IngredientsRice: 1 cup (150 g) Moong dal: 1 tbsp Sugarcane juice: 2 cups (You can prepare using the stalk at home or use store-bought juice) Jaggery/palm sugar/kalkandu:  cup or required Ghee: 100 g or required amount Cashew, raisins, coconut pieces for garnishingMethodTake a pan. Add some ghee and roast the moong dal. Keep it aside. Take the rice in a strainer and wash it. Roast it in ghee for a minute in the pan.Add the sugarcane juice, one cup of milk, one cup of water and pressure-cook it on medium flame for about five to six whistles (without keeping the inner vessel) until the rice turns soft.Now, add half a cup of powdered jaggery/palm jaggery or natural brown sugar or karuppatti as per your preference.The pongal will melt but will start to thicken after cooking for a few minutes. Add two tablespoons of fresh ghee and ensure that the pongal doesnt stick to the bottom of the vessel.In another pan, add small pieces of coconut, cashews and fry it in ghee and add to the pongal.Crush a few cardamoms and add it with the skin. Mix well and serve.VariationsYou can use any millet instead of rice.While saffron is not added in traditional south Indian pongal, if you wish, you can add it along with a very small pinch of edible camphor.TipsFor pongal, pudu paccha arisi is recommended because it gives a lovely fresh fragrance and turns soft quickly. It is also much cheaper than regular rice variants. Use of pudu paccha arisi is also considered very auspicious during Pongal because its a symbolic celebration of nature and its harvest.Puli Pongal by Jeyashri Suresh(Instagram @Jeyashris Kitchen)IngredientsBroken rice/arisi kurunai: 1 cup Tamarind a lemon sized Sesame oil: 2 tbsp + 2 tsp Mustard seeds: 1/4 tsp Peanuts: 2 tbsp Chana dal: 1 tsp Urad dal: 1 tsp Green chilli: 1 Dried red chilli: 2 Water: 3 1/2 cups Turmeric powder: 1/4 tsp Asafoetida: a generous pinch Curry leaves: few Salt as neededMethodSoak a small lemon-sized tamarind in 1/2 cup hot water for 10 minutes. Extract tamarind juice using 1 cup of water.In a pressure pan or cooker, add two tablespoons sesame oil. Add the 1/4 tsp mustard seeds and two tablespoons of peanuts.Saute them for a minute and add one teaspoon urad dal and one teaspoon chana dal. Add two whole red chillies, curry leaves and two green chillies.Saute till the dals turns golden brown. Add the 1/4 teaspoon turmeric powder and asafoetida.Mix well and add the tamarind extract. The tamarind extract was about 1.5 cups. Add 2 cups of water, salt and allow this to boil well.Once it starts boiling, add one cup of broken rice to this. Mix well to ensure no lumps are formed.Cover the cooker and pressure-cook for three whistles.Once the pressure is released, open and add two teaspoons of sesame oil.Serve with vadams or appalam.NoteThe water measurement was perfect for this rice kurunai. If the broken rice is little finer than the one I used, you can add three cups of water.Country vegetables sambar by Banumathi Balasubramanian(Instagram @Banumathi Balasubramanian)IngredientsToor dal: 1/2 cup Water: 2 cupTurmeric: 1/4 tsp Sesame oil: 2 tspDry red chilli: 6 Chana dal: 1 tbspCoriander seeds: 2 tbsp Fenugreek: 1 tsp Pumpkin Ash gourd Sweet potato Broad beans Chow chowField beans: 1/4 cup Grated coconut: 2 tbsp Asafoetida; a small pieceTamarind water: 2 cups Salt to tasteMethodPressure-cook 1/2 cup toor dal with two cups water and 1/4 teaspoon turmeric powder. Heat two teaspoons sesame oil in a frying pan. Fry six dry red chillies, 1 tablespoon chana dal/kadalai paruppu, two tablespoons coriander seeds and one teaspoon fenugreek seeds, until dal turns light brown. Add in two tablespoons grated coconut and fry until coconut turns light brown. Grind this to a fine paste or powder. Cut country vegetables (pumpkin, ash gourd, sweet potato, broad beans, chow chow) to 1 inch cubes/pieces. Add in 1/4 cup field beans. Heat two cups of water in a cooking pot. Add in the vegetables and then add 1/2 teaspoon turmeric powder. Cook for about seven minutes. Add a small piece of solid asafoetida and two cups of tamarind water extracted from a lemon-sized tamarind. Add salt. Bring to a boil. Cook until the vegetables are soft. Add in the cooked dal and the ground spice powder/paste. Add in a cup of water if needed to adjust consistency. This kozhambu should be a little thicker than regular sambar. Bring to a boil. Cook for two more minutes. Turn the heat off. Temper with mustard seeds, curry leaves and 2-3 red chillies broken to pieces in one tablespoon sesame oil. We dont add chopped cilantro/coriander leaves to this sambar.Red rice ven pongal by Padma Balasubramanian(Instagram @Padma Balasubramanian)IngredientsRed rice: 1 cup Moong dal: 1/4 cup Pepper: 1 tsp Jeera: 1 tsp Hing powder: 1/2 tsp Ginger: a small piece, finely chopped Curry leaves: a few Cashews: 10 Ghee: 2 tbsp Oil: 1 tbspMethodWash and soak red rice for an hour in 3.5 glasses of water. Wash the moong dal, drain water and add it to the soaked red rice. Transfer to a pressure cooker and cook for six whistles. Keep the stove in sim for another five minutes and switch off. Allow the pressure to settle down and open after 20 minutes. It would have cooked very soft. If its watery, it will thicken after cooling. Add salt and mix well. Heat a frying pan. Add ghee and oil. Add coarsely crushed pepper and jeera. Add the cashews, hing powder, ginger and curry leaves. When it splutters, add it to the pongal. Mix well and enjoy.Millet akkaravadisal by Jeyashri Suresh(Instagram @Jeyashris Kitchen)IngredientsVaragu/ kodo millet:  cup Saffron: 2 pinches Moong dal: 2 tbsp Milk: 2 cups Jaggery: 2 tbsp Water:  cup Ghee: 2 tbsp Cashew nuts: a few Edible camphor: a pinchMethodIn a vessel, add millet and moong dal. Wash well and add  cup water and two cups of milk. Cover it with a plate. Pressure-cook this for 7-8 whistles and keep it on low flame for five minutes. Switch off the flame. Once the pressure subsides, take it out and mash it well. If it is too thick, you can add some milk and mix well. Soak saffron in one tablespoon of warm milk for five minutes. In a pan, add jaggery and  cup of water. Let the jaggery melt. Filter the impurities and add it to the mashed millet mixture. Mix well and cook for two minutes on low flame. Add ghee and mix well. Add edible camphor. Roast a few cashew nuts in ghee and garnish the dish.NotesAny millet like barnyard millet, little millet or thinai works well for this millet akkaravadisal. I personally dont prefer adding cardamom powder as it will suppress the flavour, or saffron and edible camphor. The consistency of the akkaravadisal is perfect and stays intact for 4-5 hours.Kambu vella pongal or Bajra jaggery pongal by Praveen Kumar(Instagram @Awesome Cuisine)IngredientsKambu (bajra): 1 cup Moong dal: 1/4 cup Jaggery: 1 1/2 cups Ghee: 1/4 cup Cashew nuts: a handfulRaisins: a handful Cardamoms: a few Water: 6 cupsMethodDry roast the bajra until it gives out an aroma, and keep it aside.To the same pan, add the moong dal and roast for a minute. Add water and simmer until the dal is 3/4th cooked. Then, add the kambu (bajra). Stir continuously until it starts to thicken.Add jaggery and mix well. When it starts to leave the sides of the pan, reduce the flame.Fry the cashew nuts and raisins in ghee. Add to the pongal and stir.Cook for another 3 to 5 minutes or until it has a pongal-like consistency.Sprinkle some cardamom powder and serve.Turmeric pickle by Shanthi Ramachandran(Instagram @shaanthram)IngredientsFresh turmeric Salt Chilli powder Lemon juice (All Quantities as required)MethodClean, peel the skin of fresh turmeric and cut them into thin strips (or grate them according to your preference).Add the required amount of salt and chilli powder and mix well.Keep it aside for 10-15 minutes.Add in the required amount of lemon juice, mix well and serve after 30 minutes.You can refrigerate and use this pickle, which is both tasty and medicinal, for a few days.Kodo millet sweet pongal by Srividhya Ravikumar(Instagram @Vidhus Kitchen)IngredientsVaragarisi / Kodo Millet: 1 cup Moong dal: 1 tbsp Jaggery: 1 1/2 cup Ghee: 4 tbsp Cashew nuts: 2 tsp Cardamom powder: 1 tspMethodPressure-cook varagarisi and moong dal in the ratio of 1:3, and let it cook for 7 to 8 whistles. Once cooked, mash it.Add 1/2 cup hot water to the jaggery and filter it.Boil the jaggery and when it reaches a thick consistency, add the mashed varagarisi mixture, cardamom powder and stir well.Fry cashews in three tablespoons of ghee and add to the varagarisi sarkarai pongal. Mix well. Serve hot.",GREEN GRAM DAL (MOONG DAL)
