PUBLISHEDDATE,ARTICLEURL,TEXT,ARTICLETITLE,COMMODITY
2021-03-29,https://indianexpress.com/article/cities/pune/hit-hard-by-lockdown-last-year-maharashtra-farmers-oppose-any-such-move-to-tackle-second-wave-7250673/,"While growers of non-perishable commodities like chana, tur and wheat might not face problems with disposal of their produce, a lockdown would result in huge losses to them. (Representational Image)In the wake of Chief Minister Uddhav Thackeray indicating that a state-wide lockdown could be imminent to deal with rising cases of Covid-19, a section of farmers in the state have opposed such a move, pointing out the financial hardships it will entail. Farmers say they would face severe losses in sale of products such as milk, fruits and vegetables if markets close.While growers of non-perishable commodities like chana, tur and wheat might not face problems with disposal of their produce, a lockdown would result in huge losses to them. Last year, the nationwide lockdown in March had hit farmers hard, with many vegetable and fruit growers forced to throw away market-ready produce.Read | Maharashtra stares at lockdown as Covid-19 cases surgeSantosh Gorde, a grape and onion grower from the village of Takli Vinchur in Niphad taluka of Nashik district, urged the chief minister not to announce any such lockdown till April 15. The grape season is in its last leg and there should be no lockdown for at least the next 15 days. If the markets are closed, we will again be compelled to discard our produce, he said.Last year, Gorde and other grape farmers had sustained huge losses as the lockdown had dried up markets and prices had collapsed to Rs 10-12 per kg. Currently, farmers are selling their produce between Rs 30-60 per kg. Stay updated with the latest Pune news. Follow Express Pune on Twitter here and on Facebook here. You can also join our Express Pune Telegram channel here.India has seen export of 6,800 container-load of grapes this season, nearly 5 per cent lower than last year. Vilas Shinde, CMD of Nashik-headquartered Sahyadri Farmers Producers Company, said the season has already encountered many issues and a lockdown would add to the losses. We will be operational with all the Covid-10 measures in place we cant afford another year of loss, he said.As talk of lockdown gains ground, traders from other states have stopped coming to Maharashtra to deal with farmers. Sangli-based farmer Ankush Chormule said markets for fruits like watermelon and musk melon have seen fall in sales. The government has not made any alternate market chain ready. What are farmers supposed to do if the existing markets are closed, he asked.Farmer leader and former MP Raju Shetti also spoke out against a lockdown, saying such a move will backfire on the economy. Other than fruits and vegetable growers, farmers who had invested in high-tech farming, like polyhouses or green houses, have also experienced heavy losses.Shetti said he has decided to meet state Chief Secretary Sitaram Kunte on Tuesday to discuss the issue.","Hit hard by lockdown last year, Maharashtra farmers oppose any such move to tackle second wave",ONION
2021-03-29,https://www.newindianexpress.com/lifestyle/food/2021/mar/29/flavours-from-aflower-2282842.html,"By Express News ServiceCHENNAI: Flower with pink-coloured petals sitting amid a waxy green leaf, floating away in the pond as the sun shines on it the lotus is a beautiful picture in itself. But, there is more to the flower than symmettery a spiritual significance, symbol of purity and a host of healing properties it contains. The seed (makhana) and the root (kamal kakdi) of the lotus plant, cultivated in most parts of the world, are edible.Known for its crunchy texture, water chestnut-like flavour with a slightly sweet taste, the lotus root (also called as lotus stem) can be eaten raw, stir-fried, braised or sauted. The oval-shaped seeds are puffy in texture and a diabetic-friendly snack option.They are staples in north India, especially Kashmir. But, that does not mean that the dwellers of south India have to miss out on its goodness! From cutlets to curries, Vaishali Vijaykumar brings you eight delectable recipes from five home chefs.Lotus root kuzhambu by Mullai MadavanIngredientsLotus root: 10, slicedOnion: 1 cup, finely-choppedTomato: 1/2 cup, choppedGarlic: 3 cloves, crushedGreen chilli: one, slitTurmeric powder: 1/4 tspRed chilli powder: 1 tspCoriander powder: 1 tbspSugar or jaggery: 1/4 tspMustard: 1/2 tspCumin: 1/2 tspCurry leaves: 6 leavesTamarind extract: 1/4 cupAsafoetida: 1/4 tspSalt: 112 tsp, Oil: 2 tbsp,Water: 1 cupCoriander leaves: 2 tspAny vegetable or seafood (optional): 1 cupMethodBoil lotus root over stove top in a pot of water for 20 to 25 minutes over medium flame.Heat oil in a saucepan and splutter mustard, cumin and curry leaves.Sprinkle asafoetida powder and add chopped onions, green chilli and crushed fresh garlic.Fry for five minutes over medium flame or until translucent.Add chopped tomatoes, along with chopped lotus root.Saut for a couple of minutes in the onion-tomato mixture.Add water and turmeric powder. Bring this to a boil, then cover and cook over low flame for 20 minutes or until the roots turn tender. (A knife inserted should pass through the root easily).Once it cooks, add red chilli powder, coriander powder, sugar, tamarind extract and salt.Cook this gravy base for 5 to 6 minutes and simmer for 10 or until the oil separates on top.Garnish with coriander and curry leaves. Turn it off.Serve lotus root kuzhambu over piping hot rice.Hariyali lotus root by Roshni KishoreIngredientsLotus root: 1Coriander leaves: 1 bunchFennel seeds: 1 tspCumin: 1 tspGinger-garlic paste: 1 tspGreen chillies: 4Salt to tasteLime juice: 1 tbspCoriander powder: 1/2 tspRed chilli powder: 1/2 tspChaat masala: 1/2 tspMethodPeel the skin of the lotus root, wash and cut into thin slices.Boil in a pressure cooker with one cup of water.Prepare the hariyali chutney with the rest of the ingredients.Marinate the lotus stem with this masala for 10 minutes.Heat ghee in a pan.Add the lotus stem and hariyali chutney for a few minutes till it is dry and cooked.Serve hot as a snack.You can also have it with tandoori roti.Phool Makhana Poori by Dr Sarawathy ViswanathanIngredientsWheat flour: 2 cupsMakhana flour: 1 cupSalt to tasteOil for deep fryingMethodDry-roast makhana and grind it to a fine powder.Mix wheat flour, makhana powder, salt and two tbsp of oil. Add water slowly and knead to a stiff dough.Cover the dough and keep it aside for 10 to 15 minutes.Divide into equal portions.Take a ball, roll it on an oiled surface till thin.Drop rolled poori in oil. Press on top till puffy, flip over and cook.Serve with potato masala or your favourite curry.Lotus root and peas curry by Geeta PalIngredientsLotus root: 250 g, peeled and dicedOnion: 1, finely-choppedTomatoes: 2Ginger and garlic paste: 1 tbspGreen peas (frozen or boiled): 1/2 cupCumin seeds: 1 tspGreen chilli: 2 to 3, choppedSalt to tasteTurmeric powder: 1 tspRed chilli powder: 2 tspCoriander powder: 1 tspKasuri methi: 1 tspGaram masala: 1/2 tspDesi ghee: 1 tbspFresh cream: 1 tbsp (for topping)MethodIn a pressure cooker, heat ghee and add cumin seeds. Once the colour changes, add ginger, garlic, chopped chillies and onions. Saut until onions turn golden brown.Meanwhile, prepare the tomato puree by boiling and blending them.Once the onions are sauted to golden brown, add all the spice powders except garam masala. Fry for a few seconds and, then, add tomato puree.Let the puree cook until you see oil floating on the top. This is the time to add in diced lotus stem and green peas.Cook them in the masala for 3-4 minutes. Add little water (ensure it doesnt become like gravy) and close the lid.Let them cook for around 2 to 3 whistles on slow flame. Ensure it is properly cooked but does not become lumpy.Open the pressure cooker once all the pressure has released. The sabzi should be semi-dry.Garnish with kasuri methi and garam masala. Serve hot with a dollop of fresh cream.Lotus root cutlets by Geeta PalIngredientsLotus root: 1 cup, peeled, diced and boiledGreen peas: 12 cupBoiled potato: 1 mediumGreen chillies: 2 to 3Onion: 2 tbsp,finely-choppedGram flour: 1/8 cupCorn flour: 1/8 cupCoriander leaves: 2 tbsp,finely-choppedBlack pepper powder: 1 tspCumin: 1 tspRed chilli powder: 1/2-3/4 teaspoonSalt to tasteOil: 2 tbspMethodIf you are using fresh lotus root then peel, wash and dice the stem. Boil them until soft and tender.If you are using frozen then thaw the stems. Coarse-grind them and set them aside.Wash green peas. Parboil and grind into a coarse paste.In a food processor or mixer toss all the ingredients (except potato and oil).Pulse the ingredients a couple of times until it looks like a mixture.Add mashed potato and adjust seasonings.Check dough consistency and add gram flour and corn flour accordingly to ensure forming a smooth ball.Shape it like cutlets.Heat oil in a pan.Cook the cutlets until crispy and evenly brown.Serve them hot with pudina chutney and saunth.Crispy chilli lotus root by ShikhaIngredientsFor the crispy lotus rootCleaned lotus root: 200 gCorn flour/ starch: 3 tbspVegetable oil for fryingSalt and white pepper to tasteFor the chilli sauceVegetable oil: 1 tbspGinger, garlic: 1 tbsp eachGreen chillies: 1 tbspCelery: 1 tbsp, finely-choppedSpring onion:  cupOnion: 1 small, finely-choppedGreen capsicum:  cupLight and dark soy sauce, Sriracha sauce: 1 tbsp eachTomato ketchup: 1 tspSpring onion greens: 2 tbspCorn flour slurry: 1 tbspKashmiri red chilli powder:1 tspRice vinegar:  tspWhite pepper:  tspSalt to tasteFor garnishFresh spring onion greens and sesame seedsMethodPeel the skin of the lotus root. Slice it diagonally into 0.5 cm thick slices and set it aside.In a pan, add oil. Saut ginger, garlic, green chillies, celery, spring onion whites and onions until fragrant. Add green capsicum. Cook until the vegetables start to wilt.Add light and dark soy sauce, sriracha sauce and ketchup. Saut for another minute.Add spring onion greens and season with salt and pepper.Add the prepared cornflour slurry and rice vinegar. Cook until the mixture thickens.Finish the sauce by adding Kashmiri red chilli powder.To the sliced lotus root, add three tablespoons of corn flour and season with salt and pepper. Mix to coat all the slices in corn flour.Deep fry until golden brown. Once cooked, strain on tissue paper to remove excess oil.Add the fried lotus root to the chilli sauce. Mix till it is coated with chilli sauce.Garnish with sesame seeds and sliced spring onion greens, and serve hot.Red Velvet Phool Makhana Payasam by Dr Saraswathy ViswanathanIngredientsPhool makhana (puffed lotus seeds): 1 cupMilk: 2 cupsSugar: 1/4 cupCondensed milk: 2 tbspCashew nuts: 1/4 cupVanilla essence: 1 tspRed colouring agent: a few dropsCocoa powder: 1 tbspGhee: 1/2 tspFew fried cashews for garnishingMethodHeat a pan, pour ghee and roast makhana for two minutes.Dry roast the cashews in the same pan and keep aside.Crush half cup roasted makhana roughly with your hands. It will be crisp, so it is easy to crush.Powder the remaining half of makhana with the roasted cashews finely.Boil milk. Add makhana and sugar.Add cocoa powder and red colour and mix well. Allow boiling for a few minutes.Add the cashew makhana powder and mix well. Payasam will thicken.Add condensed milk and vanilla essence at this stage and mix well.Bring to boil for a few more seconds and switch off the flame.Garnish with fried cashews and serve.Lotus root dosa by Roshni KishoreIngredientsLotus root: 1Green chillies: 2SaltChaat masala: 1 tspRed chilli powder: 1 tspGram flour (besan): 1 cupCoriander leaves: a handful, choppedMint leaves: a few choppedGaram masala: 1 tspMethodPeel the skin of the lotus root, wash and cut into thin slices.Boil in a pressure cooker with one cup of water.Grate it and mash it.To this add the dry ingredients. Add water as per dosa consistency.Heat a tawa. Pour olive oil. Pour one ladleful of the batter.Let it cook (on medium flame) and turn to another side.Apply oil or ghee.Serve hot with hariyali chutney.Flower PowerDhanalakshmi R, dietician, Rainbow Childrens Hospital, throws light on the benefits of lotus stem and seeds.Blood circulationIt gives you an energy boost as it regulates blood circulation. Proper circulation means all organs of the body are properly oxygenated. Lotus root is rich in copper and iron and stimulates the formation of red blood cells.Regulates BPPotassium, which is a vasodilator, helps maintain the fluids in our body and even counteracts the effects of sodium. Potassium also helps to keep the blood vessels relaxed and increases blood flow by reducing the rigidity and contraction of blood vessels. This reduces the pressure on the cardiovascular system.Aids digestionLotus root has a good amount of dietary fibre and it adds bulk to the stool facilitating easy expulsion from the body. The rich fibre content also helps to release the gastric juices which help to break down food and absorb the nutrients.Immunity boosterLotus root is rich in vitamin C, a powerful antioxidant. It acts against the free radicals in our body and thus protects us from various diseases like heart disease and cancer.Mental healthLotus root contains vitamin B complex and the pyridoxine in it regulates your mood and mental health by interacting with the neural receptors of the brain.Healthy heartPotassium and dietary fibre help remove cholesterol from our blood. Pyridoxine controls the homocysteine levels in the blood and helps to keep our hearts healthy.Breathe easyIt helps remove accumulated mucus and provides relief from cough. Lotus root juice also helps to treat illnesses like tuberculosis and asthma.",Flavours from a flower,ONION
2021-03-30,https://www.thehindu.com/life-and-style/food/the-tradition-of-making-pesaha-appam-on-maundy-thursday-in-christian-households-of-kerala/article34198692.ece,"Pesaha appam, an unleavened bread made of rice flour, is cooked in many Christian householdsFor Marina Charles, the flavours of Lent are unfermented, steamed Indri appam, Pesaha appam and kurukku, made at her home in Thiruvananthapuram. That was not all. Since my mother, Thelma Gomez, hails from St. Andrews near Menamkulam in the capital city, she also used to make sweet hot cross buns, rich in spices like nutmeg, cloves, cinnamon and all-spice powder. St Andrews had a unique culture with traces of Portuguese influence and so she used to bake the hot cross buns for Easter. My paternal grandmother, Lydia Gomez, was the one who made the Indri appam (or Pesaha appam) and kurukku, which is also called pesaha paal, says Marina, a popular cookery instructor and blogger settled in Bengaluru.Myriad optionsAs with all things food, each region and Christian denomination in Kerala has its own flavours for Lent. What is common is the simple food that is usually served on Maundy Thursday and Good Friday after the church service is over. While it is invariably kanji (rice porridge) and payar (green mung) on Good Friday, on Maundy Thursday it is the Pesaha appam, an unleavened bread made of rice flour that is cooked in many Christian households all over Kerala.Pesaha appam or kurishappam | Photo Credit: Ammu Elizabeth JohnLent is a period of fasting, prayers and abstinence for many Christian families. Although Easter eggs and bunnies are getting increasingly popular, many families continue the tradition of making or buying Pesaha appams. Although we make Easter eggs, cakes and hot cross buns, what is much in demand is the Indri appam that is served on the day of Maundy Thursday, says Reina Thomas, one of the partners of Square One Homemade Treats, a popular bakery in Thiruvananthapuram.Marina says that since cakes are easier to make, many of the ethnic snacks that were traditionally made during the Holy Week have been forgotten as they involve a great deal of time consuming, laborious stirring and cooking, mostly with rice flour. To keep the tradition going, Marina makes it a point to make the Indri appam every year.Traditional treats St. Michels Bakery, Bread Fort, Ambrosia and Square One Home Treats make the hot cross buns that many of us are familiar with because of the popular nursery rhyme about it. Michel David, proprietor of St. Michels Bakery, makes both hot cross buns and hot cross bread. He says there is a clientle for it as some families have the buns or the bread with milk on Maundy Thursday. It is available on Wednesday and Thursday at the different outlets of the bakery.Prasobhithan S says Bread Fort will also be making about 20 to 25 hot cross buns and different kinds of breads for Maundy Thursday. As Square One Homemade Treats will be closed from Thursday for Easter, their hot cross buns and pesaha appam will be available on Wednesday.Preethi Abraham, a home cook, recalls that during her childhood in Ranni, Pathanamthitta, the service on Maundy Thursday used to be early in the morning at around 3 am. The Indri appam, made with rice flour and urad dal, was steamed, either in leaves like an ela ada or in a vessel. The Cross that we got for Palm Sunday is pressed into the middle. In the evening, after prayers, the eldest in the family would bless the appam, cut it and serve it to the others for dinner. It is dipped into a syrup that we called kuruma, also called paal in some places. The paal is made with jaggery and coconut milk, says Preethi. Nowadays, Preethi cooks the paal and a friend of hers makes the appam and they share it.Wayanad-based Babu Stephen, son of YouTuber Annamma Pulivelil aka Annamma chedathi (Annammachedathi Special) explains that in their parish, the Indri appam is steamed in banana leaves while the Pesaha appam is called Kurishu appam as it has the palm leaf cross embedded in the middle.Pesaha appam (unleavened bread) and paal are made on Maundy Thursday in many Christian homes in Kerala | Photo Credit: Bindu JoyTraditions prevailAll my siblings, and our children gather at our house since my mother stays with us. After prayers, it is the kurishu appam, made with a little sugar, that is cut by the eldest in the family and shared amongst all of us. Usually, after the service, this sharing of food was done in the church. This time, in accordance with the COVID-19 protocol, all of us in our parish have been told to conduct the prayers at home after the service, says Babu.Hot cross buns | Photo Credit: PexelsIn many homes in Kollam, the dough, made of rice flour, coconut and jaggery, is filled in vayana leaves (bay leaves) folded into cones and steamed, says Jessie Ignatius, a former school teacher from Kollam. However, my mother in Thrissur used to make pulikatha appam (unfermented appam) made without yeast. It is made with rice, urad dal, shallots and coconut and made as soon as the mixture was ground. My mother used to make the kurukku with rice powder, coconut milk, jaggery, a bit of ghee and roasted cumin. I used to love the flavour of the cumin in the kurukku, she says.Marina says that some people might add a bit of jaggery to the Pesaha appam and that gives it a brownish tone. And the paal could be seasoned with cardamom too. Kalathappam, a bread made in a pot, is also made on Maundy Thursday by some families. Made of rice flour and lightly spiced, there were fried shallots and coconut in it, she says.The flavouring agents and the names might differ but not the solemnity of the occasion when families break bread together for Maundy Thursday, symbolising the Last Supper of Jesus Christ.Recipe of Pesaha AppamIngredientsRice powder: 1 cupUrad dal: 3 table spoonCoconut grated: 1 cupGarlic: 1Small onion: 2Jeera: a pinchWater: 1 to 1 cupsMethodSoak urad dal for 30 minutes and grind it into a smooth paste by adding little water. Grind coconut (don't grind the coconut to fine paste) with garlic, small onion and jeera with little water. Add salt and boil water and when it starts boiling add rice powder, little at a time and mix well. Now add the dal mixture and coconut mixture and mix well. Transfer the batter to a greased pan and place a cross made with palm leaves. Now steam for 20 minutes. Cool it and transfer to the serving dish.How to make paalMelt jaggery (200 gm) with water and strain it. Add the thick coconut milk (4 cups) and stir for few seconds, don't let it boil. Take it off the stove and serve cool.Courtesy: Marina Charles",‘Pesaha’ appam is a must on Maundy Thursday in many Christian households in Kerala,ONION
2021-04-03,https://www.newindianexpress.com/cities/hyderabad/2021/apr/03/after-good-friday-devout-christians-look-forward-to-online-easter-services-2285043.html,"Kakoli Mukherjee ByExpress News ServiceHYDERABAD : Its that time of the year again when followers of Christian faith in the city will celebrate the Resurrection of Christ on Sunday. Just like last year, the Covid-19 pandemic has thrown a spanner in the celebrations with number of positive cases rising every day. However, it has not dulled the spirit of worshippers who are happy to attend the virtual services from home and share a meal with their families.Talking about the services being held over the Holy Week, Father MM Kennedy from St Francis Xavier Church in Yapral, says: Our services are being held both physically and virtually. We are following government restrictions and allowing only a certain number of worshippers inside the church so as to follow physical distancing. We have open grounds outside the church and that makes the process easier. We had the morning service which reminds us of Jesus instituting the Eucharist and priesthood.Besides these, we carry out the ritual of washing feet which symbolises work of the Lord as service to the people. Today, on Good Friday, we remember the passion and death of our Lord, and we marked the Way of The Cross (14 stations) by taking all safety precautions. During the evening, we will follow Veneration of The Cross. On Saturday, at around 10 pm, we will hold the night Easter vigil which marks the Resurrection of Jesus.Roydin Roach, who is the Telangana president of the All India Catholic Union, says: In Hyderabad, we saw a large number of people offering prayers on Good Friday while taking Covid-19 precautions. Many parishes are broadcasting their services online through their own YouTube channels or Facebook Live feature. Liturgy TV, Catholic Hub and Divyavani TV are a few of the channels which telecast all services, in Hindi and English, live from city churches. We saw tableau and plays enacted across churches on Good Friday. At a few places, only the actors were allowed on the church grounds, while worshippers watched them from home. The night Easter Vigil, which can go on till 1:30 am, is the most important service of Easter. It involves rituals like lighting the candles and sprinkling of holy water.Easter is also the time of feasting for those who have been observing Lent fast for 40 days. Talking about the different dishes that are prepared during the fasting period and its culmination, Jacqueline Nicholas from Jackies Patisserie & Cafe says: My chicken roasts sell like hot cakes on Easter. Many followers do not eat meat during the 40-day period. The fasting ends after the Easter night service and people celebrate with chicken roasts along with grilled vegetables and Easter eggs. We have the tradition of eating hot cross buns and Kanji rice with various chutneys on Good Friday. The dish, to which no tadka is added, is prepared with rice, roasted moong dal and grated coconut. I made groundnut, onion and coconut chutneys to go with Kanji this year.Sujatha Stephen, who is a nutritionist with Yashodha Hospital, says that Easter is an auspicious festival for her family. Describing a typical Easter day at her home, she says: We start preparations for Easter after Good Friday. Due to the pandemic, we are not attending the early morning service at church and will be part of it virtually. In the pre-pandemic days, I used to go to St Georges Church. We would decorate the church with jasmine flowers. After the service, we would be offered Easter eggs which were boiled eggs with coloured shells. At home, we eat chocolate Easter eggs, cakes and a special meal. We marinate turkey in the morning and grill it to perfection. Later, at a lunch attended by friends and family, we serve it with either coconut rice or chicken biryani. Kakoli Mukherjee kakoli_mukherjee@newindianexpress.com @KakoliMukherje2","After Good Friday, devout Christians look forward to online Easter services",ONION
