PUBLISHEDDATE,ARTICLEURL,TEXT,ARTICLETITLE,COMMODITY
2021-07-14,https://www.thehindu.com/life-and-style/food/burgers-from-burgerama-in-delhi-ncr/article35316338.ece,"Burgerama in Delhi-NCR offers more than just a patty in a bun  I had my first burger even before I read my first Archie Comic. One of my earlier memories is of a cycle-led cart stopping by the place where I  and a lot of other hungry young lads  lived. The compartment at the back of the cycle was filled with flaky patties and vegetable burgers  essentially a potato patty between two small soft buns. I preferred the burgers to the patties, which were so flaky that they disintegrated when you touched them. The vendor would place one on a paper plate and squeeze some ketchup on the side. Food couldnt ever get better, I used to think, biting into the bun-and-potato.  Over the years, burgers have gone through a metamorphosis. I think my first classy burgers were at Wengers restaurant, just above the confectionery, and then, several years later, at Nirulas in Connaught Place. Until some years ago, burgers were simple dishes  two pieces of soft bun holding together a juicy lamb or chicken patty. The buns were often speckled with sesame seeds, the insides were brushed with mayo or sometimes with thousand island sauce. A crisp lettuce leaf and rings of onion added taste and texture.  But that was then. Over the past few years, I have had various kinds of burgers, prepared with imagination and ingredients such as blue cheese, caramelised onions, imported bacon, celery slaw, fried eggs and what have you.  A foodie friend mentioned ordering burgers from a place called Burgerama. I had heard about it, too, but hadnt tried out their fare. It is a delivery chain that serves Delhi-NCR (order at burgerama.in or on Zomato; 215 to 545). I learnt later that it was the brainchild of three friends and the focus was on cheeseburgers.  Ours is a meat loving home, so when we looked at the website, the focus was on different kinds of meat. We agreed on a bender lamb burger, bacon double cheese chicken burger, and T-Rex tenderloin burger. The sides consisted of onion rings, French fries, hot wings, and galaxy bombs (Panko-crusted deep fried chocolate).  I liked the sides, especially the crispy wings and the crunchy onion rings. The potato fries were a bit limp, though, but that could have been because of the weather.  What I really enjoyed was the bacon wrapped lamb burger. I had a large bite from it and thought the bacon had given the lamb a nice kick, and the fried egg and smoked paprika mayo had added to the taste.  The Galaxy Bombs at Burgerama | Photo Credit: Special arrangement  The quarter pound patty of the tenderloin burger came with caramelised onion, a cheese blend, lettuce, pickle, and a blue cheese dressing. I enjoyed it, but would have liked it more had the patty been softer. But I suppose you cant have the tenderloin rare when you are running a delivery outfit. The chicken and cheese burger got a thumbs up, too, as did the delicious galaxy bombs, which were crisp and sweet.  Burgerama offers an Oink Oink burger, with honey-glazed smoked pulled pork, BBQ sauce, lettuce, jalapenos, and smoked paprika mayo. For vegetarians, there is something called Plane Jane (batter-fried cottage cheese patty topped with sun-dried tomatoes, fresh lettuce, pickles, and smoked paprika mayo); and Spicy Leela, which has all these, topped with hot sauces.  Burgers, clearly, are not what they used to be. For burger lovers, theres a whole new world out there. Blue cheese, anyone?  The writer is a seasoned food critic",Blue cheese in a burger at Burgerama,ONION
2021-07-13,https://timesofindia.indiatimes.com/city/vadodara/vadodara-policemen-under-scanner-for-violent-behaviour/articleshow/84356340.cms,"VADODARA: Touted as the cultural capital of Gujarat, the city has witnessed some boorish behaviour of the cops over the last few days. Some policemen have come under the scanner for ill-treating and assaulting citizens over minor issues. City police commissioner Shamsher Singh has acted sternly and either transferred or suspended the erring policemen.But the violent streak of the cops doesnt seem to end. On the night of July 10, a shop owner in Manjalpur area was brutally assaulted by two police constables posted in Manjalpur police station. The shop owner pleaded with folded hands but the cops kept thrashing him till his face got swollen. Both the cops were suspended on Monday morning.Five days ago, a vegetable vendor was also thrashed by a head constable of a police control room (PCR) van in Sama area. Ganesh Sonkar alleged that the cop identified as Suresh Rathwa demanded 20kg of onion for free. When Sonkar asked for money, Suresh allegedly assaulted him. Instead of acting against the cop, the Sama police had acted against Sonkar for not wearing a face mask in a public place.Senior police official, though, transferred the head constable and ordered an inquiry against him. Some days ago a 45-year-old man was reportedly assaulted by a police constable in Chhani. Govind Rathwa had to undergo treatment in a private hospital but he refused to file a complaint against the constable.Actions have been taken in such cases whenever we get complaints. I keep telling the policemen that they should take legal steps as per the situation but never misbehave or use violence on public. In our large police force, very few cops misbehave with people, city police commissioner Shamsher Singh told TOI.Last month, D S Patel, a police sub-inspector posted in Navapura police station that time had beaten up an 18-year-old boy who had not worn a face mask. The incident occurred when Ritham Patel was driving his car without wearing a face mask near Polo Ground. The cops intercepted him and D S Patel was accused of beating up the boy along with some other cops.An inquiry was ordered against Patel who was later transferred to the police control room. Patel had also allegedly assaulted ex-Member of Parliament Satyajit Gaekwad over a minor issue near Polo Ground last year.",Vadodara policemen under scanner for violent behaviour,ONION
2021-07-13,https://www.thehindu.com/news/national/karnataka/2-killed-after-truck-jumps-over-divider-on-bengaluru-pune-highway/article35295400.ece,"The truck hit a lorry on the other side while the container fell on a van parked nearby  Two persons died in a collision involving three vehicles near Sutagatti-Vantamuri villages on the BengaluruPune highway on July 12 night.  A truck carrying a container filled with maize flour was going from Shivamogga in Karnataka to Pune in Maharashtra. The driver lost control and the vehicle went over the divider. It hit a lorry carrying onion from Kolhapur in Maharashtra to Belagavi in Karnataka.  The force of the collision was such that the container flew off the truck and hit a van containing chemicals, which was parked nearby. The van was damaged, but no one was injured.  The deceased have been recognised as Niraj, 30, from Uttar Pradesh and Rajendra, 35, from Bheed district in Maharashtra.  The road was blocked by the vehicles involved in the accident, which resulted in a traffic jam.  The Belagavi police were alerted. They rushed to the spot and cleared the damaged vehicles from the road using earthmovers. The road was opened for traffic by daybreak, police said.  Some people stole onions and flour that was scattered by the collision before police arrived and cleared the site.",2 killed after truck jumps over divider on Bengaluru-Pune highway,ONION
2021-07-27,https://indianexpress.com/article/lifestyle/life-style/this-monsoon-keep-hair-fall-at-bay-with-these-easy-home-remedies-7422826/,"After months of searing summer heat, the monsoon is finally here to give us some respite. But, our hair isnt as happy as the excessive moisture in the environment during monsoon makes them brittle and frizzy often leading to hair fall  which is one of the most common problems during the rainy season, coupled with dull hair and dandruff.  However, with some extra care, you can significantly reduce hair fall this season and keep your locks healthy.  Taking care of your hair becomes much more difficult during the rainy season. But with a little extra care, you can enjoy this season to the fullest without worrying about your hair, Dr Nitika Kohli, ayurvedic doctor, wrote in an Instagram post as she shared some useful remedies.  View this post on Instagram A post shared by Dr Nitika Kohli (@drnitikakohli)  Onion juice  Blend onion to extract its juice and apply it on your scalp with a cotton swab. Leave it on for 30-50 minutes and then wash your hair with water. Use this remedy twice a week.  ALSO READ | Five common mistakes to avoid while using turmeric on your skin  Hibiscus hair mask  Grind hibiscus leaves and flowers to make a fine paste. Add in some curd and mix well to get a smooth consistency. Apply the mixture to your scalp and hair and let it sit for an hour. Shampoo your hair with lukewarm water. Use the remedy once or twice a week.  Aloe vera",Monsoon tips: Effective home remedies to keep hair fall at bay,ONION
2021-07-30,https://www.thehindu.com/life-and-style/food/simply-good-panta-bhaat-brings-back-memories-of-childhood-summers/article35580302.ece,"Long before Masterchef, the humble fermented rice dish was cool in its own right  When I called up a distant aunt the other day and mentioned how a version of the panta bhat, or poita bhat, as we call it in Assam, has made it to the grand finale of an internationally acclaimed food show, her immediate reaction was surprise. Really? she exclaimed, Ordinary poita bhat?  The Melbourne-born chef of Bangladeshi origin, Kishwar Chowdhury, may not have won the recently concluded MasterChef Australia contest, but by wowing the judges with her panta bhat, she has brought into the limelight a humble dish thats consumed in several parts of India and is called by as many names. For Bengalis, its panta bhat, for Odiyas, pakhala bhat, for Malayalis, vella choru or pazham kanji, for Tamils, pazhaya soru. Chowdhury gave her own twist to this dish, presenting it as Smoked Rice Water.  But in each of its versions, the essence of the dish remains the same: leftover rice, fermented overnight in water. Its versatility lies in the way it can take on a range of accompaniments or stand on its own.  Ideal for summer  My first introduction to this dish was at the age of 10 or 11 on a hot and humid summer day. As I waited for my parents to pick me up from school, my best friend invited me for a quick snack at her home, a stones throw away. No harm, I thought and followed her. We took off our shoes at the door and as she ran in to call her mom, I noticed her grandmother slurping what looked like watery gruel from a bowl. There it was, poita bhat.  Curious, I asked my friend if we could have some of that. And I can never forget that taste. With a dash of mustard oil and lime juice, it was one of the best summer meals I have ever had. We gorged on the accompaniments too  aloo pitika (mashed potato) and bengena bhoja (eggplant fritters), which are popular side dishes served with poita bhat in Assam  and slurped our way to the end.  The next time I relished it as much was years later, when I was on an assignment in Odisha. A field worker invited me to an impromptu lunch and as we sat down to feast on an array of dishes, he pulled out a bowl of what looked like poita bhat. Pakhala bhat, he said, In the hot summer months, this is my staple meal. Needless to say, he had to forego much of his pakhala bhat as I slurped it up with green chillies, onion and lime.  Health food  Light on the stomach, cooling and nutritious, poita bhats origins are as simple as the dish. In most States where rice is a staple, soaking the leftover portion in water overnight and consuming it the next morning made sense at a time when refrigerators were not common. This ensured there was no wastage. Left to ferment overnight, the gruelly rice has a high starch content, which sustained farmers and manual labourers for a long period of time after they ate it for breakfast. As we know today, its high Vitamin B12 and probiotic content makes it good for health. Poita bhat was also easy to prepare, standing ready even before the kitchen fire was started for the days meals.  Panta bhaat with hilsa. | Photo Credit: Wiki Commons  Vella choru was my usual breakfast during schooldays, says Nandini, my friend from Kerala, in our Whatsapp group. I didnt like eating dosa, idli or upma, but vella choru with curd I loved. Sangya, my Odia friend, who now lives in Delhi, says she still eats pakhala bhat every once in a while. She shared a picture of her Amsterdam-based friends lunch the other day. On the table was a plate of colourful veggies and fritters, nestling close to a bowl of pakhala bhat.  RECIPE  Poita bhat  Ingredients  1 cup of cooked rice soaked in  2 cups of water overnight   cup buttermilk or  cup curd  2 tbsp onion, chopped  2 green chillies, chopped  Salt to taste  Method  Let the cooked rice ferment in water overnight.  Next morning, pour the rice gruel in a bowl and add the buttermilk or curd. Mix well.  Add the chopped onion, chopped chillies and salt.  A dash of mustard oil and a wedge of lemon, and your poita bhat is ready to be served.    The writer is a Jodhpur-based freelance journalist.","The versatile panta bhat has many names, and brings back childhood memories",ONION
2021-08-06,https://www.thehindu.com/life-and-style/food/prateek-sadhu-of-masque-distilling-india-on-a-plate/article35766620.ece,"The countrys most experimental chef is hitting the road, to celebrate Mumbais Masque turning five and to share his ingredients-first approach with pop-ups in five cities  It is a dark and stormy night. Traffic on Delhis pot-holed roads has been crawling for hours. In the quiet, tree-lined neighbourhood of Friends Colony, however, 35-odd diners at boutique hotel The Manor are getting ready for a treat: a 10-course menu featuring some of the bravest, most avant garde Indian cooking yet.  Inside, chef Prateek Sadhu, 34, is readying to roll it all out. This is the first day of a three-day pop-up of Masque, his Mumbai restaurant. Tickets sold out within 48 hours of announcement. Pop-ups in four other cities are to follow  Bengaluru, Chennai, Kolkata and Leh, where Sadhu will keep adding elements to the dishes, building newer ones as he finds inspiration in local cuisines and ingredients.  Also read | Indias new spice merchants  Unique and universal  Before the pandemic hit, Sadhu had been doing precisely this at Masque  a restaurant sans a menu, where guests are encouraged to sit inside a lab and experience how he puts together thoughts and flavours after trips to different regions and farms across the country. The restaurant, which turns five this September, recently made it to number 32 on Asias 50 Best Restaurants list of 2021  the only Indian entry apart from Indian Accent in New Delhi (at number 18).  The Masque team touches down in Delhi | Photo Credit: @masquerestaurant  But this is the first time that many gourmands in other Indian cities are getting to experience Sadhus distinctive cooking because even within our competitive, growing restaurantscape, Masque is more niche than popular, more experimental than mass. Which is a shame because it is perhaps the only one in the country that prizes pure experimentation over commerce. If Masque was cinema, it would have been Satyajit Rays.  Like art house cinema, there is both the unique and the universal in Sadhus oeuvre. Take, for example, some of his dishes from the Delhi pop-up: course one was Carrot kanji, bhekti  brined and cured fish, pickled Kashmiri cherry, pickled lime, gongura greens, aam papad, and carrot kanji. Sour is perhaps the least accepted of tastes with the Indian palate. But Sadhu pushes that boundary with this study in sour. Fermented traditions from across India have been layered  northern Indian kanji, eastern aam papad, southern gongura, the pickled lime of the numerous pan-Indian achars, and the elusive Kashmiri cherry.  In course two, Sadhu puts out Corn pani puri, kalari kulcha, ghevar and chok charwan with tomato rasam. What could be the thread of thought running through his mind while putting together such disparate regional influences? A study in textures: of crusts and breads from several Indian regions. The Marwari pure veg ghevar serves as a base for Kashmiri lamb liver, startling purists, but look closely and youll find a redefining of the idea of Indian bread.  Part of the menu at the Delhi pop-up | Photo Credit: Special arrangement  Food that doesnt pander  Sadhu seems to use his individual experiences  his Kashmiri roots, travels, and the innate internationalism that comes from his stints at top global restaurants such as Alinea, Le Bernardin and Noma  as the lens to look at more universal Indian culinary traditions. Kashmiri lamb neck yakhni meets morels miso in what turns out to be his most popular dish that evening; rogan josh sausage and katlam, the Jammu bread, masquerade with NYC casual-chic; and Pondicherry chocolate gets combined with indigenous central Indian flower liqueur mahua that not many urban Indians have tasted before.  Also read | Sadhu and Krugs onion chronicles  In a way what he does is the opposite of what I do because I do not mix different regional cuisines, chef Manish Mehrotra, one of Sadhus guests that evening, who came with his teenage daughter Adah, tells The Hindu Weekend. Mehrotra, widely regarded as the father of modern Indian cuisine, whose signature Indian Accent dishes continue to be copied and regurgitated by chefs in even small towns, finds Sadhus voice to be among the most unique in Indian kitchens. He mixes cuisines and is not afraid to experiment even if diners here do not accept certain tastes or the importance of things like acidity, something that all Michelin-level dining pays attention to internationally, he points out.  The five-year plan Influenced by zero wastage, techniques like fermentation, and local ingredients sourced directly from farms, the philosophy behind Masque has remained the same since it launched. Even as Sadhu sharpened his focus to researching diverse subregional cuisines. So what is his ambition in the next five years? It is always to survive, he says candidly, about the difficulty of balancing commercial success with cutting-edge experimentation. The pandemic has made this tougher. The next few years will definitely have to be about healing from our current difficult scenario. But, personally, my ambition is to dig deeper into Indian cuisines. I feel I have only scratched the surface. I want to look at home recipes, bring them into the restaurant after R&D, understand different regions and subregions, castes and sub-castes, and how food has changed so many things in the country, he says.  Sadhus signature style is neither purist nor populist, and it is definitely not derivative. In fact, his individualistic experimentation is one of the ways forward for modern Indian food. ITCs Manisha Bhasin concurs. There are two schools of thought when it comes to Indian food, one is purist and other is inventive. But what I like about Prateeks food is that it is not about presentations; the food talks to me, there is a purity in that, says Bhasin. ITC hotels will be the venues for Sadhus pop-ups in Chennai, Kolkata and Bengaluru.  Younger chefs like Dhruv Oberoi of Olive, who was also a guest at the pop-up, add that this is perhaps the boldest experimentation in Indian gastronomy yet  with a sense of internationalism in the dishes. While a few of the courses like the lamb yakhni were comfort, there were bold combinations like chocolate and mahua that I had never experienced before, says Oberoi.  Chefs Dhruv Oberoi, Manisha Bhasin and Manish Mehrotra  What is authentic?  I remember the first meal I had at Masque, in the first week of its opening in Mumbai in 2016 in a mill compound that had fallen into disuse. There was Himalayan rye bread and sea buckthorn berries from Leh, there were textures of potato using techniques like dehydration, cooking in an earthen pit, and sous vide, there was olive oil specially pressed from Rajasthan. The whole approach was described as botanical bistronomy  what appeared to be a mix of international styles of cooking using carefully-sourced (and often unheard of) regional ingredients. Over the last five years, that focus has sharpened.  Koji-cured barramundi, carrot & passion fruit kanji  Sadhu now uses Indian ingredients as well as cooking styles and techniques and refashions them. But the sense of internationalism still binds all these. Does he see his food as Indian? Indian food as we know it today is a result of constant evolution. What is authentic? Is my mothers rogan josh more authentic than what my aunt cooks? Authentic is subjective; food is the result of migration and is constantly evolving. So while tradition is important, innovation is critical, he says. His Indian food, he points out, is not about returning to regional recipes and simply plating them with new tweaks. It demands revisiting ingredients in altogether new ways that can build cross-cultural bridges, he adds.  As you eat a bhetki with clam rogan with a puri flavoured with Goan sausage, thinking cross-cultural bridges is inevitable. The pop-up menu will continue to evolve over all its stops  much like the journey of food itself.  The upcoming pop-ups will be priced 5,500 plus taxes. Bengaluru on August 20-21 and Chennai on August 27-28.  Chef Sadhu and his team  Hat tip  Sadhus innovative cooking and internationalism (that comes from study at the Culinary Institute of America plus work at top global restaurants) have been winning him recognition ever since Masque launched. In its first year, it was ranked among the top 10 on Food Tanks 2016 list of restaurant innovators in the world. In 2020, the restaurant received the Miele One To Watch award in Asias 50 Best Restaurants list before debuting this year on the main list. Sadhu has been the first Indian chef to be a brand ambassador for Champagne brand Krug and, more recently, he contributed a simple but inventive beets with peach chunda recipe for the #Amexforfoodies cookbook featuring recipes by top global chefs. Before the pandemic, Masque had also been collaborating with leading chefs across the world to host pop-ups, including with Matt Orlando who helms Copenhagens Amass, in 2017.",Prateek Sadhu of Masque: distilling India on a plate,ONION
2021-08-12,https://indianexpress.com/article/technology/science/soft-robots-waste-onion-peels-dst-7450800/,"Using porous carbon nanoparticles from waste onion peels, a team of scientists have developed soft robotic actuators with enhanced photomechanical capacity, the Department of Science and Technology said on Tuesday.  The actuators can act as efficient traps for illuminating low-power near-infrared (NIR) light and can convert a control signal into mechanical motion with bioengineering applications such as drug delivery, wearable and assistive devices, prostheses, and even artificial organs.  Soft robots or actuators consisting of rubber-like polymer with embedded nanomaterial, which convert a source of energy to mechanical motion, have been gaining much interest with targeted applications in areas, including bio-medical, military, and remote space operations.  Generation of predesigned motion facilitated by their flexibility, affordability, and easy customisation are the main reasons for such interest. The high thermal conductivity of these nanoforms results in rapid distribution of the heat generated locally by thermal and photo-thermal stimuli, the DST said.  To take these actuators to the next level of development, heat traps can be created to capture and contain the generated heat for slightly longer durations such that the achieved photomechanical actuation can be enhanced.  A team led by prof. S Krishna Prasad at the Centre for Nano and Soft Matter Sciences (CeNS), Bengaluru, has realised such a possibility by utilising porous carbon nanoparticles (PCNs), the DST said.  In the research work recently published in the Journal of Nanostructure in Chemistry, the porous nano-carbons (PCN) prepared from waste onion peels by Gurumurthy Hegde at the BMS College of Engineering in Bengaluru, it added.  The specific surface area of the high porosity PCNs were efficient traps for the illuminating low-power near-infrared (NIR) light resulting in the film comprising PCNs and PDMS achieving large magnitude (multi-mm) actuation with fast (sub-second) responses. These features are seldom obtained in single-layer films containing any other carbon nanostructure. The researchers attribute the heat-trapping capability to the manner in which the PCN is prepared.  Pragnya Satapathy, a senior research fellow, said, Exhaustive measurements performed show that the photothermal conversion efficiency and the heat-trapping capability is seen to be strongly correlated with the pyrolysis temperature employed for PCN preparation, and thus is an effective control parameter.  As a value addition, the team also found with an additional ultrathin (30 nm) gold layer, the actuation magnitude could be more than doubled, and more importantly, bidirectional photo-controlled face-sensitive movement was realised. As a novel application-oriented demonstration of the process, the team fabricated a near-infrared-driven electrical switch, which could activate LED circuits and could be used for other similar applications, it added.",Scientists develop soft robots from waste onion peels,ONION
