PUBLISHEDDATE,ARTICLEURL,TEXT,ARTICLETITLE,COMMODITY
2021-05-12,https://www.thehindu.com/news/national/andhra-pradesh/steps-taken-to-ramp-up-oxygen-storage-capacity/article34545323.ece,"Monitoring cells will be set up to prevent wastage, disruption: AllaDeputy Chief Minister and Minister of Health Alla Kali Krishna Srinivas has said that steps have been taken to increase the oxygen storage capacity from the existing 517 tonnes to 600 tonnes to ensure its timely supply to the hospitals.Monitoring cells were being set up in all the hospitals to prevent wastage of oxygen and disruptions in its supply, which had caused the death of many COVID-19 patients so far in the State, Mr. Srinivas told the media after a meeting of the Cabinet Sub-Committee on COVID-19 organised at the APIIC headquarters at Mangalagiri on Wednesday.The District Collectors had been instructed to get the condition of oxygen pipelines checked from time to time to avert leakages.Mr. Srinivas pointed out that Chief Minister Y.S. Jagan Mohan Reddy had requested the Central government to despatch 910 tonnes of oxygen to meet the growing demand for it.Of the 49 new oxygen plants for which clearance has been given a few days ago, some have already started production, he said.The government is trying its best to administer vaccine to the people free of cost. We stood as a model for other States by distributing 60 lakh vaccines in a single day, the Minister claimed.Mr. Srinivas said due priority was being given to prevent black marketing of Remdesivir injections. A task force had been set up for the purpose. Kits needed by COVID-19 patients in home isolation were being supplied as per guidelines, and the number of beds was being increased as the pandemic continued to spread, he added.Agriculture Minister K. Kanna Babu said ambulances bound for Telangana were not being stopped at the borders, and over 15,000 beds were provided at the COIVD Care Centres.He cautioned people against believing in rumours that COIVD-19 could be prevented by applying cow dung or by putting onion juice in the nose. The ideal course of action is to consult doctors to ascertain whether a particular symptom is that of COVID-19, he added.",‘Steps taken to ramp up oxygen storage capacity’,ONION
2021-05-13,https://indianexpress.com/article/lifestyle/life-style/here-is-why-you-hair-needs-red-onion-check-it-out-here-7301230/,"Have you tried red onion to address your hair woes? (Source: Getty/Thinkstock)You may apply numerous products to your hair hoping to make them healthy, bouncy, and shiny. But what if we tell you that the answer to all your hair woes lies in one of the most common kitchen ingredients?Wondering what we are talking about? Its red onion, the simple ingredient that can give you nourished, dandruff-free, long, and lustrous hair.Red onion is a storehouse of sulphur and is rich in anti-bacterial and anti-fungal properties. Hence, it has been used to strengthen hair and give all the nutrients it needs for healthy growth. Owing to its promising results, it is now a part of the beauty industry, too, said Nitin Passi, managing director, Lotus Herbals.Below, he shares some of its benefits:READ | Bipasha Basu swears by this onion hack to prevent hair fall; check it outHelps in hair growthThe ingredient helps maintain the pH value of the scalp and also aids in improving blood circulation, which also aids growth, added Passi.Combats hair lossPollution and other external stressors cause hair to become weak, thus resulting in hair fall. Therefore, it is recommended to use red onion oil as it is filled with antioxidants that produce enzymes restricting hair loss.Kiss dry and damaged hair goodbye!Red onion is a magic ingredient to cure dry and damaged hair because it contains amino acids. The goodness of the juice works miraculously in eliminating impurities present in the pores while also repairing damaged hair and bringing back its shine, explained Passi.No dandruff and itchy scalpRed onion juice is one of the best natural ingredients to get rid of dandruff and scalp irritation. This is because it contains properties that make it hard for the survival of bacteria, said Passi.Improves hair texture and adds shineThe properties of red onion are such that it helps in strengthening hair from its roots while also nourishing and improving its texture. It also helps in making hair shine like never before as a result of improved circulation of blood in the scalp, he explained.For more lifestyle news, follow us: Twitter: lifestyle_ie | Facebook: IE Lifestyle | Instagram: ie_lifestyle",Red onion: Is it beneficial for hair?,ONION
2021-05-13,https://indianexpress.com/article/cities/pune/markets-remain-close-traders-go-to-farmers-fields-in-nashik-7313995/,"In response to the 10-day lockdown in Nashik district, traders and market committees have decided to go directly to farmers fields to buy onions. The Lasalgaon Market Committee has made a detailed plan for farmers to sell their produce at the farm gate under its supervision to prevent complaints of cheating.Nashik, like other districts of Maharashtra, has resorted to a strict 10-day lockdown to break the chain of transmission of Covid-19. During lockdown, which is to last till May 23, household essentials like milk and vegetables will be delivered at home. The district collector has also ordered the closure of agricultural produce marketing committees, but farmers who wish to sell their produce are free to do so as traders are allowed to carry out trade directly at the farm gate.At present, farmers have late kharif and rabi onions in storage. While the former has a shorter shelf life, the latter, due to its lower moisture content, has a longer shelf life. Mostly farmers will store their rabi produce, which has been harvested after March, in on-field moisture proof structures called kanda chawls to stop them sprouting green shoots. This stored onion would feed the market till the arrival of the new stock after Diwali.Survarna Jagtap, chairperson of Lasalgaons wholesale market in Niphad taluka of the district, said closure of trade in wholesale markets made preparation for farm gate trade possible. Employees of the market committees had been assigned to traders and commission agents, whom farmers could contact for direct sale, Jagtap said. In case a farmer wants to sell, they are advised to contact traders. The trade would be carried out at the farm gate under the supervision of market representatives, she said.The state has long denotified vegetables from market committees that allows traders to buy from farmers without the supervision of market committees. But numerous complaints of cheating have made farmers wary of farm gate sales.Nashik is also the centre for large-scale procurement of onions by farmer producer companies (FPC). Eknath Sanap, director of Goda Dharna FPC in Sinnar taluka of the district, said their procurement centres were open and farmers who wanted to sell were bringing in their produce. In Ahmednagar, Pune, the FPCs procure at the farm gate, he said.MahaFPC  the consortium of FPCs in the state  has been mandated to procure around 25,000 tonnes of onion by National Agricultural Cooperative Marketing Federation (NAFED), but the consortium is hopeful of procuring 50,000 tonnes. State-wise, NAFED intends to procure around 1.5 lakh tonnes of the bulb this season.Sanap and Jagtap said at present farmers were not in a hurry to sell their produce. Jagtap also said late kharif onions had higher probability of moisture loss, so around 10 to 15 per cent farmers would like to offload their produce. Sanap, however, said most farmers were wary of social contact as the spread of Covid-19 in rural areas was like wildfire. While trade is on, few are venturing out, he added.","Markets remain closed, traders go to farmers’ fields in Nashik",ONION
2021-05-15,https://www.thehindu.com/news/cities/chennai/a-banquet-on-the-streets/article34563790.ece,"On most days, E Nilavennis morning routine begins around 4.30 a.m. when she washes a variety of vegetables  passels of ladies finger, brinjal, onion and tomato, with each weighing five kilos. Chopped, the vegetables are boiled with rice to make vegetable rice.Her husband, M Eassiya, a pastor at a church in Sholinganallur, helps her pack the meals along with 250 ml water bottles. Later, they drive across Chennai to distribute the food to the homeless and mentally-challenged persons.Kasimedu, Royapuram, Vyasarpadi, R K Nagar, Park Town and Broadway are among the areas routinely covered by them.Since the lockdown began on May 12, on an average, every day, over 100 food packets are being distributed. We are helping the needy with our limited resources depending on the donations we receive. We focus on destitute, homeless and physically-challenged persons, says 58-year-old Eassiya.Prior to the lockdown, the couple gave a bath and haircut to mentally-challenged persons in the streets and roads of Old Mahabalipuram Road and East Coast Road.On their birthdays and during festivals, donors also sponsor food packets for them to distribute to the needy. Nilavenni can be contacted at 7845542439",A ‘banquet’ on the streets,ONION
2021-05-16,https://mumbaimirror.indiatimes.com/mumbai/cover-story/how-hiware-bazar-became-covid-free-sarpanchtantra/articleshow/82667110.cms,"Popatrao PawarcovidHiware BazarSEOPawargram panchayat.PuneZilla ParishadIts not rocket science but Up-Sarpanch Padma Shrishows how a good leader can make a differenceWhile India is experiencing a horrific second wave of thepandemic leaving several lakhs of people dead and millions infected,in Maharashtras Ahmednagar district has become covid free. This is all thanks to the Padma Shri Popatrao Pawar, who has been the Up-Sarpanch of the village since 1990.Impressed by Pawars model of slaying the virus, the Collector and Special Executive Officer () of Ahmednagar district called him to guide around 1,300 village heads on how to become covid-free in their respective villages.Talking about how he went about controlling the spread of the virus,says, In March, one of the villagers had covid symptoms. He was immediately quarantined in a nearby training school, as were all the people who came in contact with him. While we waited for the RT-PCR results, we administered Rapid Antigen Tests for quick results.This is not the first time Pawar has demonstrated his vision for the benefit of the village. He has been widely recognised for his work on water harvesting, water conservation and transforming a drought-prone area into a lush green village.We had 52 covid cases at one time between March and April. After they tested positive, we immediately started treating them with a doctors help. Four of them required ventilators so they were shifted to a hospital. Unfortunately, we lost one of our men. However today we are covid free, says Pawar, proudly.The villagers strictly follow covid appropriate behaviour. Besides following social distancing, every house uses the sanitiser supplied by the, uses masks and four teams keep a tab on the markets to see that covid guidelines are followed.Our main crops are onion, potato and seasonal vegetables. However, villagers are not allowed to grow sugarcane, grapes or even pomegranate as they require huge amounts of water and the village has been focusing on conserving its groundwater level, said Pawar.Due to onion production, several labourers from Marathwada and Konkan keep on coming to our village for work. We have asked them to stay on the farms in sheds and the villagers have been asked to maintain distance while working with them in the fields, said Pawar.Every week teams of gram panchayat staff and volunteers check the villagers oxygen saturation and temperature. Those from Hiware Bazar who go to other villages are advised to sanitise upon return and isolate themselves from their families.This has worked for us because our villagers have cooperated with us. Till now we have vaccinated around 200 senior citizens in our small village that has a population of 1,600, said Prasanna Pawar, son of Popatrao Pawar.Since Pawar took over as the sarpanch in 1990 after completing his post-graduation, Hiware Bazar has built several dams, percolation tanks and bunds. The villagers have always supported my efforts since 1990, said Pawar who has been elected continuously since then.The villagers have not only planted trees but built dams, focused on family planning, laying underground drainage pipeline, clean water, street-lights and banned open defecation. Weve had reverse migration from Mumbai andas peoples incomes went up with more and more land getting access to water, said Pawar who has been unopposed as the leader of the village and even conferred with a Padma Shri for his efforts.Appreciating Hiware Bazars efforts, Rajendra Kshirsagar, chief executive officer,, Ahmednagar, said, They made sure that all the guidelines given by government and health officials were duly followed to become a successful model with zero cases. In rural areas, a lot of people use handkerchieves instead of masks.But here, the village leaders made sure everybody uses masks, follows social distancing and most importantly, ensured that they isolated the person and his contacts while waiting for the test reports to stop further spread of the virus, said Kshirsagar.",How Hiware Bazaar became Covid free,ONION
2021-05-22,https://www.newindianexpress.com/cities/hyderabad/2021/may/22/green--tangy-add-these-vitamin-loaded-leaves-to-your-dishes-for-that-extra-tang-2305836.html,"Kakoli Mukherjee ByExpress News ServiceHYDERABAD: The happy marriage of different flavours has been one of the highlights of Indian cuisine. In our ancient texts, a balance of six tastes - sweet, sour, salty, pungent, bitter and astringent - has been recommended in everyday eating for optimum health.While sugar and jaggery are the primary sweetening agents in our kitchens, we have also been blessed with an array of natural food souring agents which add that tangy zest to any dish. As summer makes its presence felt, tender tamarind leaves make their appearance which are used extensively in meat preparations in Telangana and Andhra Pradesh. The same applies to Gongura leaves which are also enjoyed in the form of pickles and chutneys. Another green leafy vegetable that imparts tartness to pappus and chutneys is Green Sorrel.Commenting on the use of these leaves in Indian kitchens, Chef Sudhir Nair, who is the executive chef in The Westin Hyderabad Mindspace, says: The summer season is believed to be a good time to add these leaves to your food as they keep your body cool. It is also a season when appetite goes down and the tang of these leaves can help bring it back. Gongura, as we know, is used extensively in Telangana and Andhra Pradesh. We must note that tamarind and Gongura leaves are used mainly in the preparation of meats that have a strong flavour like mutton. In case of chicken or seafood, the taste of the leaves might overpower the dish.Green Sorrel leaves: They are called Chukka Koora in Telugu and Khatta Palak in northern India. Their appearance is similar to spinach leaves but the leaves are darker and the stems thicker. Apart from being added to lentil recipes, they are also used in salads. Their tartness comes from oxalic acid, the quantity of which becomes higher as the leaves grow. They grow all year round but the peak season is summer.Tamarind leaves: Tamarind is one of the most common souring agents in Indian cuisine, and even its leaves are eaten in a few states. Chugur Dal and Chugur Gosht are relished during summer as this is the time when tender, crunchy tamarind leaves are available. These sour leaves are used in Ayurvedic medicines and Chef Sudhir tells us that they taste swell with potatoes too.Gongura leaves: Known as red sorrel leaves in English, these serrated leaves are extensively used in the two Telugu states, Maharashtra, the north-eastern states and other regions. Apart from the celebrated Gongura Mamsam and pickles, they can also be used to whip up a quirky pulihora. They come in green-stemmed and red-stemmed varieties and their pretty fruit pods are used to make red-hued teas.Health benefitsTamarind leavesThe polyphenols in tamarind have antioxidant and anti-inflammatory propertiesThese can protect against diseases such as heart disease, cancer and diabetesThe leaves were also used to promote wound healingTamarind contains a good amount of magnesium, an important mineral that plays a role in over 600 functions in the bodySeveral studies show that tamarind can combat many different microbes. It may help kill bacteria, viruses, fungi and parasitesGreen sorrelRich in vitamin C, it has always been valued for its ability to prevent scurvy, a disease caused by Vitamin C deficiency, especially at a time when other vitamin C-rich foods were not available or affordable.It acts as a diuretic; aids digestion; relieves constipation and alleviates bronchitis and asthma.Gongura leavesGongura is an excellent source of folate and Vitamin B6, both of which are needed to maintain low homocysteine levelsIt is a rich source of iron, vitamin C, anti-oxidants, calcium, iron, zinc and Vitamin A.Gongura leaves and flowers help cool the body and reduce inflammationThey also contain moderate levels of potassium, calcium and magnesium, which help strengthen the bones and are useful in relieving symptoms of fever.Recipe : Gongura MamsamIngredientsDiced lamb (boneless and tender) - 1 kg | Sunflower oil sunflower - 100 gm | Cloves - 4 | Green cardamom - 6 | Cinnamon stick - 1 | Cumin seeds - 1 tbs | Ginger garlic paste - 75 gm | Garlic chopped - 100 gm | Onion chopped - 250 gm | Red chilies split - 8 | Sorrel leaves - 1000 gm | Coriander powder - 2 tbs | Roasted cumin powder - 2tbs | Green chillies slit - 250 gm | Turmeric powder - 15gm | Salt - as required | Water - as required | Ghee - 50 gmMethodFor Gongura paste: Take a pan and heat some oil in it, then add some whole red chillies, cumin seeds, chopped garlic, green chillies and saute till the garlic sweats.Add washed sorrel leaves and simmer in the heat. Cook for 10 minutes.Next, cool the mixture and then coarsely grind it in a blender.For Gongura Mamsam:Take a pan, add oil to it and heat. Then add red chillies, whole spices, cumin seeds, green chillies, chopped onion and add ginger-garlic paste, Saute till the garlic cooks and turns brown in colour.In the same pan, add diced lamb and saute everything together for 10 minutes. Then add some water. Cook on slow fire for 15 minutes, add turmeric powder and salt.When the mutton is cooked, add coriander powder, cumin powder, sorrel leaves paste and simmer for five minutes. Then add ghee, check the salt and serve with steamed rice.During summer, tamarind leaves, which are used in meat dishes, make their appearanceContributed by Chef Sudhir Nair, executive chef, The Westin Hyderabad Mindspace Kakoli Mukherjee kakoli_mukherjee@newindianexpress.com @KakoliMukherje2",Green & tangy: Add these vitamin-loaded leaves to your dishes for that extra tang,ONION
2021-05-23,https://www.newindianexpress.com/cities/chennai/2021/may/23/vegetable-prices-soar-in-chennai-ahead-of-total-lockdown-in-tn-from-may-24-2306440.html,"By Express News ServiceCHENNAI: As the city braces itself for a complete lockdown from Monday, vegetable prices skyrocketed marginally on Sunday.Most vegetables were being sold at double, or even triple the price in most of the places since these shops will not operate from Monday.In the retail market per kilogram, potato was being sold at Rs 40-50 as against the usual price of Rs 20-30, Beans at Rs 150-190 (usually Rs 70), Ladies finger at Rs 50-60 (usually Rs 20) and onion at Rs 60 (usually Rs 30). Almost all the vegetable prices spiked similarly.ALSO READ | Tamil Nadu lockdown: Vegetables to be delivered in tri-cycles, Tata Ace; Non-vegetarian hotels in a fixIn the air-conditioned, big vegetable shops across the city, the prices were almost four times the usual prices. For example, beans were being sold at Rs 290 per kg, carrots at Rs 190, brinjals at Rs 100 and potatoes at Rs 80.""We already do not have money to stock up vegetables for a week. With the prices so high, we can stock up for a maximum of two days. We hope the government will step in and help us,"" said P Hassar, a daily wage labourer from Velachery.Meanwhile, social distancing also took a major toll in almost all of the markets on Sunday.Ironically, the lockdown is being imposed to control the cases, but on Sunday, the markets witnessed a heavy rush with people pushing each other and removing their masks in intervals to catch some 'fresh air'.ALSO WATCH:",Vegetable prices soar in Chennai ahead of total lockdown in TN from May 24,ONION
2021-05-23,https://timesofindia.indiatimes.com/city/chennai/prices-of-vegetables-shoot-up-in-chennai-due-to-panic-buying-ahead-of-full-lockdown/articleshow/82875222.cms,"Koyambedu Wholesale Market Complex on Sunday morning. Photo by B A RajuCHENNAI: Prices of vegetables shot up at neighbourhood shops in Chennai as people went for panic buying after the Tamil Nadu government announced a full lockdown from Monday till May 31 that will see grocery and vegetable shops shut.The rates of most of the vegetables at the Koyambedu Wholesale Market Complex (KWMC) was jacked up by at least by two times more than their usual cost.Potato was sold at Rs 40 per kilogram while tomato was priced Rs 30, carrot Rs 50, beans Rs 90 and ladies finger Rs 75 at Koyambedu. The price escalation reflected in the local markets, where the cost of these vegetables doubled making the essential commodity dearer for consumers.In some markets, the cost of some vegetables hit Rs 200 per kilogram with ladies finger and brinjal being sold in the similar price range.In Choolaimedu , the price of one kilogram of potato was spiked by Rs 30 and sold at Rs 50.In Tambaram, the prices of French beans and tomato went up to Rs 300 and Rs 70 per kg, respectively. A trader in Tambaram said a sack of cabbage which was available for Rs 280 at Koyambedu on Friday night was sold for Rs 2,000 on Saturday night.In Madipakkam, tomatoes were sold as high as Rs 40 per kg while onion was going a Rs 45 per kg. On Saturday, the price of tomato was hovering around Rs 15.At Chitlapakkam, one bunch of coriander leaves was available for Rs 30 on Sunday that was just Rs 10 on Saturday. Residents complained that several vegetable vendors in their area are indulging in charging exorbitant rates cashing in on the demand during.However, a few online entities were fair, who were selling the vegetables at nominal and usual prices.Panic buying was visible at supermarkets, as people were seen piling up on staples like atta, maida, dal and pulses. The shelves were running out dry quickly and the staff were seen busy refilling them as long as they had it in stock.",Chennai: Prices of vegetables shoot up due to panic buying,ONION
