PUBLISHEDDATE,ARTICLEURL,TEXT,ARTICLETITLE,COMMODITY
2021-05-27,https://www.thehindu.com/life-and-style/food/chef-jomon-kuriakose-gives-londoners-a-taste-of-kerala/article34659514.ece,"As Chef de Cuisine at The Lalit London, Jomon Kuriakose is putting dishes like payasam, duck mappas and mathanga erissery on the mapJomon Kuriakose | Photo Credit: Sekhar AbrahamSeared red mullet and cassava mash served with a side of Alleppy fish curry sauce and crushed curry leaves is Chef Jomon Kuriakoses personal victory. As Chef de Cuisine, when he first served the dish at The Lalit London, it starred king fish along with tapioca, and was simply known as kappa meen curry. Back home in Kerala, sardines are usually used for the dish. Even though Jomon chose king fish because of its fleshy texture, the dish did not get the warm response he was expecting.Not one to give up, a few months later, in one of the usual menu rejigs, Jomon reintroduced the dish using the red mullet, a much-loved variety of fish in London. Now, Jomon had guests ordering it and complimenting him as well. I realised that the way the dish is presented and described makes all the difference. I tweaked the plating a bit, making the fish centre of attraction, so that guests of any nationality could relate to the description. I consider it an honour to showcase Kerala cuisine here, he says, over a call from London.Seared red mullet and cassava mash served with Alleppy fish curryThe only Malayali chef in the five star hotel that serves Indian food, Jomon was keen on including a number of dishes from his homeland in the menu. I just wanted to show that Indian food does not begin and end with butter chicken and tadka dal, he adds.Jomon has served everything from the traditional mathanga erissery (a curry made of pumpkin, dal and coconut) to payasam to the famed duck mappas. He served mathanga erissery as a vegan main course, calling it Pumpkin Steak. The konju theeyal (shrimp onion curry) was served along with lobster tail tandoor, with the theeyal made with shallots and crushed dried shrimp. When I was given charge of the menu, I wanted to bring in some diversity. I started researching my own food and I realise that nothing could possibly go wrong if you turn to your roots, he says.Payasam with caramelised bananaHe says he takes care to retain the authenticity of the dish, tweaking only the plating and the presentation. So even inherently Malayali ingredients such as vazhappindi (banana stem) or kovakka (ivy gourd), for instance, were transformed into steaks and salads. The simple milk payasam was made into a frozen dessert, garnished with caramelised banana sticks and served with crushed pappadam to add texture.The Lalit has just reopened after a year and Jomon spent the time at home, trying out a variety of new dishes and experimenting with unique ways of plating. He took virtual classes for a few universities online as well.Born and raised in Mavelikkara, Kerala, Jomon completed his hotel management course at Sarosh Institute of Hotel Management in Mangaluru. He moved to London in 2008, where he completed his post-graduation in Hospitality Management from the London School of Business and Computing. He started his career in London as the Chef de Partie at Bombay Palace, a high-end Indian restaurant in London. He worked as Senior Chef de Partie at Cinnamon Kitchen, a restaurant which specialises in merging eastern spices with western culinary styles, before moving to Baluchi, the pan-Indian dining destination at The Lalit in 2017.Coconut-stuffed and steamed sardine, colocasia brunoise cooked in turmeric brine liquid and a chutney made of mango, coconut and curry leavesThe love for food is what has brought him so far, believes Jomon, who appeared in BBCs Celebrity Master Chef 2018. He also got an opportunity to teach at the Hammersmith and West London College, where he had once hoped to study. This was a dream come true. I couldnt study at the college 12 years ago, as my circumstances did not permit it. But, I have no regrets today as I got a chance to teach in the very same college, he says.Ayala pollichathu (mackerel steamed in banana leaf) with chilli and shallots; mathi varuthathu (fried sardines); and potato mezhukkupuratti (a pepper stir-fry) are next on his list. I want to speak through my food, I want to tell the world about the unique food tradition of Kerala, Jomon signs off.",Meet the chef giving Londonâ€™s fine diners a taste of Kerala,POTATO
2021-05-27,https://www.thehindu.com/life-and-style/food/the-post-covid-19-diet/article34656244.ece,"Once youve recovered from COVID-19 and are out of quarantine, your body needs strengthening for quick healingAsk anybody who has gone through the suffering and stress of COVID infection in the last 18 months; the common thread of complaints that emerges from their post-recovery experience is all about fatigue, weakness, and the loss of energy, appetite, strength, muscle mass and weight. The road to complete recovery from COVID-19 is tiring. Besides sleep and rest, eating healthy is an essential now to aid in healing.Good nutrition helps your battered body build up its energy levels as fast as possible, says Dr Kavitha Fenn Arunkumar, Madurai-based psychiatrist, referring not just to those who have suffered the sickness, but also those who have seen adversity through the pandemic. In fact, she recommends the intake of easy-to-digest food in frequent and small measures because the body and mind are both vulnerable and not in a condition to labour hard over three big elaborate meals.Dr Arunkumar receives three or four calls a day from those who have seen a COVID-19 death in their families and now during their own recuperation are finding it difficult to eat. The food we eat should be easy and comforting to chew and swallow, she says. She also cautions against emotional eating (feeding on convenience foods to satiate cravings). Its best to eat food that does not cause distress to the digestive system or any other part of the body, she says.Power up with nutrientsTo gain stamina and fight the weakness, Delhi-based nutritionist Shweta Gupta says it is important to power up with proteins as they help reverse tissue damage and stimulate the production of T-cells, the agents that promote healthy immune functioning. Proteins are the most important macro-nutrients that aid in rebuilding and recharging the body; vitamins improve immunity and probiotics improve the gut bacteria after the heavy antibiotic and steroid used in treatment, says Anjali Dange, nutritionist and founder of Starlite Nutrition and Wellness Centre, Visakhapatnam. For those who are lactose tolerant milk-based products have immunomodulatory, antimicrobial, and anti-hypertensive effects on the body.Buy fresh and seasonal fruits and vegetables for good healthThe carbohydrates in our breakfast and lunch can constitute up to 25%, says Gurugram nutritionist Asheesh Grewal. Our Indian kitchens are full of potent anti-inflammatory and anti-viral ingredients such as ginger, turmeric, garlic, cumin, coriander, mint, cinnamon, honey, all of which are usually and can be used in different combinations and different items for overall well being. One should nourish the body well for at least six months post-COVID treatment, he says.Comfort foodHome-maker Mili Ghosh from 24 South Paraganas, West Bengal, cooks and packs seven different types of khichdi for each day of the week and home delivers it fresh in her neighbourhood to those in home quarantine. After hearing a dietician on television, I began preparing khichdi using a different millet and combination of dals each day and powered it with lots of seasonal vegetables, says Mili, who has been doing this free of cost for six weeks now ever since her husband fell to COVID-19. Along with the nutritious and tasty khichdi, she also gives them a boiled egg five days a week and a flask of lassi daily. I am alone and this work keeps me going, she says.Suman Agarwal, from Mumbai, recommends the 4X model: four meals at agap of four hours each. Follow the 8 am- noon-4pm-8 pm or 9 am-1 pm-5 pm-9 pm schedule and control the portions, especially carbohydrates. Feed your hunger but never over-stuff, she says.Tips to follow at home: Avoid elaborate cooking and stick to simple recipes with more greens (Spinach, methi, sarson saag and other keerais) as they are known to lower anxiety levels.Make one or two vegetable chutneys and store, so that you can use them every day with rice or chapatis.Keep a jar of nuts and seeds by your side for easy snacking, They are potent sources of essential fatty acids such as Omega-3 and healthy fats that boost energy and promote healthy cholesterol levelsTaste and smell may take a while to return to normal making every bite of food utterly tasteless but it is important to keep up the appetite with small and frequent meals.The essential vitamins required during the period of healing are C and D. They help to prevent the body from oxidative damage and reduce inflammation. Stock yourself up with guavas, amla, kiwis, oranges and sweet lime for your lung healthSubhashree Ray, clinical and public health nutritionist in Mumbai, focusses on customised nutritional requirements of those with co-morbidities, particularly diabetes. Those with insulin resistance and metabolic syndrome need to be extra cautious of what is entering their body, she says and suggests complex carbohydrates such as whole grains and legumes for them. High fibre cereals and pulses like jawar, bajra, ragi, brown rice, oatmeal, millets, quinoa take longer to digest than simple carbs (refined grains like maida  often found in bread) and thereby keep the blood sugar from spiking, she adds. A staple cuisine of Bengal, the tetor dal (bitter lentil) made with the yellow split moong dal and karela (bitter gourd) is considered good.Nutrients-dense post-COVID recovery mealPasty khichdi with lots of vegetables; mashed dal or rasam with rice; curd rice; paneer or soya curry with two to three soft phulkas; green leafy and seasonal vegetables; steamed fish, egg and chicken (for non-vegetarians).Eat home-made balanced diet for the body to respond well and fast after infectionHealthy snacks:A bowl of salad or low-fat curd at room temperature, figs and dates, a spoonful of pumpkin, chia or flax seeds, boiled peanuts or chick peas, a fistful of nuts (including almonds, walnuts), sweet potato chaat or seasonal fruits.High hydration:Enough water, low salt lassi, coconut water, butter milk with a dash of cumin and mint, chaach, and fresh juice with seasonal fruits (without adding sugar), bael ka sharbat (it is high in fibre).Chicken or vegetable broth soupThe immunity boosters:You can make a variety of health drinks at home to improve your haemoglobin levels. Here are a few suggested by the nutritionists:Blend one small amla, half a carrot and apple each, one tomato, quarter of a boiled beetroot and half cup pomegranate; dilute it with little water to suit your taste.Kadha: To 300 ml boiling water add 10 basil (tulsi) leaves, four lightly crushed peppercorns, half inch grated ginger and one pinch cinnamon. Reduce the concoction to half and add one teaspoon honey.A simple concoction of coriander, cumin and fennel seeds (saunf) or lemon and barley water is good for general well-being.",Hereâ€™s what to include in your post-COVID-19 diet,POTATO
2021-05-29,https://www.thehindu.com/news/national/kerala/govt-in-a-fix-over-hc-order-on-minority-scholarships/article34678732.ece,"Muslim forums ask govt. to appeal, Church heads hail order, govt. to study details before decidingThe High Courts order striking down the 2015 State government order allocating scholarships for Muslim and Christian communities in 80:20 ratio is set to become a political hot potato for the new Left Democratic Front (LDF) government.The Division Bench order on Friday overturning the government order sub-classifying the minorities by providing scholarships to Muslims and Christians (Latin Catholics and Converted Christians) in 80:20 ratio has already stirred contrary but expected responses from leaders of political and religious organisations representing the two communities. The government has not yet responded to the court order. Giving an indication that the government will take extreme caution before taking a stand on demands for and against going for appeal against the court order, Chief Minister Pinarayi Vijayan at his press conference said any decision on the issue will be made after studying the details of the order.Blaming VS-led govt.The Indian Union Muslim League (IUML) leadership is in the forefront of the demand that the government appeal against the Division Bench order. Blaming the LDF government for the High Court ruling, IUML general secretary P.K. Kunhalikutty and party organising secretary E.T. Mohammed Basheer said at Malappuram that the order issued in 2011 by then LDF government led by V.S. Achuthanandan that introduced allocation up to 20% for Latin Catholics and converted Christians had created all the trouble. They noted that the earlier decision to provide scholarships and training to Muslim youths had been based on the Paloli Mohammed Kutty Commission recommendations.Sunni leader Kanthapuram Aboobacker Musaliyar, the Samastha Sunni faction, Jamaat-e-Islami State Ameer M.I. Abdul Azeez and Kerala Nadvathul Mujahid State committee also separately demanded that the State government appeal against the verdict. Kasim Irikkur, general secretary of the Indian National League, a coalition partner in the LDF, said the court order did not take into consideration the backwardness of the Muslim community detailed by the Sachar Committee.As expected Christian organisations welcomed the HC order. Malankara Orthodox Syrian Church Episcopal Synod secretary Youhanon Mar Diascoros Metropolitan and Malankara Mar Thoma Syrian Church head Mar Theodosius Mar Thoma Metropolitan were among the Church leaders who said that the court order would bring equality in the distribution of benefits to the minority communities. The Kerala Catholic Bishops Council and the Malankara Syrian Jacobite Church too have hailed the verdict. P.J. Joseph, chairman of the Kerala Congress, which is a coalition partner in the Opposition United Democratic Front, urged the State government to implement the HC order.A balancing actThe LDFs political experiment of forging a rainbow coalition that helped it make inroads into traditional anti-Left vote bases in the two dominant minority communities will now be under scrutiny. For the LDFs return to power in the State is attributed to, among others, its efforts to strike a balance between the conflicting interests of the Muslim and Christian communities.",Govt. in a fix over HC order on minority scholarships,POTATO
2021-06-01,https://indianexpress.com/article/world/the-pandemic-in-the-us-has-vastly-improved-for-these-families-the-worst-has-just-begun-7339481/,"Even in the worst spots  Michigan leads the country in recent deaths per capita  the situation is vastly improved. About 34 deaths are being reported in Michigan each day, down from more than 130 a day last spring. (File)Written by Sarah MervoshAfter more than a year of pandemic restrictions, many Americans are leaving their masks behind, making summer travel plans and joyously reuniting with family and friends. As more are vaccinated and new infections plummet, there is a sense that the worst of the pandemic is over in the United States.But for people like Michele Preissler, 60, the worst has just begun.Preissler lost her husband to COVID-19 in late May, just as many restrictions were being lifted and life, for many, was starting to look more like normal. Customers were going without masks last week at the Walmart near her home in Pasadena, Maryland, where she was shopping for items for her husbands funeral.Everybody is saying, Oh, its fine, said Preissler, whose husband, Darryl Preissler, 63, loved to hunt, camp and go crabbing with his grandson, and was not vaccinated when he caught the virus at a wedding in early April. Im just thinking to myself, If you only knew what I just went through.With half of Americans protected with at least one dose of a vaccine, the virus outlook in this country is the best it has been at any point in the pandemic. New cases, hospitalizations and deaths are lower than they have been in many months, and even the most cautious health officials are celebrating the countrys progress. Fully vaccinated people, who are at low risk of catching and spreading the virus, have been told they can take off their masks and return to many regular activities, with the support of top scientists.Even now, though, about 450 deaths are being reported each day, and that has left hundreds of families dealing with a new kind of pandemic grief.Opinion | Vulnerable, scared, grief-stricken: How govts can support children whove lost parents to CovidUnlike earlier periods when most Americans were seeing their lives affected by COVID, relatives of people dying of the virus now describe a lonely sorrow: They are mourning even as so many others are celebrating newfound freedom. In one sign of the dissonance, the pandemic has improved enough that funerals  once forced to take place over Zoom  are mostly permitted to happen in person again, a bittersweet shift for those losing people now.In some cases, the grief has been complicated by new  and thorny  questions about vaccination. People dying from COVID-19 today are largely unvaccinated, health experts say. There have been some reports of people dying after being vaccinated, but experts say those are rare exceptions.Some people who died in recent weeks got sick before they were eligible for shots, raising questions about whether the United States vaccine rollout moved quickly enough to reach all Americans. The widespread availability of vaccines is still relatively recent  most states had opened vaccines to all adults by mid-April, with up to six weeks needed for full immunity  and it can take several weeks from the onset of symptoms for cases to turn fatal.Don't Miss | Mortgaging property, selling jewellery, drawing loans: how high Covid-19 bills are pushing families to the brink of penuryOthers who have died lately were hesitant to get shots, their relatives said, underscoring the challenge that remains ahead for health authorities in their quest to convince Americans of the safety of vaccination. Still others, like Darryl Preissler, who was busy at his job remodeling homes, simply had not yet gotten around to getting his shot, according to his wife, who already had been vaccinated.Its like being related to the soldier who gets shot before the armistice kicks in, said Dr. Toni Miles, an epidemiologist at the University of Georgia who studies grief and bereavement. Everybody else is insanely happy, as they should be, because the war has stopped, but you lost somebody during a period when nobody wants to grieve.The nation has not reached this level of deaths since early July, after the virus had diminished from the spring surge in places like New York and before a summer outbreak worsened. At the worst point, in January, more than 3,000 people were dying each day of the virus, a daily toll that has diminished by about 85%. Now, there is no one city or region driving COVID deaths. Small numbers of people are dying all over, from California to Florida.Even in the worst spots  Michigan leads the country in recent deaths per capita  the situation is vastly improved. About 34 deaths are being reported in Michigan each day, down from more than 130 a day last spring.In recent weeks, the people dying have been slightly younger, often in their 50s and 60s, a group that became eligible for vaccines later than the oldest Americans and has been slower to accept the vaccine. In May, there were more deaths reported among people ages 50 to 64 than in those 85 and older, according to data from the Centers for Disease Control and Prevention. In January, those numbers were reversed; people 85 and older had accounted for about double the number of deaths as the younger group.Most of the people critically sickened from the virus now have not had vaccines.The majority that Ive taken care of personally that became sick enough to be hospitalized, all of them were not vaccinated, either fully or at all, said Dr. Mark Hamed, an emergency room physician in Sandusky, Michigan, and the medical director for eight rural counties in the state.For families of those who are dying now, the entire issue of vaccination has created a new layer of discomfort  and a set of difficult questions that no one was asking in the early months of the crisis, before vaccines.Hollie Rivers has been devastated in the weeks since her husband, Antwone, died in Michigan. He had helped raise their blended family of five children, Rivers said, and had worked his way up to manager level at his job at a vehicle logistics company. She said he became her life partner  the Charlie, as she called him, to her Angel. At his funeral in May, she helped carry the coffin.I wanted to hold him until the very end, until I couldnt hold him any longer, Rivers said.But after Rivers, 28, gave an interview to a Detroit-area television station and disclosed that her husband had not been vaccinated, she said she faced critical comments online. She and her husband had been initially hesitant, she said, but were considering getting the vaccine. Then Antwone Rivers, 40, got sick in early April, his wife said, before Michigan opened up vaccination to people his age.Hollie Rivers described some online comments, including on a family GoFundMe page, as plainly hostile: He refused the shot, how could you dare ask for money? she recalled the tone of one message suggesting.Now I just feel like I want to cancel it. Its not about money, said Rivers, who is on short-term leave from her job installing car door panels. I would live in a cardboard box if it meant my husband coming back to me and his kids.Miles, the epidemiologist who studies grief, said she had seen such dynamics play out in deaths from diseases like lung cancer or diabetes.We are shaming the dead, just like we always have, she said.Camille Wortman, a grief expert and professor emeritus at Stony Brook University in New York, said that survivors who lose a loved one to COVID-19 at this point in the pandemic might be more likely to experience feelings of anger, guilt and regret.The impact of the vaccine is really huge, and the grief of survivors will be more intense, she said.For Yvonne Santos, 30, of Houston, questions about whether her husbands death could have been prevented find her in quiet moments  when she is looking at photos of the two of them together, or when she feels the weight of her in-laws grief. Santos said she had been worried about the safety and efficacy of the vaccines, because of how rapidly they had been created and produced. Her husband, Angel, also delayed getting a shot.I dont talk about it with anybody else, but I do feel bad, because he didnt really question it as much as I did, Santos said. I was the one who was still afraid.Santos said she and her husband both came down with the virus. After testing positive in early April, Angel Santos, a juvenile supervision officer, spent weeks in the hospital, where, she said, he expressed regret that he did not get the vaccine. He died May 19, at the age of 35.Yvonne Santos now plans to get vaccinated, she said. While she said she didnt know if getting vaccinated would have spared her husband, she said she might have fewer regretsThen at least we knew we did everything we could, she said.Deaths from the coronavirus typically happen several weeks after initial infections, experts say. As cases plunge nationally, deaths have also fallen and may continue decreasing in the weeks to come.On the day that the CDC announced that vaccinated Americans no longer needed to wear masks in most situations indoors  a move that was greeted by many as a sign of the end to the pandemic  Kole Riley, 33, was at his mothers bedside at a hospital near Sedona, Arizona, saying a final goodbye.His mother, Peggy Riley, 60, had taken a turn for the worse after falling sick with the coronavirus weeks earlier. She had not gotten vaccinated because she believed she had antibodies, her family said. Several members of their family, including Rileys husband, had shown signs or been diagnosed with COVID-19 late last year.After holding her hand in her final moments, her son emerged from the hospital to find far fewer people wearing masks and a country that seemed to have moved on. He was still thinking about his mother, a real estate agent who jogged in her free time and wowed family and friends with her homemade ribs and potato salad.Angry is the best and most polite way I could say it, said Kole Riley, after seeing maskless shoppers in a convenience store.He struggled to reconcile his grief with the countrys optimism.I didnt think I would be dealing with this, he said, when all the arrows are pointing back to normal.","Pandemic in US has vastly improved, but for these families, the worst has just begun",POTATO
