PUBLISHEDDATE,ARTICLEURL,TEXT,ARTICLETITLE,COMMODITY
2021-04-04,https://www.thehindu.com/elections/west-bengal-assembly/west-bengal-assembly-polls-after-nandigram-the-electoral-contest-heats-up-singur/article34237669.ece,"Agriculture and industry have come full circle in a battle of prestige over what was once a site of resistanceAfter the polling at Nandigram, one of the most important Assembly seats going to polls in West Bengal is Singur in Hooghly. Singur, which has great symbolic and political value in the States politics, is going to election in the fourth phase of polling on April 10. The Trinamool Congress government and Chief Minister Mamata Banerjee have described the return of land to farmers unwilling to have it acquired as one of the biggest achievements of her government.Addressing a public meeting at Haripal in Hooghly district, in the constituency bordering Singur, Prime Minister Narendra Modi on Saturday accused the Trinamool Congress (TMC) of using Singur for its political gains and then leaving its people in a lurch.People are aware more than me what kind of deceit was done at Singur Today, there is no industry at Singur, no jobs at Singur and the farmers are troubled by land sharks, Mr. Modi said, addressing a public rally at Haripal.Days before the PM raised the issue of Singur, Ms. Banerjee on March 31 held a public rally at Singur after the campaign for Nandigram drew to a close. The CM had also said that she had given thought to contesting from Singur because of its history of struggle, like in Nandigram, against land acquisition.At Singur, TMC Minister Becharam Manna is contesting against four-time MLA Rabindranath Bhattacharya, formerly of the TMC, who joined the Bharatiya Janata Party (BJP) days before his candidature from the saffron party was announced. Though the local BJP had objected to the 89-year-old-veteran, who is known as mastermoshai (teacher), Mr. Bhattacharya said it was a fight for his prestige. I was disowned by the party, he said, expressing strong reservation over the nomination of Becharam Manna as the TMC candidate from the seat. The mastermoshai remains a respected figure but many people are unable to reconcile his change of political affiliations. The BJP had a lead at Singur in the 2019 Lok Sabha polls but its the States ruling party that may be helped by the last-minute defection, feel political experts.I cannot understand how mastermoshai can contest from Singur as a BJP candidate. I respect his age. We had got him elected four times from here, the Trinamool Congress chairperson has said. Ms. Banerjee recounted her 26-day strike against forcible land acquisition at Singur, and also the police atrocities and excesses at the Block Development Office during the Left front regime.The Supreme Court in 2016 had turned down the land acquisition at Singur during the Left front regime, and in September same year, Ms. Banerjee returned the land to the farmers. The 997-acre plot at Singur that was at the heart of the debate over industry and agriculture has changed significantly since 2006 and many farmers have complained that they could not even identify their plots. After removing concrete from the land for three to four years, farmers like Vivekananda Das have managed a satisfactory yield of potato this season. But the farmers claim that they have to spend a large sum of money to make their land tillable again.It was the resistance at Singur that enabled Ms. Banerjee to make a remarkable political comeback and assume power in the State in 2011. Sensing unease among the people, the TMC government and Ms. Banerjee are promising to bring industry to Singur, which has been the BJPs poll plank. On Saturday, the party was quick to react to Mr. Modis barb by asking why the Tata Motors car factory at Sanand in Gujarat had been closed.The Left parties are also hoping to recapture lost ground by fielding 27-year-old Srijan Bhattacharya who, unlike the earlier Left candidates, is not riding a Nano car to campaign in the constituency but at times gives a hand to potato farmers working in the field. Like Nandigram, which witnessed a high pitched electoral contest, Singur, which has seen life come full circle from industry to agriculture and then back to industry, is once poised for a prestige battle.","West Bengal Assembly polls | After Nandigram, the electoral contest heats up Singur",POTATO
2021-04-07,https://www.thehindu.com/news/cities/Hyderabad/first-convocation-of-horticultural-varsity-today/article34255700.ece,"It will be an online event for all students who passed out in 2016, 2017, 2018 and 2019The first convocation of Sri Konda Laxman Telangana State Horticultural University will be held on the campus of agricultural university here on Wednesday.It will be an online event for all students who passed out in 2016, 2017, 2018 and 2019 but the gold medal winners of all the four batches would attend the convocation in person. According to the university authorities, the convocation will be held in the presence of Governor Tamilisai Soundararajan, who is also the Chancellor of the university. Director General of Indian Council of Agricultural Research (ICAR) Trilochan Mohapatra will deliver the convocation address.A total of 413 students had passed undergraduate course (B.Sc) and 110 had passed post-graduate course (M.Sc). Another 6 students had qualified for Ph.D degree so far. The university has College of Horticulture at Rajendranagar and Mojerla (Mahabubnagar) and Horticulture Polytechnic at Dasnapur (Adilabad) and Ramagiri Khilla (Karimnagar). Besides, the university has 11 research stations covering fruits, flower, vegetable, medicinal and aromatic crops. The university headquarters and UG and PG centre was inaugurated in December 2019 at Mulugu in Siddipet district.The university is planning to establish a dryland horticultural research station in Mahabubnagar district, chilli and spices research station in Warangal district and potato and onion research station in Sangareddy district.Vice-Chancellor of the university B. Neeraja Prabhakar stated that the thrust areas of their research work include development of production technologies resilient climate change scenario, standardisation of precision farming with combination of high density, fertigation and mulching in major fruit crops like mango, guava, sweet orange, papaya, banana, fig and pomegranate.Besides, they were also working on standardising organic package of practices in major fruit, all vegetable crops and also exotic fruits and vegetables.",First convocation of horticultural varsity today,POTATO
2021-04-07,https://indianexpress.com/article/india/piyush-goyal-reviews-modernisation-of-cwc-asks-it-to-increase-capacity-7262061/,"UNION MINISTER of Consumer Affairs, Food & Public Distribution Piyush Goyal has asked the Central Warehouse Corporation (CWC) to double its warehouse storage capacity by end of 2023 from 125 lakh metric tonnes (LMT) at present.Reviewing the modernisation plan of CWC on Tuesday, Goyal also asked the CWC to achieve a turnover of Rs 10,000 crore by the financial year 2024-25.According to a statement issued by the Ministry of Consumer Affairs, Food and Public Distribution, Goyal said that the tariff rationalisation and setting of warehouses should be done independently by CWC without any bureaucratic interference.The minister also instructed CWC to do a Safety Audit for fire, earthquakes, burglary and accidents in its all warehouses regularly.He said that the CWC should build modern silos for wheat and rice storage all over the country, so that maximum grains could be stored in the country for longer periods.Goyal asked the Corporation to build more cold chain facilities for storage Onion, Potato and Tomato in coordination with NAFED. He suggested that CWC should prepare a masterplan for the upgradation of all its 423 warehouses.He said that maximum powers of decision making for operations should be delegated to the CWC. He also asked CWC to focus on the building of cold chain storage in the country on a priority basis, the statement said.","Piyush Goyal reviews modernisation of CWC, asks it to increase capacity",POTATO
2021-04-07,https://www.newindianexpress.com/cities/chennai/2021/apr/07/swayed-by-sweet-potato-2286703.html,"Kannalmozhi Kabilan ByExpress News ServiceCHENNAI: The humble sweet potato, in all its weird and wobbly innocuousness, often gets a poor rep. Especially when pitted against, rather unfairly, the universally loved potato. While madhura kizhangu puzhukku and sweet potato fries have persuaded many to switch camps, it doesnt exactly top the list of favourite vegetables for too many.But, maybe it should, given that theres plenty more to this unassuming tuberous root, says Yamini, clinical dietician, Kauvery Hospital. Theres a misconception that roots and tubers are not to be consumed in large quantities because of their starch content. But, when it comes to the nutritional value, the other components like micro-nutrients also have to be kept in mind.For this, sweet potato can be consumed, explains Yamini. There are two types of the sweet potato. The one which is available in India is the orange-pinkish one; the other one is purple and not commonly available here. But, both of them have the same properties and are very good for your health. It is antiinflammatory, reduces free radicals and boosts your immune, she details.Addresses anaemiaIt is very rich in ascorbic acid, fulfilling the vitamin C part. Its also a good source of iron. If cooked with jaggery, the nutritional anaemia can be treated.Potassium powerSweet potato is a rich source of potassium. This can help manage high blood pressure, its water retention properties can regulate muscle contractions and prevent kidney stones too.Starchy but goodEven though it is a starchy vegetable with a minimal amount of carbohydrates, it minimises the absorption of sugar in the body; thanks to its good fibre content both soluble and insoluble. So, even diabeticpatients can consume it once or twice a week if their sugar level is under control.Metabolism mattersThe high fibre content also helps in maintaining gut health. It enhances the growth of beneficial bacteria in your stomach; this way, it can help treat infective diarrhoea, irritable bowel syndrome and other digestive disorders. It helps in weight gain but portion size is the key and it has to be taken appropriately.Brain foodIt is a very good source of choline an essential nutrient that enhances the brain function.Vitamin storehouseSweet potato is also very rich in beta carotene, which is the precursor for vitamin A. This vitaminis very essential in all stages of life, playing a vital role in eye health.Rich in antioxidantsIt is filled with anthocyanins with antioxidant properties. Hence, it has to be included in everyday diet.ConsumptionA 100 grams of baked sweet potato offers 51 grams of carbohydrates, 4 grams of protein, 6 to 7 grams of fibre and very minimal fat. Otherwise, it is also rich in vitamin C and B6, magnesium, etc. The best way to consume sweet potato is to steam/bake it and have it with jaggery or slight seasoning. It can also be made as a regular south Indian curry or poriyal, with tomato and onions and spices.Sweet potato is not given much importance on the plate. But, you should try to include it regularly in your diet. In layman terms, it just looks like the pancreas the shape of the tuber. And Mother Nature has given it all these properties too. That depicts that it is very good for your vital organ, pancreas, she concludes.",Swayed by sweet potato,POTATO
2021-04-12,https://timesofindia.indiatimes.com/city/pune/farm-produce-likely-to-flood-market-yard-today/articleshow/82021099.cms,"The vegetable market at Mahatma Phule MandaiPUNE: The Market Yard in Gultekdi , which is the biggest wholesale market in the city, is expected to get excess intake of vegetables and fruits due to closure of the market for the last two days due to the weekend lockdown imposed by the state government.Datta Bibve, head of onion and potato section, said, We expect to get more number of vehicles on Monday. Usually, the market gets around 1,000 vehicles of agriculture produce. Now, it is expected to increase to 1,300- 1,400 vehicles.Farmers are desperate to sell their produce due to the current situation and hence they would bring produce in large quantity, officials from the market said. We can't predict the rates scenario as we can't rule out the possibility of panic buying on Monday, he added.The similar situation is expected to prevail in other wholesale markets across the district, said the officials.Vegetable markets in Kolhapur city are expected to be flooded with supply on Monday as the harvested vegetables have been piling up in the backyards of the farmers due to the weekend lockdown. The farmers will bring their produce to the citys mandis on Monday.Despite allowing vegetable and fruit vendors to operate, most markets and roadside vegetable vendors decided to observe the lockdown. The citizens, abiding by the law, too stayed indoors.As per the government orders, farming operations were allowed to continue. The farmers had expected the mandis to remain open. They had thought that citizens would be coming to buy vegetables.Eknath Pawar, a vegetable grower in Shirol, said, I went to Kolhapur to sell vegetables expecting the mandis to be open. However, most of the markets were shut. Moreover I was not allowed to sell my produce in the residential areas as police and locals said that there will be crowding if I set up shop on the society premises. I am heading to Shirol on Monday. Once the markets open on Monday, many farmers will flock to the mandis to sell their produce and the prices will crash. The lockdown has proven to be a bane for small-time farmers.Similarly, while construction activities were allowed, the shops selling construction goods and equipment were shut. Ravikant Patil, a contractor in Morewadi, said, The workers are sitting idle at the site since the last two days. The shops are closed and we need the material to resume construction.",Pune: Farm produce likely to flood Market Yard,POTATO
2021-04-12,https://www.thehindu.com/life-and-style/food/boss-burger-in-delhi-home-delivers/article34301990.ece,"Boss Burger in Delhi delivers veg and non-veg bun delightsSome friends had been drooling over the burgers they had been preparing at home. They had got some soft, sesame seed topped buns, and ordered pork patties from Meatigo.I began dreaming about this: creamy mayo slathered over a piece of bun, onion rings, perhaps a slice of tomato over it. A juicy patty on that, a crisp lettuce leaf and another soft bun on top. The problem was that we didnt have any buns, and it was too late to have them delivered.But burgers had been promised to two young people at home  one visiting Delhi for the first time. So, I turned to my good friend, the internet, and chanced upon a place called Boss Burger. I liked the different kinds of burgers it offered, and was further encouraged by the fact that it has branches across the city. With the help of Swiggy, we placed our order.The youngsters like chicken, so for them we asked for two OG Chicken Burgers (518 for two). They are also fond of hot food, so we added a Crispy Peri Peri Chicken Burger (299). A Crispy Fish Fillet Burger (349) and what seemed rather interesting  a Mutton Ghee Roast Burger (369).The burgers arrived just when the mice in the stomach had started kicking up a real shindy. The boxes were encouraging  strong, well packed cartons, which contained the burger, as well as sauces and napkins. Without much ado, we got down to business.The young ones were happy with their burgers  brioche wrapped around melted cheese and chicken topped with a hot sauce. The hot peri peri chicken was even better. The chicken and cheese patty had been doused with garlic aioli and a spicy sauce. The fish fillet burger, which came with tartar sauce, was disappointing. The patty was crisp from the outside, but sadly soggy within.My mutton ghee roast burger, however, was delicious, with its fusion flavours. The patty had been prepared in the Mangalorean style  slow cooked and then garnished with curry leaf flavoured mayo. It had a taste of soft onions that I really liked, and, overall, the patty cooked with Indian spices went rather well with the soft, bland buns.My last happy burger meal was when I had ordered in from Akus, which has some outstanding burgers with blue cheese, wild mushrooms, jalapenos, caramelized onions and more.Boss Burgers menu is comprehensive, too. For vegetarians, it offers Aloo Rataloo (sweet potato patty with mozzarella cheese, garlic aioli and chutney), Spicy BBQ Paneer, Quinoa & Veggie (quinoa-crusted roasted root vegetable patty, topped with sriracha mayo and saunth chutney) and Holy Guacamole! Black Bean Burger.Meat lovers can have its Truffled 3 Cheese Tenderloin Burger (grilled tenderloin and cheese patty, topped with truffled aioli and pickles, served in a sesame brioche bun) and a Chicken Tikka Burger. There are fries, chicken nuggets, wings and various kinds of shakes on the menu.All in all, we had a nice meal, indeed. But now I need to order in some buns and patties. Nothing like a DIY burger.The writer is a seasoned food critic",Whoâ€™s the boss (burger)?,POTATO
2021-04-12,https://www.newindianexpress.com/nation/2021/apr/12/haunted-by-trinamools-cut-money-culture-bengal-minorities-forced-tochoosea-lesser-evil-2288911.html,"Pranab Mondal ByExpress News ServiceNORTH DINAJPUR: Amin Ali has just finished his lunch of rice, daal and boiled potato at a roadside eatery at Goalpokhar in North Dinajpur district.He is planning to buy a tarpaulin sheet to cover the tiled roof his house before seasonal thunderstorms hit the region.He got a house under the state governments housing scheme for the poor, but without a concrete roof over it.The 55-year-old brick kiln labourer had to pay Rs 30,000 as cut money to local Trinamool Congress leaders for getting himself enrolled in the list of beneficiaries.As a result, he struggles with the stopgap roof of his house which gets damaged by storm almost every year.There are many others who had to face the similar plight. I had no option other than paying the cut money. How could I build a house with concrete walls with my monthly earning of Rs 4,500, Ali says.BJP has been making relentless attacks on the Mamata Banerjee government on the issue of cut money.But the campaigns electoral impact seems to be missing in this minority-dominated region of north Bengal comprising two districts North Dinajpur and Malda where 21 Assembly constituencies are located. Whom will you vote for?Do we have an option? We have to vote for those who have given us half a house. If they (BJP) come to power, we will be driven out of the country, says the father of three, who migrated from Bangladesh 35 years ago.Extreme polarisationSensing adverse impacts of the Citizenship Amendment Act and lukewarm impact of TMCs alleged corruption on the regions minority vote bank which forms around 50 per cent of the total electorates, BJP is trying to hard sell the Hindutva rhetoric.This region is set to experience an extremely polarised election on the line of religion. BJP faced largescale agitations over its choice of candidates, which is also a factor that might fetch TMC electoral dividend.Asgar Ali, a graduate in philosophy, is more concerned about his future than BJPs Hindutva or TMCs minority appeasement.Practically, I dont see a reason to vote for either. Joblessness is an issue among the youth like me which the TMC government failed to address in 10 years. Many from our area secured jobs of teachers in primary schools after paying bribes ranging from `10 lakh to `15 lakh. On the other hand, BJP leaders never hesitate to issue statements which not only hurt us but also makes us feel insecure, he says.JP supporters during Union Home Minister Amit Shahs roadshow in Nadiadistrict on SundayThe 27-year-old, a face of Bengals educated and jobless young voters, finds no reason to support the LF-Congress alliance as it would mean wasting his valuable vote.My political allegiance might be towards TMC. At least, they would be opposing CAA, which poses as a threat to us, says the resident of Chakulia, another minority-dominated pocket in North Dinajpur.The electoral landscape in Bengals concentrated minority pockets was not as polarised during the 2016 elections.Though BJP is painting Mamata as anti-Hindu, Muslim voters had shown that she was not their preferred choice in the previous Assembly elections.In the districts of Murshidabad, Malda and North Dinajpur, which have a minority population of over 50 per cent, the CPI(M)-Congress alliance had won 31 seats out of 43. But in the 2019 Lok Sabha elections, TMC secured lead in 23 Assembly constituencies.Debasish Biswas, professor of economics in Raiganj University and a political observer, described TMCs surge in the 2019 Lok Sabha elections as a fallout of BJPs aggressive Hindutva campaign.The minorities, who did not vote for TMC in the 2016 Assembly polls, extended their support to them in 2019. It is a direct impact of NRC and CAA, which Mamata Benerjee also described as a threat to the minority community, he observes.How lotus bloomedAsim Biswas, a farmer in his 40s, said most of the Hindus had migrated from Bangladesh and CAA is promising citizenship for them.When Muslims of this region united, Hindus, too, decided to come under the umbrella of BJP. Thats why BJP secured lead in this Assembly seat in the 2019 elections despite TMC winning the seat in 2016, says Biswas, who has shifted allegiance from CPI(M) to BJP, like many others across the state.They are a massive factor behind the saffron camps rise in Bengal. In Raiganj, the headquarters of North Dinajpur which is infamous for hooligaism, shootouts and gang rivalries, TMC is trying to dent Congresss vote bank after winning the civic body, which was ruled by the grand old party since 1950.The TMC also erected two statues of Priya Ranjan Dasmunsi, the late Congress stalwart from the region.A considerable number of Congress workers still carry Dasmunsis legacy. Congress has no chance of doing well in this region. Our attempt is to woo Congress supporters, said Kanhaiyalal Agarwal, TMCs candidate from Raiganj.","Haunted by Trinamool's cut money culture, Bengal minorities forced toÂ chooseÂ a lesser evil",POTATO
2021-04-13,https://timesofindia.indiatimes.com/city/pune/glut-of-farm-produce-at-gultekdi-post-shutdown-prices-stay-steady/articleshow/82038094.cms,"Rows of colourful umbrellas provide shade to vendors and their customers at Mandai on Monday afternoon.PUNE: The Gultekdi market yard for vegetables, fruits, flowers and grocery items recorded an excess intake of all farm produce on Monday, following the first weekend lockdown.An official from the Agricultural Produce Market Committee (APMC) said the farmers thronged the market with their produce as the market witnessed 1,500 vehicles, as against the normal daily arrivals of 800 to 850 vehicles.Madhukant Garad, chief administrator of the APMC, Pune, said, We got 32,638 quintals of agriculture produce, including leafy vegetables, onion, potato and fruits. Last Monday, we had received 24,700 quintals of the same. Today (Monday), it was 7,938 quintals more than last Monday. This is adequate to meet Pune and Pimpri Chinchwads requirements. We expect vegetable prices to remain stable in local mandis.Rates of all vegetables and fruits remained stable. Onion was sold in the Rs5 to Rs12 per kg range and potato was also sold in the range of Rs6 to Rs16 per kg. Rates of leafy vegetables were also in the normal bracket. A bunch of coriander was sold in the Rs5 to Rs12 range, fenugreek was in the Rs7 to Rs12 range and spinach was in the Rs4 to Rs10 bracket.Talking about the crowd management, Garad said, We have banned domestic purchase at the market, in view of the increasing crowd here. Also, small-time vendors, who sell the produce on handcarts and set up stalls in the market, too have been stopped. Restaurants on our campus have been told to provide parcel service.Shivlal Bhosale, a commission agent, said, It will be a difficult task for the administration to control the crowd at the market as thousands of them will be working together daily. A section of the commission agents said that the APMC could resort to last years strategy of running each section on alternate days. The measure had controlled the crowd significantly in the market, a commission agent said.While another agent said last years measure would go against the farmers as they wouldnt be able to sell their harvest quickly. Many farmers could not sell their produce last year because of this system, the agent said.Wholesale rates of flowers remain stableRates of flowers remained stable in Gultekdis flower markets on Monday, said Bala Sewale, head of the flower section. There was adequate supply of all flowers. Hence, there was no change in the rates. Marigold flowers, which were in demand because of the upcoming Gudi Padwa celebrations, were sold in the range of Rs40 to Rs45 per kg, he said.",Pune: Glut of farm produce at Gultekdi post-shutdown,POTATO
