PUBLISHEDDATE,ARTICLEURL,TEXT,ARTICLETITLE,COMMODITY
2021-08-07,https://indianexpress.com/article/lifestyle/health/migraine-eat-more-fish-7443030/,"Written by Anahad OConnor  A diet high in omega-3s, the fats found in fish, and low in omega-6s, found in many vegetable oils, led to fewer headaches.  For most of her life, Tanya Kamka suffered migraine headaches on a weekly basis.  The headaches would usually come on gradually and then build, causing excruciating pain and pressure behind her left eye that would culminate in her vomiting or visiting the emergency room. The ordeal would often leave her feeling weak and exhausted for days afterward.  Anytime I had a migraine Id be wiped out for three or four days, said Ms. Kamka, 58, a post office clerk who lives near Fort Bragg, N.C. I missed a lot of work because of migraines.  But a few years ago, Ms. Kamka and 181 other people who routinely experience migraine headaches joined a clinical trial, sponsored by the National Institutes of Health, which was designed to test whether a special diet could alleviate their frequent headaches. The diet that Ms. Kamka was assigned to follow emphasized foods that contain large amounts of omega-3 fatty acids, the oils found in some fish, while limiting foods that are rich sources of omega-6 fatty acids, such as many vegetable oils.  Omega-3s and omega-6s are both considered essential fatty acids  critical for health, and because our bodies cant make them, they must be obtained from foods. Historically humans consumed roughly equivalent amounts of both fatty acids. But the typical American diet today tends to contain a much larger proportion of omega-6 fats. Some health authorities see this as a good thing: Vegetable oils and other rich sources of omega-6 fats have been found in many studies to be beneficial for cardiovascular health. But others argue that this could be problematic because omega-6 fats have been shown to promote pain and inflammation, while omega-3 fats tend to have the opposite effect in studies, helping to reduce pain and inflammation.  The authors of the new study wanted to know: Could a diet that boosts omega-3 fats while lowering omega-6 fats make life easier for people burdened by frequent migraine headaches?  For Ms. Kamka, the benefits of a change in diet were striking: After a few months of increasing her fish intake and avoiding many common vegetable oils, she noticed that her headaches had all but disappeared. Other people on the new diet also reported fewer headaches. Although the trial ended after 16 weeks, Ms. Kamka has remained on it ever since. Gone are the days when she ate foods like fried chicken, French fries and potato chips that were cooked in vegetables oils rich in omega-6 fats. She now makes a point of eating foods like cod, tuna, sardines, spinach salads, hummus and avocados, and she cooks with olive oil instead of corn, soybean and canola oils.  ALSO READ | Suffering from migraine? These food items may help reduce the throbbing headache  I havent had a migraine, not even a mild one, in over two years, she said. Going from having one a week to not having any was just amazing to me.  Migraine headaches are one of the most common causes of chronic pain, affecting about 12 percent of all Americans, most of them women. For many people, the condition can be debilitating, causing intense pain, nausea and other symptoms and sharply increasing the likelihood of developing depression and anxiety. Studies have found that migraine attacks can take a toll on workplace productivity, too, causing people to lose, on average, about four work days per year.  But the new study provides evidence that the right diet could provide relief to some people who experience frequent migraine attacks, helping them reduce the number and severity of their headaches. Similar studies are underway to assess whether dietary changes could help ease other kinds of painful chronic ailments, such as low back pain.  Dr. Christopher E. Ramsden, the lead author of the study, said the findings suggest that dietary changes could be a useful complement to existing treatments for chronic pain. Many people with chronic pain continue to suffer despite taking medication, said Dr. Ramsden, a clinical investigator in the National Institute on Aging Intramural Research Program. I think this is something that could be integrated with other treatments to enhance their quality of life and reduce their pain.  For the new trial, published in the BMJ in July, participants were randomly split into three groups and followed for 16 weeks. One group, which included Ms. Kamka, followed a diet that was high in omega-3 fats and relatively low in omega-6 fats: They ate plenty of foods like wild salmon, albacore tuna and trout, while trying to minimize rich sources of omega-6 fats such as corn, soybean and canola oils. To make it easier to follow the diet, all of the subjects were given meals, snacks and recipes prepared by a dietitian throughout the course of the study.  Vegetable oils high in omega-6s are abundant in the American diet. They are often used for cooking and found in many packaged foods and restaurant meals. To see whether reducing these fats could have an impact on migraine headaches, the researchers had a second group of people add more fish and other rich sources of omega-3s to their diets without decreasing their intake of omega-6s. A third group of people, serving as controls, consumed typical amounts of both types of fats.  At the start of the study, the participants experienced, on average, about 16 headache days per month. But after 16 weeks, the group that had increased their fish intake and avoided vegetable oils had an average of four fewer headache days each month compared to the control group, as well as a 30 to 40 percent reduction in headache hours each day. The group that increased their omega-3 intake without reducing their omega-6 consumption benefited as well, though they had a smaller improvement of two fewer days without headaches each month. Both of these groups reported shorter and less severe headaches than people in the control group. They also used fewer pain relievers like acetaminophen.  The researchers also noticed differences in important blood biomarkers. The two groups that increased their fish intake had greater levels of compounds known as oxylipins, which are involved in soothing pain. They had particularly high levels of 17-HDHA, an oxylipin that in other studies has been shown to reduce pain in people with arthritis.  ALSO READ | Health tips: Simple ways to manage migraine at work  Dr. Rebecca Burch, a neurologist who was not involved in the new study, said that the findings were striking. She wrote an editorial in the BMJ pointing out that recently approved migraine medications have been shown in studies to produce two to two and a half fewer headache days per month compared to placebo, which is less than the four-day reduction caused by the high omega-3, low omega-6 diet.  Four days per month really outperforms anything weve seen from a pharmacological preventive, said Dr. Burch, a headache medicine specialist at Brigham and Womens Hospital and an assistant professor of neurology at Harvard Medical School.  Dr. Burch said that people who struggle with migraine headaches are often motivated to follow restrictive diets to try to find some relief for their condition. But until now there has not been much evidence that any particular diet works. This is the first time that weve had a robust, solid diet that we can recommend to patients, she added.  For people who want to try the diet on their own, the researchers said that the simplest way to increase omega-3 intake is to eat more fatty fish, such as sardines, anchovies, mackerel, salmon, albacore tuna and trout. Some of the best and most affordable options are canned and pouched fish. For vegetarians, good plant sources of omega-3 fats are ground flaxseeds, chia seeds and walnuts.  Another important component of the diet is avoiding fried, processed and fast foods, which are typically made with oils that are low in omega-3s and high in omega-6s. Beth MacIntosh, a co-author of the new study, said that extra virgin olive oil, avocado oil, macadamia oil, coconut oil and butter tend to contain low amounts of omega-6 fats.  You can use these oils to cook meals or to make your own snack foods, like popcorn, hummus and granola. The researchers also encouraged people in the study to eat at least five servings of fruits and vegetables per day.  Fruits and vegetables are naturally low in omega-6 fatty acids  and theyre just healthy, said Ms. MacIntosh, the clinical nutrition manager of the Metabolic & Nutrition Research Core at UNC Health in Chapel Hill.",Why migraine sufferers may want to eat more fish,POTATO
2021-08-07,https://timesofindia.indiatimes.com/nri/us-canada-news/indian-american-restaurateurs-cash-in-on-craving-for-comfort-food-in-bad-times/articleshow/85131508.cms,"The Covid-19 pandemic hit the hospitality sector hard in America last year.But for Indian American business partners and friends, Anthony Sankar and Premnath Durairaj, the story of installing their own bistro in the US has been very opposite and hopeful.Their Spice Kraft Indian Bistro, which opened its doors in Alexandria in the state of Virginia in 2019, became a go to place for desi community members for comfort food during the pandemic.Last year, the duo even moved to a bigger place and set up another bistro in Arlington nearby.The two graduated from culinary school in the late 90s and kicked off their careers at Taj Coromandel in Chennai. We met at the hotel and became good friends. From there, we moved to the United States to work with Marriott Hotels on a cultural exchange programme, after which we started working in an Indian restaurant, gained some exposure, and then were finally able to open our own restaurant as we dreamed of, Sankar recollects.The duo ran a smaller restaurant but saw an opportunity to move to a bigger space and extend their brand when they opened the twin bistros in northern Virginia. The properties they found were perfect because they replaced two other Indian restaurants Bombay Curry Company in Del Ray and Delhi Club in Clarendon and there was no need to buy tandoor ovens which were already installed.Before the Covid-19 pandemic, Spice Kraft Indian Bistro, located in a family-friendly neighbourhood, was popular among mainstream customers and not just Indians. But the pandemic hit restaurants hard across America and exposed the vulnerability of Indian cuisine to flourish in the mainstream American culture.People tend to stay with comfort food during times like these. We are not only dependent on the Indian community to thrive in this situation, but simply just to survive, Sankar says. People like to eat out, but the pandemic has made them order delivery and curb side pick-up more than dine-in, he adds. Fortunately, we had adapted well to the technology before the pandemic itself - offering online ordering, partnering with a delivery service, etc.From the best samosas to braised lamb shank, these restaurants offer the entire range of Indian cuisine. And with vegetarianism becoming a fashionable option in the US, theres a lot on platter that attracts that segment of customers.We believe in accommodating vegans, vegetarians, and carnivores with an innovative restaurant menu that will make customers feel welcome. Many diehard non-vegetarians quickly replaced chicken tikka masala with its vegetarian counterparts like vegetable, tofu, or paneer tikka masala, says Chef Durairaj.Customers can even customise their own classic dish with a protein and sauce of their choice. Theres a dedicated menu section for vegans and gluten-free lovers.We have a moderate number of fusion dishes and mixed drinks such as chicken tikka burger with potato kuri kuri fries; quinoa kale kofta with turmeric coconut sauce; lamb shank rogan josh with south Indian potato mash; blueberry chutney martini and curry leaves and smoked cumin margarita, Chef Durairaj told us.Despite the US economy opening up after the pandemic, challenges remain. From workforce issues to Indian grocery supply chain and increase in product prices, we face many challenges. Fortunately, we didnt get hit by the pandemic as much as other restaurants, mainly due to effective management of our operating expenses and adapting to the changing situations, Sankar says.The two friends are now planning to install new branches of the restaurant at a couple of locations in Washington DC and Maryland.",Indian American restaurateurs cash in on craving for comfort food in bad times,POTATO
2021-08-09,https://www.thehindu.com/news/cities/Mangalore/subsidy-on-transportation-of-fruits-vegetables-through-kisan-trains/article35804274.ece,"The objective is to protect the growers of fruits and vegetables from making distress sale  The Union Ministry of Food Processing has extended a 50% subsidy on transportation of notified fruits and vegetables through Kisan Rail Trains under Operation Greens  TOP to Total scheme. See website: https://mofpi.nic.in/Aatmanirbhar-Bharat/Operation-Greens-%28OTP-to-Total%29/about-og-total.  Under this scheme, 50% subsidy is allowed in freight charges for transporting the notified commodities, the benefit of which will be extended by Chief Parcel Supervisors at the loading station.  The objective is to protect the growers of fruits and vegetables from making distress sale and reduce the post-harvest losses.  Eligible crops in fruits category are mango, banana, guava, kiwi, litchi, papaya, musambi, orange, kinnow, lime, lemon, pineapple, pomegranate, jackfruit, apple, almond, aonla, passion fruit and pear. In the vegetable category are French beans, bitter gourd, brinjal, capsicum, carrot, cauliflower, chillis (green), okra, cucumber, peas, garlic, potato and tomato.  For more details, farmers/eligible entities can approach the nearest parcel office at railway stations, a release from the South Western Railway, Mysuru Division, said on Sunday.","Subsidy on transportation of fruits, vegetables through Kisan trains",POTATO
2021-08-09,https://timesofindia.indiatimes.com/city/mysuru/50-subsidy-on-freight-for-vegetables-fruits/articleshow/85159111.cms,"MYSURU: In order to protect the interests of farmers, a subsidy of 50% on the transportation of notified fruits and vegetables through Kisan Rail trains has been announced by the central government.In a press note released on Sunday, South Western Railway, Mysuru division senior divisional commercial manager Manjunath Kanamadi said that the Union ministry of food processing (MoFPI) has extended a subsidy of 50% on transportation of notified fruits and vegetables through Kisan Rail trains under Operation Greens  TOP to Total.Under this scheme, 50% subsidy is allowed in freight charges for transporting the notified commodities, the benefit of which will be extended by chief parcel supervisors at the loading station. The objective is to protect the growers of fruits and vegetables from making distress sales, and reduce the post-harvest losses.The eligible crops are mango, banana , guava, kiwi, litchi, papaya, mausambi, orange, kinnow, lime, lemon, pineapple, pomegranate, jackfruit, apple , almond, amla, passion fruit and pear in the fruits category, and French beans, bitter gourd, brinjal, capsicum, carrot, cauliflower, green chillies, ladies fingers, cucumber, peas, garlic, potato and tomatoes in the category of vegetables.","50% subsidy on freight for vegetables, fruits",POTATO
2021-08-11,https://indianexpress.com/article/cities/delhi/arvind-kejriwal-manish-sisodia-delhi-chief-secretary-anshu-prakash-assult-case-timeline-7448807/,"A Delhi court Wednesday discharged Delhi Chief Minister Arvind Kejriwal, Deputy Chief Minister Manish Sisodia and nine others in a case of alleged assault on former Chief Secretary Anshu Prakash. Here is a timeline of the case starting from the alleged assault in February 2018 to the court verdict Wednesday:  February 19-20, 2018: The alleged assault takes place on the intervening night of February 19 and 20, 2018 at Kejriwals residence, where the then Chief Secretary Anshu Prakash was called for a meeting.  February 21, 2018: V K Jain, who was then Kejriwals adviser, deposes before Delhi Police and states that he was also present in the meeting but did not see Prakash being manhandled.  February 23, 2018: Delhi Police conducts search at Kejriwals residence for CCTV footage.  July, 2018: IAS officers in Delhi wear black badges in protest against the alleged assault and demand apology from Kejriwal and Sisodia. Thereafter, Kejriwal says the IAS officers have gone on strike and holds a nine-day sit-in at the office of Lieutenant Governor Anil Baijal in protest. The protest is called off after bureaucrats start attending meetings at the Secretariat.  August 13, 2018: Police file chargesheet in which Kejriwal, Manish Sisodia and 11 AAP MLAs are named as accused. Hours after the chargesheet was filed, AAP issues statement in which it says the Modi government had turned Delhi Police into a mere political tool in its hunger to settle scores with the Delhi government at all costs.  October 25, 2018: Delhi court grants bail to Kejriwal, Sisodia and AAP MLAs on a personal bond of Rs 50,000 and surety of the same amount.  November, 2018: Kejriwal and Sisodia approach Delhi High Court challenging a trial courts order directing prosecution in the Chief Secretary Anshu Prakash assault case to be conducted by an officer of Delhi Police not below the rank of ACP. They also challenge the order permitting the two advocates to conduct the prosecution on behalf of the officer of Delhi Police, instead of regular public prosecutor.  November 17, 2018: Delhi Chief Secretary Anshu Prakash transferred from Delhi government to Department of Telecommunications as the additional secretary.  November 23, 2018: Vijay Dev, an IAS of 1987 AGMUT cadre, appointed Delhi Chief Secretary.  October, 2020: Observing that it is the duty of the investigating agency to bring to court all evidence collected during investigation without pick and choose, the Delhi High Court directs a trial court to consider an initial statement of V K Jain in the alleged assault case.  July 1, 2021: Supreme Court dismisses a plea by Delhi Police against sharing copies of witness statements with Chief Minister Arvind Kejriwal and Deputy Chief Minister Manish Sisodia in the 2018 case of assault of Anshu Prakash. It might be a political hot potato but legally, it is nothing. It is not worth lingering on this matter. The High Court verdict is in the interest of liberty and we will affirm it, a bench comprising Justices D Y Chandrachud and M R Shah observes.  July 26, 2021: Digital media portal The Wire reports V K Jains phone number is among those on a leaked global database, first accessed by French non-profit Forbidden Stories and Amnesty International, indicating people who were potentially targeted by Israeli spyware Pegasus.  August, 2021: Delhi court discharges Kejriwal, Sisodia and nine others in the alleged assault case","Court discharges Kejriwal, 10 others in Delhi Chief Secretary â€˜assaultâ€™ case: A timeline",POTATO
2021-08-11,https://www.thehindu.com/news/cities/Coimbatore/2157-crore-spent-on-1874-persons-for-covid-19-treatment/article35864738.ece,"The State Government has spent 21.57 crore towards treatment of 1,874 persons in the district who took treatment in private hospitals, said a release quoting Monitoring Officer and Principal Secretary M.A. Siddique, who for the second day on Wednesday inspected various places in the district to review preparedness to tackle the infection spread.  The release said the administration had approved 48 hospitals to provide COVID-19 treatment. Now, under the Chief Ministers Comprehensive Health Insurance scheme, it had approved another 64 hospitals taking the total hospitals approved for COVID-19 treatment to 112.  During his visit in and around Mettupalayam, Mr. Siddique visited the Government Hospital, potato market and Jadayampalayam vegetable market to check adherence to COVID-19 appropriate behaviour.  The release said that the State Government had directed hospitals to reserve 10% of the beds reserved for COVID-19 treatment for patients admitted under the health insurance scheme and added that in case of difficulty, members of the public could dial the toll-free number 1800 425 3993.","â‚¹21.57 crore spent on 1,874 persons for COVID-19 treatment",POTATO
2021-08-12,https://www.newindianexpress.com/cities/kochi/2021/aug/12/smells-like-a-smokey-spirit-2343412.html,"Mahima Anna Jacob By  Express News Service  KOCHI: For Steve Sebastian, smoked cooking is an art. The youngster, who is also a vocalist and a guitarist, is a fan of the slow cooking technique which can only be mastered with a lot of time, patience and practice. His online business Smoke Culture by Steve is his vision to make the cooking style more common in Kochi. Smoked cooking was largely popular in India. With time we have switched to other mediums. However, western countries still eat a lot of smoked food and use it as a technique to enhance taste in many recipes, he says.  The 22-year-old single-handedly cooks Texas-style beef briskets, Kansas-style smoked chicken, Pulled pork, Neapolitan-inspired wood-fired pizza, and artisanal sausages. The smoked cuisines are notched up by Steves authentic sides like Coleslaw, Mac and Cheese, baked potato salad, British yellow cheddar and corn pudding. I experiment with flavours from around the globe. It is amusing to see how well some unexpected combinations work out. One of the most widely-accepted sauces is the Kochi city sauce, where Kanthari (Tabasco pepper) is blended with some foreign ingredients, he says.  Briskets  From the Barbeque and smoked meat menu, the most hyped dish is the Smoked Beef Brisket. Flavoured meat from the breast or lower chest of beef is cut out and cooked to form a brisket. Having a family-run meat business has turned out to be a boon for Steve. The taste and flavour of Briskets depend on the quality of meat. It is a huge task to pick the right quality of beef as it varies from place to place, says Steve.  According to Steve, the meat should be cooked at a low temperature for about 16 hours. At times, it can go up to even 20 hours. While it is being cooked red wine will also be added.Briskets will turn out stiff and chewy otherwise, so we adopt slow cooking. Through this method, the collagen tissue which firmly connects the meat will break and form gelatin, giving the meat a right tenderness, he adds.  The meat is kept in an offset smoker, where flavoured wood, preferably tamarind, imported apple, cherry-oak wood, mango, guava are used to enhance the briskets flavour. One has to spend most of the day in front of the machine to check if the meat is getting smoked properly. Steve claims he takes limited orders because it is tough to cook many briskets at a time. Even slicing is a meticulous process and if done wrongly, the meat can lose its texture.  Though the process is labour-intensive, the effort is worthwhile, Steve says. The smoky tender juicy briskets are seasoned with salt and pepper. The luscious dish is available in one pound and half-pound.  Instagram @smokeculturebysteve",Smells like a smokey spirit,POTATO
