PUBLISHEDDATE,ARTICLEURL,TEXT,ARTICLETITLE,COMMODITY
2021-08-26,https://indianexpress.com/article/cities/pune/maharashtra-tomato-prices-crash-across-state-farmers-blame-bumper-crop-7472206/,"Bumper crop and blocked export avenues have seen tomato prices crash across wholesale markets in the state. The crash comes during a year when growers have, so far, reported minimum losses as the major tomato-growing areas of the state have not seen either heavy rainfall or a prolonged dry spell.  At Pimpalgoans wholesale market in Niphad taluka of Nashik district, the average traded price of the vegetable is currently around Rs 10.55/kg, less than half of the average traded price in August last year, which was Rs 25.55/kg.  In Punes wholesale market, the price of the vegetable is only around Rs 5-10/kg. Vilas Bhujbal, a local trader, said prices had gone down further last week as the arrivals had increased.   Stay updated with the latest Pune news. Follow Express Pune on Twitter here and on Facebook here. You can also join our Express Pune Telegram channel here.  In spite of the first wave of Cocid-19 pandemic and the lockdown, tomato growers had reported good returns in 2020, with the vegetable trading above Rs 20/kg for most of the year. However, since December last year, the trend has reversed and tomato prices have started falling.  Ironically, the price crash comes at a time when farmers from Maharashtra are in the middle of an excellent crop, and growers in Latur, Ahmednagar, Aurangabad, Pune and Nashik have reported good harvest of the vegetable.  Ajit Korade, a vegetable grower from Phaltan taluka in Satara district, said none of the tomato-growing districts have experienced either excessive rain or a prolonged dry spell this year. As the monsoon has been good over the last three years, the cultivation area of vegetables has grown in the state, he said.  Also Read | BMC to launch Mumbais climate action plan website on Friday  While plenty of rain this year may have helped the farmers, the markets have failed to rise to the challenge of a bumper crop.  Shriram Gadhave, president of the Vegetable Growers Association of India, blamed the stoppage of exports for the present price crash. Due to the turmoil in Afghanistan, land exports to Pakistan have also stopped for the last few days, he said. While demand for Indian tomatoes is good in Middle East, not much is being shipped out given the high cargo charges.  Gadhave said there has been a bumper tomato crop even in other states, including Gujarat and Madhya Pradesh, creating a glut in the markets. What we need is export-oriented schemes farmers have good crop but no markets to sell their produce in, he said.","Maharashtra: Tomato prices crash across state, farmers blame bumper crop and blocked export routes",TOMATO
2021-10-18,https://indianexpress.com/article/india/heavy-rain-poor-produce-push-up-onion-tomato-prices-trend-to-stay-till-dec-end-7578924/,"With Heavy rainfall since August-end leaving market-ready crops extensively damaged, affecting arrival and quality of the produce, prices of onion and tomatoes have gone up steadily across the country.  Data from the Ministry of Food, Public Distribution and Consumer Affairs show that retail prices of onion and tomatoes have increased significantly in the last one month. Onion prices in Delhi have gone up from Rs 33/kg in September to Rs 47/kg.  The price escalation has been steeper in the case of tomatoes, with Delhi markets now retailing it at Rs 59/kg, compared to Rs 28/kg a month ago. At some other places, onion prices have touched or crossed Rs 50/kg, while tomato prices are nearing Rs 60/kg.  Farmers had earlier reported damage to stocked produce, harvested in April-May. The overall availability of onions had started dipping since September-end.  At Lasalgaons wholesale market in Maharashtras Nashik district, the average traded price of onion is rising since the third week of September. The prices, which for most part of the year were around Rs 1,500-Rs 1,600/quintal, have breached Rs 3,300/quintal.  Suresh Deshmukh, a commission agent in Nashiks Dindori taluk, said new arrivals were of poor quality. Such onions dont have much market value. The only tradable onion now is stored onion, which farmers are offloading, he said.  In the case of tomatoes, the average traded price at Karnatakas Kolar market has been over Rs 3,000-Rs 3,500/quintal. Traders in Kolar pointed out that September rains had caused damage to the crop in the area.  The present trend is expected to continue till December-end. Prices are also going to increase as demand increases after Covid-19 restrictions ease out, said Deshmukh.","Heavy rain, poor produce push up onion, tomato prices; trend to stay till Dec-end",TOMATO
2021-10-29,https://www.thehindu.com/life-and-style/food/the-lesser-known-sourashtrian-food/article37225514.ece,"The small Sourashtrian community in Madurai has used the quiet of lockdown to revive heirloom recipes, many of which lay the foundations for Tamil Nadus most popular dishes  Streets and markets in the temple town of Madurai come alive in the evenings with pushcart vendors selling crisp vadais made with deep fried spinach or powdered mulmurungai leaves pounded with cumin. Also, there are sojji appams, sweet little maida pooris stuffed with rava kesari, and nutrient-rich paruthipaal made from extracted cotton seed milk blended with rice flour, cardamom, dry ginger and palm sugar. These dishes that are an integral part of the citys street food culture are staples in Sourashtrian households in South India. Yet there is much more to be discovered especially during the festival seasons and special ceremonies, when Sourashtrian families get together to prepare and share traditional recipes handed down generations.  Sensing an opportunity to revive heirloom recipes during the pandemic, members of the Sourashtra community planned food festivals to remind members about what defines their food, while simultaneously showcasing their food culture to the rest of the city. The first, a three-day food festival held recently in temple town Madurai revived some time-honoured recipes.  Sourashtrian delicacy Polte Chaino now commonly known as mutton kootu | Photo Credit: Special Arrangement  According to chef Aravinth G N, who curated the food festival, it is believed that the Sourashtrians brought the idli to South India. A blend of rice and urad dal, ground together and steamed to form cakes called iddada can be traced to Gujarat in the 10th to 12th Century. Rasam is also said to have originated in 16th Century Madurai, made by the Sourashtrians who called it pulichaar.  There are select dishes in traditional Sourashtrian menus for weddings and important ceremonies; we follow the ingredients and preparation style as taught by our ancestors, says Aravinth, whose family is known for its expertise in Sourashtrian cuisine and has been in private catering for the last six decades.  The taste, texture and ingredients of our cuisine has transformed under the influence of Tamil culture; even the names changed, says C R Venkatesh, president of Sourashtra Small Business Association. For instance tamarind rice, popular as puliodharai now, was called ambad bhaat; saman ambadi is kudal kuzambu, limbu pongal is commonly known aslemon rice, while the spicy alagar koil dosa evolved from halke dhowra thida. The original Sourashtrian tomato rice has a strong cinnamon flavour while their sakkarai pongal is prepared in paruthipaal (cotton seeds milk).  Sourashtrian delicacy The original Ambad Bhaath is what we now know as tamarind rice or puliyodharai | Photo Credit: Special Arrangement  Our ingredients and food are unique in taste, yet nowhere in the world there is a decent restaurant offering authentic Sourashtrian cuisine, rues Yogesh Thirukonda, who conceived the revival initiative.  It is estimated that there are around 6,00,000 Sourashtrians across Tamil Nadu, and Madurai is a major hub with 1,80,000 settled there. History records that the silk thread merchants from Gujarat were brought as royal weavers by the Nayak kings of the South in mid-17th Century.  Three major waves of migration happened, to Madurai, Thanjavur and Salem. When people move, they not only bring their food with them but the memories of home, says Venkatesh adding that heritage recipes and food available in the new place of work and living often amalgamate to shape the immigrant experience, while influencing their new home.  The community is now keen on compiling the traditional recipes to bring out a book on Sourashtrian cuisine because food is as much about memories as it is about festivity, culture, spices and names that ought to be documented, says Thirukonda.  Sourashtrian specialities  Sourashtrian delicacy Sekki Bhaath | Photo Credit: Special Arrangement  Sekki Bhaath: Special occasion dish made with three types of milk (cotton seed extract, coconut and cow milk), while adding ghee and jaggery to the rice. As part of tradition, the rice is served hot to mothers-to-be in the fifth month of pregnancy. The other special rice variety is kalkandu sadham (sugar candy or misri rice)  Sourashtrian winter dessert Dhhodh Dhowlo | Photo Credit: Special Arrangement  Dhoodh Dhowlo: A winter delicacy, the dumplings are made with rice grounded into powder and kneaded into small balls and added to hot boiling milk sweetened with sugar and flavoured with cardamom powder.  Sourashtrian delicacy Pankara Paan Bhairi, the crispy pooris made with five types of greens | Photo Credit: Special Arrangement  Pankara Paan Bhairi: Deep fried green poori contains five different types of healthy keerai (greens) including Pankarapaan (type of spinach with small leaves), Mullu Murungai (thorny drumstick), Thoodhuvalai (a thorny green hub), thippili (Indian long pepper leaves) and palak (regular spinach) ground with pepper and stuffed in rice patties that are fried in a mixture of refined sunflower oil, gingelly and castor oil and served with chenna bhurko (fried gram powder).  Sourashtrian delicacies:Madurais famous Alagar Koil spicy dosa that is believed to have originated from Sourashtrian Halke Dhowra Dhido | Photo Credit: Special Arrangement  Halke Dhowra Dhido : Spicy dosa made out of ginger, pepper, green chilli, cumin seeds, curry and coriander leaves and turmeric powder ground to paste and added to the regular dosa batter. The crepes are made only by sprinkling gingelly oil and served hot with alla (ginger) and nalar (coconut) chutney.",In search of the idli’s ancestors,TOMATO
2021-11-01,https://indianexpress.com/article/lifestyle/life-style/wedding-season-get-rid-of-puffy-face-skincare-7601830/,"Every bride wants to look her best while getting married. But, in the days leading up to the wedding, the stress, shopping, and general anxiety about wedding arrangements can make her skin act up.  While some experience sudden acne, for others, the lack of good sleep, etc., can give rise to puffiness of the face. So, how to get rid of it?  Dr Madhu Chopra, a cosmetologist and the managing director at Studio Aesthetique, says a puffy face happens when:  1. There is dehydration due to excessive alcohol or a bad diet. The body reacts by holding on to the available water and storing it, which leads to a puffy face.  2. High salt content in the diet also works as a hygroscopic and retains fluids.  3. Allergies to trial makeup or certain types of food or medication.  ALSO READ | Bridal yoga for healthy skin and calm mind  How to help yourself with some simple effective treatments?  * Drink plenty of water.  * Take less salt in your diet, not more than 1500-2300mg.  * Increase the intake of fibres. Papaya is an excellent fruit to keep your gut healthy by eliminating all the toxins from the body.  * Add beta-carotene and antioxidants to keep the fluid off your face.  * Cardio and weight training improves blood circulation and removes the toxins as well as fluids.  * Get good body massages and regular facial massage with light fingers or jade roller.  As a last minute solution, you can try the following:   Clean and grate potatoes to apply on your face as a mask.   Fresh tomato juice applied on the face helps reduce puffiness.   Jade roller massages are a must.   Keep your bowels clean.   Go for a refreshing swim/run.   You can also try taking a bowl of ice water and putting your face in it for 30 seconds which will give you an absolutely fresh looking face. This is a last minute solution, so it should not be done often. Using this technique before putting on your makeup is the best thing.  ALSO READ | Simple Ayurvedic face packs that you must try at home  Few forbidden activities:  . Laziness and staying in bed for too long.  . Alcohol consumption and smoking.  . Excessive salt intake.   For more lifestyle news, follow us on Instagram | Twitter | Facebook and dont miss out on the latest updates!","This wedding season, here’s how to get rid of a puffy face",TOMATO
2021-11-01,https://indianexpress.com/article/lifestyle/health/diwali-season-healthy-eating-habits-desserts-7597004/,"In India, festival time is when people tend to stray from healthy eating habits and allow themselves to binge-eat, and eat unhealthy food that is typically not a part of their everyday diet. While occasional cheat-meals are okay, one must also learn to consciously stay away from foods that can harm their health and lead to lifelong issues.  As we await Diwali, Minal Shah, senior nutrition therapist, Fortis Hospital, Mulund shares some pointers on how one can enjoy the festival of lights, keep their taste buds happy and also not compromise on health.  ALSO READ | This festive season, balance your cravings with these simple tips  Here are a few pointers for enjoying guilt-free desserts:  1. Choose a milk-based dessert like shrikhand, sandesh, mishit doi, kheer, etc. Milk is a good source of first-class protein, and these desserts can easily be made at home with any modifications that we desire.  2. Sugar can be replaced with natural flavoring agents like cinnamon, nutmeg, dry fruits like dates, raisins, and fresh fruits. To an extent, jaggery and honey can also be opted over refined sugar, but with quantity restriction.  3. Make a healthier choice among existing desserts.   Choose badam katli (omega-3 fatty acids) over kaju katli.   Choose besan ladoo (protein) or peanut ladoo (MUFA) over rava ladoo, Mysore pak (protein) over coconut ladoo.   Choose carrot halwa or dudhi halwa (antioxidants/vitamins) or moong dal sheera (protein) over rava sheera.   Choose payasam over a regular rice kheer.  4. Try something new and unconventional with a functional food added to it. Like dates sesame ladoo, oats dates nut ladoo, walnut ladoo, methi kheer, dudhi kheer, apple sheera, fruit kheer, papaya halwa, beetroot halwa, carrot kalakand, oats pancakes with cranberry syrup or blueberry syrup or chocolate syrup, homemade protein bars, apple pie, pumpkin pie, fruit yogurt, seeds chikki (pumpkin/sunflower/flaxseed).  5. Consider the portion size. There may be desserts which are high in fats like jalebi, malpua, gulab jamun, gulpapdi, sheera etc. If its your favourite, reduce the portion size. Cut smaller pieces to reduce the calorie intake.  6. Also, remember the basics  add a good bowl of salad with different coloured vegetables and fruits to ensure healthy fibre in every meal.  7. Add fillers for yourself and your guests, which are low in calories and tasty as well like ginger lemonade, virgin pina colada, kiwi margarita, masala milk, thandai, milkshake with fennel seeds, falooda, cucumber mint cooler, tomato mocktail, etc.   For more lifestyle news, follow us on Instagram | Twitter | Facebook and dont miss out on the latest updates!","This Diwali season, incorporate these healthy eating habits",TOMATO
2021-11-03,https://www.thehindu.com/life-and-style/food/eating-out-in-delhi/article37299507.ece,"Despite the challenges of the ongoing pandemic, a surge of feisty restaurants have launched, drawing on memories of the past and summer holidays to create alluring dining spaces  The Tangra Project  Chef Vikramjit Roys face beams like the Qutab Minar on a moonlit night, or, in his case, the Victoria Memorial. He has just launched The Tangra Project, his first own restaurant, after two decades in the industry, along with business partners Vir Kotak and Anurodh Samal. The three had started Context.Eat, the parent company, earlier last year.  Located in Delhis DLF Avenue, this barely two-month-old restaurant is an ode to Kolkata, the city where Vikramjit was born and spent his formative years. Right from the second hand book shops on College Street to the river Hooghly, everything finds a representation in the restaurant, either is the form of decor or dish. This includes marble pillars that resemble stacks of books, a giant mural of a vibrant fish that finds itself sprawled across three walls, and lights on the ceiling which are reminiscent of the toony bulbs that are strung during pujas and festivals.  Working on this project brought to life a gamut of memories for Vikramjit. As we bite into a deliciously creamy haleem on toast, he recalls how he used to catch the 1 pm show with his friends at the erstwhile Chaplin Theatre, and then wait outside for a specific vendor who sold haleem. That is what he recreated.  The kosha mangsho and kochuri are what his Sundays were made up of; he would go to the butcher with his father and get the best pieces to make this household favourite. At this restaurant, Vikram has obediently followed his mothers recipe for the kosha mangsho. She came here and taught us how to prepare it and then followed it up with a video, he laughs.  The menu is a rolodex of Kolkatas iconic dishes: Chinese, Anglo Indian, Mughlai and of course Bengali. Here youll find bhetki fish wrapped with the sharp flavours of kasundi, kanch kola kofta (dumplings made of raw plantain), cholar dal, Tangra style chilli chicken and chicken cutlets so crisp that when you bite in, you hear a satisfying crunch (#ASMR). The breadcrumbs  in which the cutlets are coated  are sourced from Kolkata, as are the other raw ingredients.  Then there are the recipes that took shape in Vikrams head before finding themselves plated on elegant crockery. These include parwal guacamole: pointed gourd being cooked for 18 hours and then made into a fine paste, featuring bits of tomato and pomegranate, shining like bright jewels on a bed of green. Or spinach, roasted poppy seed in sesame sauce, a simple yet delightful combination. If you are in the mood to experiment, the menu also offers a mustard and tender coconut mousse.  The menu, Vikram says, will keep changing according to each season. Hardly a challenge, given they had to bring down the number of entries from 500 to 200.  The Tangra Project Unit No. 154-159 Commons, DLF Avenue, Saket. Call: 8929925253  Colocal  Theres a slice of Pondicherry in the trendy Dhan Mill compound in Chattarpur.  With its sunshine yellow facade  dappled with pink bougainvillea  French style doors and courtyard bordered with white pillars, this chocolate factory and cafe mirrors the laidback charm of the former French colony. Colocal is a passion project of Sheetal Saxena and her husband Nishant Sinha. For Sheetal, a chocolate aficionado, the idea to start a bean to bar brand came to her while she was watching videos of cacao being roasted. Curiosity led her to research more on the subject and thus Colocal was born.  They are currently doing dark chocolate: 55, 66, 72 and 85%. The eventual goal is to reach 95%, says Nishant who also owns the Roastery Coffee House in Hyderabad and Kolkata. There are bonbons and truffles, and the chocolates are also blended with sea salt, nuts, caramel among others.  Also Read | Roastery Coffee House, Hyderabad review  Colocals cacao beans are sourced from Idukki in Kerala. We roast our cacao in a proper coffee roaster and that gives our chocolate a different taste, explains Nishant. He says that often there are many myths associated with chocolate. People think chocolate is sugar. Through these tours of our boutique chocolate factory we are able to show them that it is actually derived from a fruit. They can see the process right from roasting, conching to melanging, he adds.  At Colocal chocolate factory and cafe  The menu is simple, with a choice of breakfast platters, granola bowls, generously filled sandwiches, tacos, sour dough pizzas and pastas. The hot chocolates  there are about seven varieties including caramel and banana  are favourites; one sip of the smoky campfire hot chocolate and you will realise why. Fluffy white marshmallows, also made in-house, are just as decadent. The plan is to make quality couverture chocolate and break the international dominance that is there in the market, says Nishant, adding, We want to showcase Indian cacao to the world.  Colocal, Shade no. 21b, Dhan mill compound, 100 Feet Road, Chhatarpur. Call: 9310524620  They have a new branch in Khan Market.  Klap  As posh as it may seem, at Klap you can nonchalantly forego your fork. Follow Chef Gurmehar Singh Sethis instructions: Two fingers, one bite. Apparently, that is the best way to enjoy the innovative bite-sized small plates that this trendy bistro by day and gastro by night is known for.  The bistro offers sushi, galouti kebab, golgappa with pomello, dimsums (in stunning red and purple hues, using natural colour from beetroot and purple cabbage) and more. The idea here is to try an array of cuisines rather than commit to one large main course for the entire evening.  There are large plates too. The massaman curry, for instance, where the meat is cooked for 24 hours in a sous vide machine. The food represents the chefs culinary journey across London, Dubai, Maldives and Phuket, among others. The menu also lists favourites from closer home, like appams, chicken Chettinad and cone dosa.  Owned by Gurmehar, Navdeep Singh Sethi and Alekh Vardhan, Klap was born in April, but had to temporarily shut down due to the second wave of the pandemic, before reopening in June. Spread over two floors, it has a terrace offering open air dining. The terrace also has the Chefs garden that grows basil, birds eye chilli, ajwain (carom), coriander, ginger flower, lemongrass, and microgreens such as amaranth, says Gurmehar, adding that he believes in sustainability.  To that end, cucumber and tomato peels are dehydrated and served with a dash of pink salt and paprika, as nibbles at the bar. Stems of broccoli and leftovers of onion are frozen in blocks of ice, which double up as slabs on which sushi, sashimi, and nigiri are served.  Klap is currently awaiting its alcohol license and is working on elaborately concocted drinks such as a sous vide cocktail and some made with peanut butter.  Klap, 2, Rabindra Nagar, Khan Market. Tel: 9919918323",Eating out in Delhi? Here is how the city’s pandemic babies are innovating to draw diners,TOMATO
