PUBLISHEDDATE,ARTICLEURL,TEXT,ARTICLETITLE,COMMODITY
2021-05-23,https://www.thehindu.com/news/national/tamil-nadu/covid-19-norms-flouted-as-people-across-tamil-nadu-throng-shops-ahead-of-intense-curbs/article34629598.ece,"People gather at shops from 6 a.m.; COVID-19 norms flouted.Ahead of the intense lockdown for a week from Monday, huge crowds thronged markets, grocery shops and meat stalls across Tamil Nadu on Sunday.Even after the government made it clear that shops would operate till 9 p.m., people gathered at shops from as early as 6 a.m. As the hours passed, physical distancing went for a toss.Crowded markets, long queues in front of grocery outlets and meat stalls, traffic congestion and vendors putting up stalls on roadsides were common in the cities of the western region. In Coimbatore, people lined up at retail outlets from 6 a.m. Vegetable prices sky-rocketed in Coimbatore and Erode. However, the prices dipped in Coimbatore by evening.People thronged markets and commercial establishments in major towns in the Nilgiris district. In Salem, roads leading to market places were crowded as vendors put up stalls, leading to congestion near the Suramangalam market, the Hasthampatti market and the Anandha Bridge market. People flouted COVID-19 safety norms at almost all places.In Tiruchi district, people thronged vegetable markets, meat stalls and even clothing stores ahead of the lockdown. Traffic jams occurred on Madurai Road and near the Gandhi Market, even as vendors sold their ware at inflated prices. People thronged clothing stores as the day passed. We did not expect the clothing stores to open. We needed some clothes for our children..., a customer said.Vegetable prices sky-rocketed in Madurai. P.S. Murugan, president of the Central Market Wholesale Vegetable Vendors Association, said one kilogram of tomato went for 50 as against 10 earlier. All the vegetables cost at least three times higher, he said. Mutton stalls at Gomathipuram increased the price of meat from 900 a kg to 1,200.Traffic jams on arterial roads, cramped parking lots and crowded shops and markets were a common sight in different areas of Madurai city. The bustle on East Veli, East Masi and East Marret Streets was similar to what it would be on the eve of Deepavali, said K. Rahman, a businessman.In Vellore, health officials set up a vaccination centre and COVID-19 testing centre at the market entrance. Many vendors and members of the public were vaccinated and some of them were tested.",People across Tamil Nadu throng shops ahead of intense curbs,TOMATO
2021-05-24,https://www.thehindu.com/news/cities/Coimbatore/markets-crowded-as-covid-19-norms-go-for-a-toss/article34629338.ece,"People made a beeline in front provisional stores as they waited in a long queue for purchasing essentials.Crowded vegetable markets, long queues outside provision stores and roads jam-packed with vehicles were the scenes witnessed in the city and in rural areas on Sunday ahead of the week-long lockdown from May 24.Right from early morning, people in large numbers thronged Nethaji Daily Vegetable Market, Uzhavar Sandhai, grocery stores, fruit shops, meat and fish stalls, provision stores in Kongalamman Kovil Street and Manikoondu, to purchase and stock items for a week.Prices of vegetables and fruits in the markets had gone up significantly. The price of tomato rose from 7 a kg on Saturday morning to 30 a kg on Sunday. Traders wanted to exploit consumers even during the pandemic by selling at exorbitant price, said T. Chandrasekar of Sampath Nagar.People made a beeline in front provisional stores as they waited in a long queue for purchasing essentials. Since most of the shops, including textile showrooms, were opened in the city for the day, roads were crowded throughout the day.Physical distancing went for a toss as people crowded shops and moved in close proximity with others in market areas while many had their masks on their jaws. The crowd thought that the city is free of COVID-19, said a police official monitoring the crowd movement.At the corporations Central Bus Terminal, less than 50 mofussil buses were operated to other cities while a minimum number of town buses was operated to various destinations in the district which saw poor patronage.In Salem, the crowd in public places since Saturday evening raised concerns of possible spike in COVID-19 cases in the district in the coming weeks as the residnets went on a panic buying spree in the district following relaxations in restrictions.Ever since the announcement on relaxations came on Saturday, supermarkets, grocery shops and even non-essential businesses raised shutters. Roads outside market places were crowded as vendors set shops on road sides leading to even traffic congestion near Sooramangalam Market, Hasthampatti Market and near Anandha Bridge Market. Huge crowd was also present at the fish market here.Street vendors set up shops on the day public crowded at such places sans all COVID-19 safety protocols. Physical distancing norms went for a toss at market areas here and traffic congestion occurred at Four Roads junction, Sooramangalam and at other important junctions here. Police checking was minimal on roads as the State government had permitted operation of all businesses on the day. Hotels, eateries operated and even tea shops functioned.The Tamil Nadu State Transport Corporation and SETC operated buses to neighbouring districts. However, the crowd was minimal at bus stands.Salem City Police organised an awareness programme at Pallapatti police station and distributed Kabasura Kudineer to the public.Assistant Police Commissioner Nagarajan distributed awareness pamphlets to the public and also flagged off awareness vehicles.The Labour Department has set up a helpdesk at the Salem railway station to offer assistance to guest workers, who are willing to return to their native States.",Markets crowded as COVID-19 norms go for a toss,TOMATO
2021-05-24,https://timesofindia.indiatimes.com/city/coimbatore/madness-on-lockdown-eve-protocols-go-for-a-six/articleshow/82891314.cms,"In Coimbatore's Cross Cut Road and Ukkadam market, an inch of space was difficult to find.COIMBATORE: Traffic on city roads and crowds at shopping hubs on Sunday resembled a festival-eve experience. While panic shopping drove people in huge numbers to grocery stores and markets a day before another week-long complete lockdown kicked in, it also showed that the newly-elected government has a long a way to go to break the chain of the virus.Chaos prevailed in crowded market areas such as TK Market, Ukkadam vegetable market, TK Market and grocery shops across the city, where narrow roads and the population density does not allow for Covid appropriate behaviour, through Sunday.At shopping hubs and other places, physical distancing went for a toss despite warnings that hefty monetary fines would be slapped on violators.Vegetable prices shot up manifold as demand rose due to short supply from farms. More than 50,000 people visited TK Market on Sunday to buy vegetables. We dont have any stock to sell after 3pm, said A M Shajahan, a vegetable seller.A kilogram of beans, which was sold for Rs 60 on Saturday, was sold for Rs 200 on Sunday. Tomato was sold for Rs 50 (Rs 20 on Saturday), brinjal for Rs 80 (Rs 40), beetroot for Rs 60 (Rs 20), carrot for Rs 60 (Rs 40), cabbage for Rs 30 (Rs 15), lemon for Rs 120 (Rs 70), bitter gourd for Rs 80 (Rs 40), big onion for Rs 50 (Rs 25) and 1.5 kg of small onion for Rs 100 (Rs 50).People stocked up on vegetables and essential items as shops wont open for a week, Shajahan added.Though most of the customers wore masks, they failed to maintain social distancing.Meanwhile, people thronged bus terminals to leave for their native places, mostly to southern districts. The Tamil Nadu State Transport Corporation (TNSTC) operated buses to Tirupur, Erode, Salem, Madurai, Mettupalayam, Pollachi, Udumalpet, Palani and Trichy from Coimbatore city. Thousands of people were gathered at Singanallur bus stand, Ukkadam bus stand and Coimbatore central bus stand. The Tamil Nadu State Express Transport Corporation (TNSETC) operated buses to southern districts.To enforce lockdown norms, the city police will deploy 1,000 cops from Monday morning. People can step out only for medical emergencies, deputy commissioner of police G Stalin said. We will book anyone found loitering and seize their vehicles, he said. The rural police will deploy 750 cops.The situation wasnt any different in the states capital city. The efforts of frontline workers all these days are being negated because of policy decisions like this. To blame everything on public indiscipline is also unfair as the authorities gave only one-and-a-half day for people and naturally panic mode creeps in. The decision makers should have thought better, said S Srinivasan, a resident of Velachery in Chennai.",Coimbatore: Madness on lockdown eve; protocols go for a six,TOMATO
2021-05-26,https://timesofindia.indiatimes.com/city/pune/cyclone-tauktae-hits-supply-of-veggies-triggers-price-rise/articleshow/82957030.cms,"PUNE: The Agriculture Produce Market Committee (APMC) has reported a 10-15% increase in the prices of all vegetables, including leafy greens, onions and tomatoes, at the Market Yard here. The price hike was blamed on a disruption in supply for the past two days in Pune district in the wake of cyclone Tauktae Sources said the intake at the Market Yard was less than average on Monday and Tuesday.The supply disruption has had an effect on the prices of vegetables. But this wont last long as a fresh supply of vegetables is soon expected, said Madhukant Garad, chief administrator of the Market Yard and secretary of the Agriculture Produce Market Committee (APMC).On an average, the Market Yard gets 900-950 truckloads of vegetables per day. This dropped to 850 truckloads on Monday, officials from the vegetables section at the Market Yard said.On Tuesday, we got 20,599 quintals of vegetables and fruits in 873 vehicles. This is less than the average intake and led to the price hike, Datta Kalamkar, head of the vegetables section, told TOI.Kalamkar said demand for all vegetables was high in the market. Poor weather and the cyclone have affected crops in most tehsils of the district, he explained.Vilas Bhujbal, head of the Commission Agents Association, said most farmers do not cultivate fresh vegetables, particularly coriander, fenugreek and spinach, due to uncertainty in sales and low rates. Several farmers had not planted cauliflower and tomato, among others, due to Covid restrictions. This has also disturbed the supply. Because of this, prices will remain high for a few days, he said.In the retail markets, a kilo of onion was sold for Rs15-20, while potato and tomato were going for Rs15-22 and Rs8-14 respectively.The rates of leafy vegetables too increased by Rs 5-10 per bunch. A bunch of Coriander is now sold for Rs 10Rs 15, while fenugreek is being sold for Rs12-18 per bunch. Spinach, meanwhile, costs Rs 7-12 per bunch.Sandesh Khade, a retailer from the Vishrantwadi market, said he expects the prices to remain high for two weeks at least. The supply shortage could affect prices for the next two weeks or so. Many farmers told us that they havent grown fresh vegetables because of the curbs, he said.Deepti Deshpande, a resident of Dighi employed with a private firm, said citizens will feel the pinch, especially with the financial impact of the ongoing pandemic. This comes at a time when salaries are being reduced. It has become difficult to meet our monthly expenses, she said.Archana Gardare, a resident of Dhankawdi, said, We always buy vegetables at high pricees. The prices of several grocery items too have significantly increased this month. We dont know how to manage monthly expenses. Things have become very difficult during the pandemic",Pune: Cyclone Tauktae hits supply of veggies,TOMATO
2021-05-27,https://www.newindianexpress.com/cities/hyderabad/2021/may/27/a-salad-a-daycan-keep-the-pounds-at-bay-2308024.html,"HYMAVATHI M ByExpress News ServiceHYDERABAD : Over the years, we have heard all the salad jokes and the most common one is Haha, are you a goat, why are you eating grass? Haha. Lame. I say, all these not-a-salads-person kind of people make these jokes only until they take a bite from a perfect bowl of salad. A chilled watermelon feta salad with mint garnish for lunch on a hot summer day or a Subway chicken teriyaki salad bowl is all you need for a hearty meal.Salads are refreshing, easy to make and nutritious. In summers, nutrient-rich yet tasty food is a good way to keep your health in check, especially when a lot of people are working from home. Quinoa, for example, is a rich source of protein, essential minerals, and amino-acids which regulate your body function. Include citrus fruits, cheese and nuts in your salads as they help in immunity building, says Md. Shahid Hossain, executive chef at the Taj Krishna.Whether you are working from home or attending an online class, try to switch to a salad for lunch. These are very light and prevent you from dozing off in your chair. Summer salads, paired with a good workout plan, will help you shed those pandemic pounds easily. Otherwise, include a salad as a side dish to your meal or snack time and you will be able to inculcate the necessary veggies and hearty greens into your diet effortlessly.Mansi Patel, a nutritionist based in Hyderabad, says, Salads are a good source of fibre, which helps relieve constipation. Salad bowls usually contain a rich source of protein, a healthy amount of fat and veggies that contain vitamins and minerals. For people who are watching their weight during the lockdown or those who want to improve their strength, salads are the easiest and most beneficial.Everyone loves a salad at a restaurant but a lot of us will not touch lettuce unless it is in a delicious burger. The creamy and savoury dressings make all the difference to a salad bowl. Be it any sauce -- a tangy BBQ or a refreshing mint mayonnaise or a basic mixture of mustard, honey, and vinegar -- salad dressings add flavour and zing to your greens. Some of the sauces that are available on e-commerce platforms are mint mayonnaise, BBQ, chipotle southwest dressing, sriracha sauce and honey mustard, among others.Instead of boring yourself with a standard salad dressing, which will eventually make you give in to cravings, mix and match various dressings and sauces. Im sure youll be waiting to dig into your bowl every day. Finding veggies has become a hassle since the second lockdown has been imposed on the city. With all markets open during a short window early in the morning, it is not easy to find all the veggies you desire. Instead, check out the recipes below and order these vegetables and foods enough for a week, and you are all set.RecipeQuinoa and Avocado Salad(This salad is gluten-free and can also be enjoyed by people with dietary restrictions)Ingredients100 g quinoa | 1 avocado | 20 g cherry tomato | 50 g olives | 10 ml lime juice | 40 g walnut | 1 orange | 25 ml olive oil | 20 g feta cheese | 5 g mustard cress | 5 g chivesSalt and pepper to tasteMethod Soak the quinoa for 1 hour and boil it till softly cooked. Drain the excess water and refrigerate the quinoa Mix chopped olives, olive oil, lime juice, salt and pepper to make the dressing Peel the ripe avocado, remove the stone, and dice it neatly Mix the dressing with the boiled quinoa and adjust the seasoning accordingly Mould the quinoa mixture and arrange the avocado. Garnish with orange segments, feta cheese, cherry tomatoes, mustard cress, chives, lettuce and walnuts Md. Shahid Hossain, executive chef at Taj Krishna, HyderabadRecipeCorn Paneer Salad(For weight watchers)Ingredients4 thin slices of paneer | 1/2 cup sweetcorn | 1  cup chopped lettuce |  cup long-sliced capsicum | 1 cucumber - sliced | 3 cherry tomatoes - cut into halves | 10 black olives | 4 walnut kernelsMethod Pan roast 4 slices of paneer without oil or butter Boil the sweetcorn Chop lettuce, capsicum, cucumber, cherry tomatoes and black olives as instructed above In a mixer, add 1 tbsp of mayonnaise, 8-10 mint leaves, 2 cloves of garlic, 1/2 inch of ginger, 1 green chilli, 1/2 tsp lime juice, salt and pepper according to your taste. Grind it into a smooth paste On a bed of chopped lettuce, throw in all of the diced veggies and roasted paneer and serve it with this dressing - youll have a zippy salad bowl ready Mansi Patel, nutritionist",A salad a day can keep the pounds at bay,TOMATO
2021-05-29,https://www.thehindu.com/news/national/karnataka/farmers-left-high-and-dry-by-lockdown-in-karnataka/article34671711.ece,"Fall in demand and disruption of transport networks to blame, say growers of vegetables and flowersChandrakanth Rama, a small farmer in Kalaburagi district, had two acres of onion and ladies finger yet to be harvested when the lockdown was imposed in the last week of April. As a result, while transport costs skyrocketed, prices crashed so severely that he decided not to harvest the crop at all.The price offered was not even the quarter of what he would need to meet the costs. If I sell at these rates, I will incur heavy losses considering what it costs to harvest and transport. So I am feeding the ladies finger to my cattle. As for the onions, I have asked the labourers to harvest and take home as much as they want for free, Mr. Rama told The Hindu.Produce dumpedThis is the story of many farmers across Karnataka. A video clip of a watermelon grower in Sagar, Shivamogga, destroying his crop in frustration was widely shared. There was another of a jasmine grower dumping his harvest on the streets in the district, cursing the administration for the lockdown. Many tomato growers in Kolar and Chickballapur recently protested by throwing their produce on the street.A kilo of tomato was selling at less than 2, which wouldnt have even recovered my transport cost, leave alone my investment. So I abandoned the crop at the market and returned, said Adi Reddy, a tomato farmer from Kolar.The fall in demand for vegetables, fruits and flowers, the disruption of transport networks, and high transport costs following the Statewide lockdown imposed for the past three weeks have hit these farmers hard.Despite the lockdown guidelines clearly allowing free movement of all cargo, transport networks have been disrupted, especially inter-district and inter-State ones.For two weeks, vegetables were not being sent out of the State. This has now been resolved. The price of tomatoes improved to 7 to 9 a kg only after the supply to other States, including West Bengal and Bangladesh, resumed, said G. Srinivasan, a farmer from Nandi and a member of HOPCOMS. He also said transport operators were charging several times more than usual, citing the lockdown, police harassment, and skyrocketing diesel prices. Diesel prices have touched an unprecedented 90 a litre. This has also added to the farmers woes, he said.Inadequate reliefThe State government sop of 10,000 a hectare (4,000 an acre) for vegetable, fruit and flower growers has been dubbed woefully inadequate by farmers and farmers unions. The amount they have promised to grant us does not compensate for the loss we are facing every day, said Ganesh, a farmer from Hassan.Kodihalli Chandrashekhar, president of Karnataka Rajya Raitha Sangha, said, Not only is 4,000 an acre inadequate, the total outlay for this sop is less than 100 crore, which evidently shows not all farmers will get this relief as well.(With inputs by K.V. Aditya Bharadwaj, G.T. Sathish, and Kumar Buradikatti)",Farmers left high and dry by lockdown in Karnataka,TOMATO
2021-05-29,https://indianexpress.com/article/world/us-blocks-seafood-from-chinese-fleet-over-crew-mistreatment-7335464/,"Both the State Department and Labor Department have also documented abusive conditions in the Chinese fishing industry, where mostly foreign crews often work 18 to 22 hours per day under abysmal conditions. (Representational image/Reuters)The US government blocked imports of seafood Friday from the entire fleet of a Chinese company that authorities say forced crew members to work in slave-like conditions that led to the deaths of several Indonesian fishermen last year.Customs and Border Protection said it will place an immediate hold on any imports linked to the more than 30 vessels operated by Dalian Ocean Fishing, under a US law that bars goods suspected to have been produced with forced labor.Imports from Dalian, which primarily fishes for tuna, have exceeded USD 20 million as recently as 2018. Shipments linked to the company have dropped over the past year to about USD 200,000, officials said.We will not tolerate any amount derived from forced labor, Homeland Security Secretary Alejandro Mayorkas told reporters as he announced the measure.Also Read | Joe Biden banks on $3.6 trillion tax hike on the rich and corporationsCBP issued what is known as a withhold release order that halts shipments that have suspected links to forced labor, under a law that has been on the books for decades, ostensibly to protect US producers from unfair competition.The law has been used with increased frequency in recent years, given the growing awareness of the prevalence of what is essentially modern-day slavery in a range of industries, with workers forced to work long hours for low pay, or none at all, and subjected to violence.CBP found that Dalians operations, across the fleet, met all 11 criteria for forced labor laid out by the International Labor Organization, including the holding back of wages, inhumane conditions and physical intimidation, said John Leonard, the acting executive assistant commissioner of the agencys Office of Trade. This was a rather egregious example, Leonard said.Both the State Department and Labor Department have also documented abusive conditions in the Chinese fishing industry, where mostly foreign crews often work 18 to 22 hours per day under abysmal conditions.US authorities have used the Tariff Act of 1930 to halt imports from specific companies, individual fishing vessels and all cotton and tomato products from the Xinjiang region of China, where the Chinese government is waging a brutal assimilation campaign against Uyghurs and other predominantly Muslim ethnic groups.The announcement Friday marks the first time that the US has sought to block imports from a companys entire fishing fleet, a sign that the CBPs investigation found evidence of widespread abuse on Dalian vessels around the world.Indonesias government in May 2020 accused the company of inhuman treatment of fishermen from that country, with dozens of men forced to work 18 hours a day for no pay or less than agreed upon.It said the conditions led to illnesses that killed at least three fishermen, whose bodies were cast overboard into the Pacific Ocean.Dalian did not immediately respond to a request for comment made through its website.The company has had recent financial troubles, but Leonard said it appears to be reorganizing and planning to resume operations. We need to be vigilant, he said.",US blocks seafood from Chinese fleet over alleged crew mistreatment,TOMATO
