PUBLISHEDDATE,ARTICLEURL,TEXT,ARTICLETITLE,COMMODITY
2021-03-29,https://www.newindianexpress.com/lifestyle/food/2021/mar/29/flavours-from-aflower-2282842.html,"By Express News ServiceCHENNAI: Flower with pink-coloured petals sitting amid a waxy green leaf, floating away in the pond as the sun shines on it the lotus is a beautiful picture in itself. But, there is more to the flower than symmettery a spiritual significance, symbol of purity and a host of healing properties it contains. The seed (makhana) and the root (kamal kakdi) of the lotus plant, cultivated in most parts of the world, are edible.Known for its crunchy texture, water chestnut-like flavour with a slightly sweet taste, the lotus root (also called as lotus stem) can be eaten raw, stir-fried, braised or sauted. The oval-shaped seeds are puffy in texture and a diabetic-friendly snack option.They are staples in north India, especially Kashmir. But, that does not mean that the dwellers of south India have to miss out on its goodness! From cutlets to curries, Vaishali Vijaykumar brings you eight delectable recipes from five home chefs.Lotus root kuzhambu by Mullai MadavanIngredientsLotus root: 10, slicedOnion: 1 cup, finely-choppedTomato: 1/2 cup, choppedGarlic: 3 cloves, crushedGreen chilli: one, slitTurmeric powder: 1/4 tspRed chilli powder: 1 tspCoriander powder: 1 tbspSugar or jaggery: 1/4 tspMustard: 1/2 tspCumin: 1/2 tspCurry leaves: 6 leavesTamarind extract: 1/4 cupAsafoetida: 1/4 tspSalt: 112 tsp, Oil: 2 tbsp,Water: 1 cupCoriander leaves: 2 tspAny vegetable or seafood (optional): 1 cupMethodBoil lotus root over stove top in a pot of water for 20 to 25 minutes over medium flame.Heat oil in a saucepan and splutter mustard, cumin and curry leaves.Sprinkle asafoetida powder and add chopped onions, green chilli and crushed fresh garlic.Fry for five minutes over medium flame or until translucent.Add chopped tomatoes, along with chopped lotus root.Saut for a couple of minutes in the onion-tomato mixture.Add water and turmeric powder. Bring this to a boil, then cover and cook over low flame for 20 minutes or until the roots turn tender. (A knife inserted should pass through the root easily).Once it cooks, add red chilli powder, coriander powder, sugar, tamarind extract and salt.Cook this gravy base for 5 to 6 minutes and simmer for 10 or until the oil separates on top.Garnish with coriander and curry leaves. Turn it off.Serve lotus root kuzhambu over piping hot rice.Hariyali lotus root by Roshni KishoreIngredientsLotus root: 1Coriander leaves: 1 bunchFennel seeds: 1 tspCumin: 1 tspGinger-garlic paste: 1 tspGreen chillies: 4Salt to tasteLime juice: 1 tbspCoriander powder: 1/2 tspRed chilli powder: 1/2 tspChaat masala: 1/2 tspMethodPeel the skin of the lotus root, wash and cut into thin slices.Boil in a pressure cooker with one cup of water.Prepare the hariyali chutney with the rest of the ingredients.Marinate the lotus stem with this masala for 10 minutes.Heat ghee in a pan.Add the lotus stem and hariyali chutney for a few minutes till it is dry and cooked.Serve hot as a snack.You can also have it with tandoori roti.Phool Makhana Poori by Dr Sarawathy ViswanathanIngredientsWheat flour: 2 cupsMakhana flour: 1 cupSalt to tasteOil for deep fryingMethodDry-roast makhana and grind it to a fine powder.Mix wheat flour, makhana powder, salt and two tbsp of oil. Add water slowly and knead to a stiff dough.Cover the dough and keep it aside for 10 to 15 minutes.Divide into equal portions.Take a ball, roll it on an oiled surface till thin.Drop rolled poori in oil. Press on top till puffy, flip over and cook.Serve with potato masala or your favourite curry.Lotus root and peas curry by Geeta PalIngredientsLotus root: 250 g, peeled and dicedOnion: 1, finely-choppedTomatoes: 2Ginger and garlic paste: 1 tbspGreen peas (frozen or boiled): 1/2 cupCumin seeds: 1 tspGreen chilli: 2 to 3, choppedSalt to tasteTurmeric powder: 1 tspRed chilli powder: 2 tspCoriander powder: 1 tspKasuri methi: 1 tspGaram masala: 1/2 tspDesi ghee: 1 tbspFresh cream: 1 tbsp (for topping)MethodIn a pressure cooker, heat ghee and add cumin seeds. Once the colour changes, add ginger, garlic, chopped chillies and onions. Saut until onions turn golden brown.Meanwhile, prepare the tomato puree by boiling and blending them.Once the onions are sauted to golden brown, add all the spice powders except garam masala. Fry for a few seconds and, then, add tomato puree.Let the puree cook until you see oil floating on the top. This is the time to add in diced lotus stem and green peas.Cook them in the masala for 3-4 minutes. Add little water (ensure it doesnt become like gravy) and close the lid.Let them cook for around 2 to 3 whistles on slow flame. Ensure it is properly cooked but does not become lumpy.Open the pressure cooker once all the pressure has released. The sabzi should be semi-dry.Garnish with kasuri methi and garam masala. Serve hot with a dollop of fresh cream.Lotus root cutlets by Geeta PalIngredientsLotus root: 1 cup, peeled, diced and boiledGreen peas: 12 cupBoiled potato: 1 mediumGreen chillies: 2 to 3Onion: 2 tbsp,finely-choppedGram flour: 1/8 cupCorn flour: 1/8 cupCoriander leaves: 2 tbsp,finely-choppedBlack pepper powder: 1 tspCumin: 1 tspRed chilli powder: 1/2-3/4 teaspoonSalt to tasteOil: 2 tbspMethodIf you are using fresh lotus root then peel, wash and dice the stem. Boil them until soft and tender.If you are using frozen then thaw the stems. Coarse-grind them and set them aside.Wash green peas. Parboil and grind into a coarse paste.In a food processor or mixer toss all the ingredients (except potato and oil).Pulse the ingredients a couple of times until it looks like a mixture.Add mashed potato and adjust seasonings.Check dough consistency and add gram flour and corn flour accordingly to ensure forming a smooth ball.Shape it like cutlets.Heat oil in a pan.Cook the cutlets until crispy and evenly brown.Serve them hot with pudina chutney and saunth.Crispy chilli lotus root by ShikhaIngredientsFor the crispy lotus rootCleaned lotus root: 200 gCorn flour/ starch: 3 tbspVegetable oil for fryingSalt and white pepper to tasteFor the chilli sauceVegetable oil: 1 tbspGinger, garlic: 1 tbsp eachGreen chillies: 1 tbspCelery: 1 tbsp, finely-choppedSpring onion:  cupOnion: 1 small, finely-choppedGreen capsicum:  cupLight and dark soy sauce, Sriracha sauce: 1 tbsp eachTomato ketchup: 1 tspSpring onion greens: 2 tbspCorn flour slurry: 1 tbspKashmiri red chilli powder:1 tspRice vinegar:  tspWhite pepper:  tspSalt to tasteFor garnishFresh spring onion greens and sesame seedsMethodPeel the skin of the lotus root. Slice it diagonally into 0.5 cm thick slices and set it aside.In a pan, add oil. Saut ginger, garlic, green chillies, celery, spring onion whites and onions until fragrant. Add green capsicum. Cook until the vegetables start to wilt.Add light and dark soy sauce, sriracha sauce and ketchup. Saut for another minute.Add spring onion greens and season with salt and pepper.Add the prepared cornflour slurry and rice vinegar. Cook until the mixture thickens.Finish the sauce by adding Kashmiri red chilli powder.To the sliced lotus root, add three tablespoons of corn flour and season with salt and pepper. Mix to coat all the slices in corn flour.Deep fry until golden brown. Once cooked, strain on tissue paper to remove excess oil.Add the fried lotus root to the chilli sauce. Mix till it is coated with chilli sauce.Garnish with sesame seeds and sliced spring onion greens, and serve hot.Red Velvet Phool Makhana Payasam by Dr Saraswathy ViswanathanIngredientsPhool makhana (puffed lotus seeds): 1 cupMilk: 2 cupsSugar: 1/4 cupCondensed milk: 2 tbspCashew nuts: 1/4 cupVanilla essence: 1 tspRed colouring agent: a few dropsCocoa powder: 1 tbspGhee: 1/2 tspFew fried cashews for garnishingMethodHeat a pan, pour ghee and roast makhana for two minutes.Dry roast the cashews in the same pan and keep aside.Crush half cup roasted makhana roughly with your hands. It will be crisp, so it is easy to crush.Powder the remaining half of makhana with the roasted cashews finely.Boil milk. Add makhana and sugar.Add cocoa powder and red colour and mix well. Allow boiling for a few minutes.Add the cashew makhana powder and mix well. Payasam will thicken.Add condensed milk and vanilla essence at this stage and mix well.Bring to boil for a few more seconds and switch off the flame.Garnish with fried cashews and serve.Lotus root dosa by Roshni KishoreIngredientsLotus root: 1Green chillies: 2SaltChaat masala: 1 tspRed chilli powder: 1 tspGram flour (besan): 1 cupCoriander leaves: a handful, choppedMint leaves: a few choppedGaram masala: 1 tspMethodPeel the skin of the lotus root, wash and cut into thin slices.Boil in a pressure cooker with one cup of water.Grate it and mash it.To this add the dry ingredients. Add water as per dosa consistency.Heat a tawa. Pour olive oil. Pour one ladleful of the batter.Let it cook (on medium flame) and turn to another side.Apply oil or ghee.Serve hot with hariyali chutney.Flower PowerDhanalakshmi R, dietician, Rainbow Childrens Hospital, throws light on the benefits of lotus stem and seeds.Blood circulationIt gives you an energy boost as it regulates blood circulation. Proper circulation means all organs of the body are properly oxygenated. Lotus root is rich in copper and iron and stimulates the formation of red blood cells.Regulates BPPotassium, which is a vasodilator, helps maintain the fluids in our body and even counteracts the effects of sodium. Potassium also helps to keep the blood vessels relaxed and increases blood flow by reducing the rigidity and contraction of blood vessels. This reduces the pressure on the cardiovascular system.Aids digestionLotus root has a good amount of dietary fibre and it adds bulk to the stool facilitating easy expulsion from the body. The rich fibre content also helps to release the gastric juices which help to break down food and absorb the nutrients.Immunity boosterLotus root is rich in vitamin C, a powerful antioxidant. It acts against the free radicals in our body and thus protects us from various diseases like heart disease and cancer.Mental healthLotus root contains vitamin B complex and the pyridoxine in it regulates your mood and mental health by interacting with the neural receptors of the brain.Healthy heartPotassium and dietary fibre help remove cholesterol from our blood. Pyridoxine controls the homocysteine levels in the blood and helps to keep our hearts healthy.Breathe easyIt helps remove accumulated mucus and provides relief from cough. Lotus root juice also helps to treat illnesses like tuberculosis and asthma.",Flavours from a flower,TOMATO
2021-03-30,https://www.thehindu.com/life-and-style/food/miss-margarita-delivers-mexican-food-in-delhi/article34198085.ece,"Mexican food has a number of ingredients Indians love, and Miss Margarita in South Delhi taps into thisI like the word salsa, and all that it denotes, from dance and music to food. That explains, to an extent, why Mexican food appeals to me. It is, after all, a glorious mix of fluid and tonal flavours.It is also the cuisine that a talented young chef called Noah Barnes has been focusing on. Id had some delicious Mexican food at his restaurant Arriba some years ago, and still remember the taste of the habanero-smoked pork skewers, flavoured with honey and served with a hot chilli sauce.The chef now runs a new restaurant called Miss Margarita (Ph no 8920331591; M block market, GK 2), which specialises in Mexican food. Chef Barnes, who learnt the nuances of Mexican cooking from the former ambassador of Mexico in India, and a visiting master chef at the embassy, prepares various kinds of tortillas, quesadillas, tacos and more.Mexican food has a spicy edge that appeals to the Indian palate. Some of the flavours  such as cilantro  are used in both cuisines. We love our tomatoes and onions; so do they. A lot of what we eat  think corn on the cob or peanuts  came to our shores from distant Mexico.I love all their open and closed wraps. The tacos that he prepares, with different toppings are superb. His Street-styled grilled chicken and chilli bean taco (475) consisted of grilled chicken strips, a sweet paprika drizzle, refried beans, rocket, and smoked tomato salsa, topped with fresh tomato and onions.The dish I really loved was the diablo prawn (725). With a pressed tomato and coriander drizzle, it had a tamarind and habanero glaze and came with burnt garlic and lime. The prawns were first grilled and then tossed in the sauce. The tart flavours of the tamarind went well with the sharpness of the chillies. The prawn  soft inside and crunchy outside  had soaked in the flavours.The cheesy jalapeno chicken chipotle quesadilla (625) was just that  hot with a sharp taste of cheese, while the charred sweet potato and crispy cauliflower taco (395) was a spinach tortilla, also topped with a hot sauce. The problem with the latter was that I didnt really get the taste of cauliflower or the sweet potato, as it had been overwhelmed by the sauce.The pork carnitas tacos, however, were superb. Soft pork belly had been topped with a potato, pineapple and jalapeno salsa, smoked tomato salsa and refried beans (575). The chicken enchilada, the chef said, was a dish of chargrilled chicken, mixed with peppers and cheese, rolled in tortilla bread and topped with home-made fermented hot sauces, baked with cheese.Churros with chocolate and chilli chocolate sauce at Miss Margarita in Delhi | Photo Credit: Special arrangementChef Barnes takes pride in his Fresh Guacamole Bar, where guacamole is prepared at the table with avocado, tomatoes, jalapeno, onion, coriander and lime, and served with chips. There is a smoked chicken guacamole, too.There is a lot else on the menu: blackened Cajun fish taco (475), gondhoraj flavoured lime shrimp fajita (975) and a chicken casserole consisting of crispy, skinned chicken and spiced pilaf (775).I ended the meal with my favourite churros, eaten with chocolate and chilli chocolate sauce (425). It is a simple dish  fried dough dusted with sugar and cinnamon, but it is the sauce that gives it its singular taste. I dipped the churros in the chilli chocolate sauce and thought that was a blend worth a salsa.The writer is a seasoned food critic",Do a salsa and more at Miss Margarita in South Delhi,TOMATO
2021-04-04,https://www.thehindu.com/news/cities/Coimbatore/no-cakewalk-for-aiadmk-in-palacodde-this-time/article34234547.ece,"Palacodde is predominantly into farming, with sugarcane and tomato being the primary crops alongside paddy, coconuts, and flowers. With a farm-based economy, the process-side lags and the lack of affiliated agro-based industries are the main concerns for the cultivators here. A cold storage facility for tomatoes remains to see fruition here.The constituency is also drought prone. Poor rainfall and the resultant drought axed cane production that Palacodde Sugar Cooperative Mill did not take up crushing this year for want of cane.Palacodde has long demanded irrigation schemes linking from Ennekolputhur (Krishnagiri) to Thumballahalli dam; Aliyaalam dam to Tulchetti lake; and Jathalavau channel extension to Pullikarai  to tackle the drought. Ennekolputur project was hastily hatched up in an election year and notification was issued only recently.Minister for Higher Education K.P. Anbalagan has had winning streak, holding the constituency for four straight terms since 2001. If anti-incumbency is a challenge, his run is equally dogged by the drought of Palacodde and the inability to deliver the promised irrigation schemes.The drought is seen as a result of the AIADMK governments failure to implement the irrigation schemes and the Minister is seen as the face of that failure, since the irrigation schemes were part of his poll promise in 2016. Kongu Vellalar community that is second only to the Vanniyars in population in the constituency has been hit hard by the drought as land holders.In addition, there is resentment of under-representation amid Kongu Vellalars for not receiving candidature even in the neighbouring constituency of Paapireddypatti, where they are a sizeable population. The blame for it has been laid on Mr. Anbalagan, who is said to have pushed for Vanniyar candidate in all, but one reserved constituency.The vote bank is led by Vanniyars by over a lakh population (48.30%), followed by Kongu Vellalars (15.50%), Adidravidars (13.80%), Muslims (4.80%), Chettiars (5.20%) and others.The AIADMK has relied on the Vanniyar votes of the AIADMK and the PMK. But, the communitys votes are split with the DMK too. In addition, there is also degree of distrust amid the PMK supporters over the defeat of their leader Anbumani Ramadoss in the Lok Sabha elections, allegedly caused by the lackadaisical participation of the AIADMK.The DMK has fielded P.K. Murugan, an office-bearer in its lawyers wing for the second time after his loss in 2016. A Vellalar Gownder, Mr. Murugan is riding high on sympathy wave that he is well expected to garner the community votes in full. He is also expecting to garner the votes of the Muslims and the Adi Dravidars, with neither community expected to go with the AIADMK. An essentially two-cornered contest, Palacodde is no cakewalk for the high-profile incumbent.",No cakewalk for AIADMK in Palacodde this time,TOMATO
2021-04-07,https://indianexpress.com/article/india/piyush-goyal-reviews-modernisation-of-cwc-asks-it-to-increase-capacity-7262061/,"UNION MINISTER of Consumer Affairs, Food & Public Distribution Piyush Goyal has asked the Central Warehouse Corporation (CWC) to double its warehouse storage capacity by end of 2023 from 125 lakh metric tonnes (LMT) at present.Reviewing the modernisation plan of CWC on Tuesday, Goyal also asked the CWC to achieve a turnover of Rs 10,000 crore by the financial year 2024-25.According to a statement issued by the Ministry of Consumer Affairs, Food and Public Distribution, Goyal said that the tariff rationalisation and setting of warehouses should be done independently by CWC without any bureaucratic interference.The minister also instructed CWC to do a Safety Audit for fire, earthquakes, burglary and accidents in its all warehouses regularly.He said that the CWC should build modern silos for wheat and rice storage all over the country, so that maximum grains could be stored in the country for longer periods.Goyal asked the Corporation to build more cold chain facilities for storage Onion, Potato and Tomato in coordination with NAFED. He suggested that CWC should prepare a masterplan for the upgradation of all its 423 warehouses.He said that maximum powers of decision making for operations should be delegated to the CWC. He also asked CWC to focus on the building of cold chain storage in the country on a priority basis, the statement said.","Piyush Goyal reviews modernisation of CWC, asks it to increase capacity",TOMATO
2021-04-07,https://www.newindianexpress.com/cities/chennai/2021/apr/07/swayed-by-sweet-potato-2286703.html,"Kannalmozhi Kabilan ByExpress News ServiceCHENNAI: The humble sweet potato, in all its weird and wobbly innocuousness, often gets a poor rep. Especially when pitted against, rather unfairly, the universally loved potato. While madhura kizhangu puzhukku and sweet potato fries have persuaded many to switch camps, it doesnt exactly top the list of favourite vegetables for too many.But, maybe it should, given that theres plenty more to this unassuming tuberous root, says Yamini, clinical dietician, Kauvery Hospital. Theres a misconception that roots and tubers are not to be consumed in large quantities because of their starch content. But, when it comes to the nutritional value, the other components like micro-nutrients also have to be kept in mind.For this, sweet potato can be consumed, explains Yamini. There are two types of the sweet potato. The one which is available in India is the orange-pinkish one; the other one is purple and not commonly available here. But, both of them have the same properties and are very good for your health. It is antiinflammatory, reduces free radicals and boosts your immune, she details.Addresses anaemiaIt is very rich in ascorbic acid, fulfilling the vitamin C part. Its also a good source of iron. If cooked with jaggery, the nutritional anaemia can be treated.Potassium powerSweet potato is a rich source of potassium. This can help manage high blood pressure, its water retention properties can regulate muscle contractions and prevent kidney stones too.Starchy but goodEven though it is a starchy vegetable with a minimal amount of carbohydrates, it minimises the absorption of sugar in the body; thanks to its good fibre content both soluble and insoluble. So, even diabeticpatients can consume it once or twice a week if their sugar level is under control.Metabolism mattersThe high fibre content also helps in maintaining gut health. It enhances the growth of beneficial bacteria in your stomach; this way, it can help treat infective diarrhoea, irritable bowel syndrome and other digestive disorders. It helps in weight gain but portion size is the key and it has to be taken appropriately.Brain foodIt is a very good source of choline an essential nutrient that enhances the brain function.Vitamin storehouseSweet potato is also very rich in beta carotene, which is the precursor for vitamin A. This vitaminis very essential in all stages of life, playing a vital role in eye health.Rich in antioxidantsIt is filled with anthocyanins with antioxidant properties. Hence, it has to be included in everyday diet.ConsumptionA 100 grams of baked sweet potato offers 51 grams of carbohydrates, 4 grams of protein, 6 to 7 grams of fibre and very minimal fat. Otherwise, it is also rich in vitamin C and B6, magnesium, etc. The best way to consume sweet potato is to steam/bake it and have it with jaggery or slight seasoning. It can also be made as a regular south Indian curry or poriyal, with tomato and onions and spices.Sweet potato is not given much importance on the plate. But, you should try to include it regularly in your diet. In layman terms, it just looks like the pancreas the shape of the tuber. And Mother Nature has given it all these properties too. That depicts that it is very good for your vital organ, pancreas, she concludes.",Swayed by sweet potato,TOMATO
